Conference,Year,Filename,Title,Authors,Category,PDF_URL
NeurIPS,2024,mmlongbenchdoc_benchmarking_longcontext_document_understanding_with_visualizations__cf62637b.pdf,MMLONGBENCH-DOC: Benchmarking Long-context Document Understanding with Visualizations,"Yubo Ma, Yuhang Zang, Liangyu Chen, Meiqi Chen, Yizhu Jiao, Xinze Li, Xinyuan Lu, Ziyu Liu, Yan Ma, Xiaoyi Dong, Pan Zhang, Liangming Pan, Yu-Gang Jiang, Jiaqi Wang, Yixin Cao, Aixin Sun",datasets_and_benchmarks_track,https://proceedings.neurips.cc/paper_files/paper/2024/file/ae0e43289bffea0c1fa34633fc608e92-Paper-Datasets_and_Benchmarks_Track.pdf
NeurIPS,2024,imagenet3d_towards_generalpurpose_objectlevel_3d_understanding__a8d4306f.pdf,ImageNet3D: Towards General-Purpose Object-Level 3D Understanding,"Wufei Ma, Guofeng Zhang, Qihao Liu, Guanning Zeng, Adam Kortylewski, Yaoyao Liu, Alan L. Yuille",datasets_and_benchmarks_track,https://proceedings.neurips.cc/paper_files/paper/2024/file/ae51515c1cfecf544963a527260f94e9-Paper-Datasets_and_Benchmarks_Track.pdf
NeurIPS,2024,unlearncanvas_stylized_image_dataset_for_enhanced_machine_unlearning_evaluation_in_diffusion_models__17e7af50.pdf,UnlearnCanvas:  Stylized Image Dataset for Enhanced Machine Unlearning Evaluation in Diffusion Models,"Yihua Zhang, Chongyu Fan, Yimeng Zhang, Yuguang Yao, Jinghan Jia, Jiancheng Liu, Gaoyuan Zhang, Gaowen Liu, Ramana Kompella, Xiaoming Liu, Sijia Liu",datasets_and_benchmarks_track,https://proceedings.neurips.cc/paper_files/paper/2024/file/aebf4822d30c3f2600566af7eba83548-Paper-Datasets_and_Benchmarks_Track.pdf
NeurIPS,2024,biomedical_visual_instruction_tuning_with_clinician_preference_alignment__5f34a147.pdf,Biomedical Visual Instruction Tuning with Clinician Preference Alignment,"Hejie Cui, Lingjun Mao, Xin Liang, Jieyu Zhang, Hui Ren, Quanzheng Li, Xiang Li, Carl Yang",datasets_and_benchmarks_track,https://proceedings.neurips.cc/paper_files/paper/2024/file/aec33ab89b5986605cd7c331396e7e5c-Paper-Datasets_and_Benchmarks_Track.pdf
NeurIPS,2024,lucidaction_a_hierarchical_and_multimodel_dataset_for_comprehensive_action_quality_assessment__15ec35c9.pdf,LucidAction: A Hierarchical and Multi-model Dataset for Comprehensive Action Quality Assessment,"Linfeng Dong, Wei Wang, Yu Qiao, Xiao Sun",datasets_and_benchmarks_track,https://proceedings.neurips.cc/paper_files/paper/2024/file/aecf6978509d8b306f74c0d09508f9bc-Paper-Datasets_and_Benchmarks_Track.pdf
NeurIPS,2024,brain_treebank_largescale_intracranial_recordings_from_naturalistic_language_stimuli__e03e2a47.pdf,Brain Treebank: Large-scale intracranial recordings from naturalistic language stimuli,"Christopher Wang, Adam Yaari, Aaditya Singh, Vighnesh Subramaniam, Dana Rosenfarb, Jan DeWitt, Pranav Misra, Joseph Madsen, Scellig Stone, Gabriel Kreiman, Boris Katz, Ignacio Cases, Andrei Barbu",datasets_and_benchmarks_track,https://proceedings.neurips.cc/paper_files/paper/2024/file/aefa2385b3f33abf1526ae4e2c208cd9-Paper-Datasets_and_Benchmarks_Track.pdf
NeurIPS,2024,shdocs_a_dataset_benchmark_and_method_to_efficiently_generate_highquality_realworld_specular_highlight_data_with_nearperfect_alignment__4fe3e88b.pdf,"SHDocs: A dataset, benchmark, and method to efficiently generate high-quality, real-world specular highlight data with near-perfect alignment","Jovin Leong, Koa Di, Benjamin Cham, Shaun Heng",datasets_and_benchmarks_track,https://proceedings.neurips.cc/paper_files/paper/2024/file/af9199ef7d5ff267451a667170124c04-Paper-Datasets_and_Benchmarks_Track.pdf
NeurIPS,2024,neuralplane_an_efficiently_parallelizable_platform_for_fixedwing_aircraft_control_with_reinforcement_learning__8cd8c3f4.pdf,NeuralPlane: An Efficiently Parallelizable Platform for Fixed-wing Aircraft Control with Reinforcement Learning,"Chuanyi Xue, Qihan Liu, Xiaoteng Ma, Xinyao Qin, Gui Ning, Yang Qi, Jinsheng Ren, Bin Liang, Jun Yang",datasets_and_benchmarks_track,https://proceedings.neurips.cc/paper_files/paper/2024/file/af97b61e9fef8f55e32a2602af364d8c-Paper-Datasets_and_Benchmarks_Track.pdf
NeurIPS,2024,evaluating_language_models_as_risk_scores__aa545d36.pdf,Evaluating language models as risk scores,"André F. Cruz, Moritz Hardt, Celestine Mendler-Dünner",datasets_and_benchmarks_track,https://proceedings.neurips.cc/paper_files/paper/2024/file/b0a4b3e384b4554e65a47ad1f6b0310a-Paper-Datasets_and_Benchmarks_Track.pdf
NeurIPS,2024,classic_gnns_are_strong_baselines_reassessing_gnns_for_node_classification__c43db042.pdf,Classic GNNs are Strong Baselines: Reassessing GNNs for Node Classification,"Yuankai Luo, Lei Shi, Xiao-Ming Wu",datasets_and_benchmarks_track,https://proceedings.neurips.cc/paper_files/paper/2024/file/b10ed15ff1aa864f1be3a75f1ffc021b-Paper-Datasets_and_Benchmarks_Track.pdf
NeurIPS,2024,a_taxonomy_of_challenges_to_curating_fair_datasets__4e07b98f.pdf,A Taxonomy of Challenges to Curating Fair Datasets,"Dora Zhao, Morgan Scheuerman, Pooja Chitre, Jerone Andrews, Georgia Panagiotidou, Shawn Walker, Kathleen Pine, Alice Xiang",datasets_and_benchmarks_track,https://proceedings.neurips.cc/paper_files/paper/2024/file/b142e78db191e19b17e60c1425a28b52-Paper-Datasets_and_Benchmarks_Track.pdf
NeurIPS,2024,benchmarking_the_attribution_quality_of_vision_models__e42ec057.pdf,Benchmarking the Attribution Quality of Vision Models,"Robin Hesse, Simone Schaub-Meyer, Stefan Roth",datasets_and_benchmarks_track,https://proceedings.neurips.cc/paper_files/paper/2024/file/b17799e0bbbf65687f4e2df1f98aa225-Paper-Datasets_and_Benchmarks_Track.pdf
NeurIPS,2024,einsum_benchmark_enabling_the_development_of_nextgeneration_tensor_execution_engines__23a7ed1e.pdf,Einsum Benchmark: Enabling the Development of Next-Generation Tensor Execution Engines,"Mark Blacher, Christoph Staudt, Julien Klaus, Maurice Wenig, Niklas Merk, Alexander Breuer, Max Engel, Sören Laue, Joachim Giesen",datasets_and_benchmarks_track,https://proceedings.neurips.cc/paper_files/paper/2024/file/b1bbfdb9197bfc819a52c34dce493f85-Paper-Datasets_and_Benchmarks_Track.pdf
NeurIPS,2024,rwku_benchmarking_realworld_knowledge_unlearning_for_large_language_models__63424184.pdf,RWKU: Benchmarking Real-World Knowledge Unlearning for Large Language Models,"Zhuoran Jin, Pengfei Cao, Chenhao Wang, Zhitao He, Hongbang Yuan, Jiachun Li, Yubo Chen, Kang Liu, Jun Zhao",datasets_and_benchmarks_track,https://proceedings.neurips.cc/paper_files/paper/2024/file/b1f78dfc9ca0156498241012aec4efa0-Paper-Datasets_and_Benchmarks_Track.pdf
NeurIPS,2024,cure4rec_a_benchmark_for_recommendation_unlearning_with_deeper_influence__dd3e42a5.pdf,CURE4Rec: A Benchmark for Recommendation Unlearning with Deeper Influence,"Chaochao Chen, Jiaming Zhang, Yizhao Zhang, Li Zhang, Lingjuan Lyu, Yuyuan Li, Biao Gong, Chenggang Yan",datasets_and_benchmarks_track,https://proceedings.neurips.cc/paper_files/paper/2024/file/b364953e402d7d92e13830383677efb5-Paper-Datasets_and_Benchmarks_Track.pdf
NeurIPS,2024,personalsum_a_usersubjective_guided_personalized_summarization_dataset_for_large_language_models__66204419.pdf,PersonalSum: A User-Subjective Guided Personalized Summarization Dataset for Large Language Models,"Lemei Zhang, Peng Liu, Marcus Henriksboe, Even Lauvrak, Jon Atle Gulla, Heri Ramampiaro",datasets_and_benchmarks_track,https://proceedings.neurips.cc/paper_files/paper/2024/file/b3c318cd7ee132d8a6b1895a2d6436c7-Paper-Datasets_and_Benchmarks_Track.pdf
NeurIPS,2024,enhancing_visionlanguage_models_for_medical_imaging_bridging_the_3d_gap_with_innovative_slice_selection__62be8cd6.pdf,Enhancing vision-language models for medical imaging: bridging the 3D gap with innovative slice selection,"Yuli Wang, Peng jian, Yuwei Dai, Craig Jones, Haris Sair, Jinglai Shen, Nicolas Loizou, jing wu, Wen-Chi Hsu, Maliha Imami, Zhicheng Jiao, Paul Zhang, Harrison Bai",datasets_and_benchmarks_track,https://proceedings.neurips.cc/paper_files/paper/2024/file/b53513b83232116ae25f57a174a7c993-Paper-Datasets_and_Benchmarks_Track.pdf
NeurIPS,2024,harmonic_harnessing_llms_for_tabular_data_synthesis_and_privacy_protection__655a4eb4.pdf,HARMONIC: Harnessing LLMs for Tabular Data Synthesis and Privacy Protection,"Yuxin Wang, Duanyu Feng, Yongfu Dai, Zhengyu Chen, Jimin Huang, Sophia Ananiadou, Qianqian Xie, Hao Wang",datasets_and_benchmarks_track,https://proceedings.neurips.cc/paper_files/paper/2024/file/b5aebe9a48398525a9da27a1df827d60-Paper-Datasets_and_Benchmarks_Track.pdf
NeurIPS,2024,detectrl_benchmarking_llmgenerated_text_detection_in_realworld_scenarios__2c50722c.pdf,DetectRL: Benchmarking LLM-Generated Text Detection in Real-World Scenarios,"Junchao Wu, Runzhe Zhan, Derek Wong, Shu Yang, Xinyi Yang, Yulin Yuan, Lidia Chao",datasets_and_benchmarks_track,https://proceedings.neurips.cc/paper_files/paper/2024/file/b61bdf7e9f64c04ec75a26e781e2ad51-Paper-Datasets_and_Benchmarks_Track.pdf
NeurIPS,2024,embodied_agent_interface_benchmarking_llms_for_embodied_decision_making__9e7d3a46.pdf,Embodied Agent Interface: Benchmarking LLMs for Embodied Decision Making,"Manling Li, Shiyu Zhao, Qineng Wang, Kangrui Wang, Yu Zhou, Sanjana Srivastava, Cem Gokmen, Tony Lee, Erran Li Li, Ruohan Zhang, Weiyu Liu, Percy S. Liang, Fei-Fei Li, Jiayuan Mao, Jiajun Wu",datasets_and_benchmarks_track,https://proceedings.neurips.cc/paper_files/paper/2024/file/b631da756d1573c24c9ba9c702fde5a9-Paper-Datasets_and_Benchmarks_Track.pdf
NeurIPS,2024,sustaindc_benchmarking_for_sustainable_data_center_control__c3b18830.pdf,SustainDC: Benchmarking for Sustainable Data Center Control,"Avisek Naug, Antonio Guillen-Perez, Ricardo Luna Gutierrez, Vineet Gundecha, Cullen Bash, Sahand Ghorbanpour, Sajad Mousavi, Ashwin Ramesh Babu, Dejan Markovikj, Lekhapriya Dheeraj Kashyap, Desik Rengarajan, Soumyendu Sarkar",datasets_and_benchmarks_track,https://proceedings.neurips.cc/paper_files/paper/2024/file/b6676756f8a935e208f394a1ba47f0bc-Paper-Datasets_and_Benchmarks_Track.pdf
NeurIPS,2024,streaming_detection_of_queried_event_start__9b3b3837.pdf,Streaming Detection of Queried Event Start,"Cristobal Eyzaguirre, Eric Tang, Shyamal Buch, Adrien Gaidon, Jiajun Wu, Juan Carlos Niebles",datasets_and_benchmarks_track,https://proceedings.neurips.cc/paper_files/paper/2024/file/b689b90ddf2b47d3103decabe6d47446-Paper-Datasets_and_Benchmarks_Track.pdf
NeurIPS,2024,convbench_a_multiturn_conversation_evaluation_benchmark_with_hierarchical_ablation_capability_for_large_visionlanguage_models__fecf24eb.pdf,ConvBench: A Multi-Turn Conversation Evaluation Benchmark with Hierarchical Ablation Capability for Large Vision-Language Models,"Shuo Liu, Kaining Ying, Hao Zhang, yue yang, Yuqi Lin, Tianle Zhang, Chuanhao Li, Yu Qiao, Ping Luo, Wenqi Shao, Kaipeng Zhang",datasets_and_benchmarks_track,https://proceedings.neurips.cc/paper_files/paper/2024/file/b69396afc07a9ca3428d194f4db84c02-Paper-Datasets_and_Benchmarks_Track.pdf
NeurIPS,2024,fire_a_dataset_for_feedback_integration_and_refinement_evaluation_of_multimodal_models__a9b790b8.pdf,FIRE: A Dataset for Feedback Integration and Refinement Evaluation of Multimodal Models,"Pengxiang Li, Zhi Gao, Bofei Zhang, Tao Yuan, Yuwei Wu, Mehrtash Harandi, Yunde Jia, Song-Chun Zhu, Qing Li",datasets_and_benchmarks_track,https://proceedings.neurips.cc/paper_files/paper/2024/file/b83bea9688047be30f54034c55716854-Paper-Datasets_and_Benchmarks_Track.pdf
NeurIPS,2024,bivlc_extending_visionlanguage_compositionality_evaluation_with_texttoimage_retrieval__65034976.pdf,BiVLC: Extending Vision-Language Compositionality Evaluation with Text-to-Image Retrieval,"Imanol Miranda, Ander Salaberria, Eneko Agirre, Gorka Azkune",datasets_and_benchmarks_track,https://proceedings.neurips.cc/paper_files/paper/2024/file/b8b93c48f5bfa385d071342089d70422-Paper-Datasets_and_Benchmarks_Track.pdf
NeurIPS,2024,a_simulation_benchmark_for_autonomous_racing_with_largescale_human_data__b43b6a9a.pdf,A Simulation Benchmark for Autonomous Racing with Large-Scale Human Data,"Adrian Remonda, Nicklas Hansen, Ayoub Raji, Nicola Musiu, Marko Bertogna, Eduardo Veas, Xiaolong Wang",datasets_and_benchmarks_track,https://proceedings.neurips.cc/paper_files/paper/2024/file/b91ea2ba1b6521940e204b7b81d5ef47-Paper-Datasets_and_Benchmarks_Track.pdf
NeurIPS,2024,biotrove_a_large_curated_image_dataset_enabling_ai_for_biodiversity__8cae8964.pdf,BioTrove: A Large Curated Image Dataset Enabling AI for Biodiversity,"Chih-Hsuan Yang, Benjamin Feuer, Talukder ""Zaki"" Jubery, Zi Deng, Andre Nakkab, Md Zahid Hasan, Shivani Chiranjeevi, Kelly Marshall, Nirmal Baishnab, Asheesh Singh, ARTI SINGH, Soumik Sarkar, Nirav Merchant, Chinmay Hegde, Baskar Ganapathysubramanian",datasets_and_benchmarks_track,https://proceedings.neurips.cc/paper_files/paper/2024/file/b92854f80ba4feefb973959b259dbc2c-Paper-Datasets_and_Benchmarks_Track.pdf
NeurIPS,2024,apddv2_aesthetics_of_paintings_and_drawings_dataset_with_artist_labeled_scores_and_comments__f9f76b03.pdf,APDDv2:  Aesthetics of Paintings and Drawings Dataset with Artist Labeled Scores and Comments,"Xin Jin, Qianqian Qiao, Yi Lu, HuayeWang , Heng Huang, Shan Gao, Jianfei Liu, Rui Li",datasets_and_benchmarks_track,https://proceedings.neurips.cc/paper_files/paper/2024/file/baa66b34c11716bdff4854bbc8e667e4-Paper-Datasets_and_Benchmarks_Track.pdf
NeurIPS,2024,textttconflictbank_a_benchmark_for_evaluating_the_influence_of_knowledge_conflicts_in_llms__f397fe99.pdf,$\texttt{ConflictBank}$: A Benchmark for Evaluating the Influence of Knowledge Conflicts in LLMs,"Zhaochen Su, Jun Zhang, Xiaoye Qu, Tong Zhu, Yanshu Li, Jiashuo Sun, Juntao Li, Min Zhang, Yu Cheng",datasets_and_benchmarks_track,https://proceedings.neurips.cc/paper_files/paper/2024/file/baf4b960d118f838ad0b2c08247a9ebe-Paper-Datasets_and_Benchmarks_Track.pdf
NeurIPS,2024,infer_induced_sentiment_of_comment_response_to_video_a_new_task_dataset_and_baseline__6b16a3c2.pdf,"Infer Induced Sentiment of Comment Response to Video: A New Task, Dataset and Baseline","qi jia,  baoyu, Cong Xu, Lu Liu, Liang Jin, Guoguang Du, Zhenhua Guo, Yaqian Zhao, Xuanjing Huang, Rengang Li",datasets_and_benchmarks_track,https://proceedings.neurips.cc/paper_files/paper/2024/file/bbf090d264b94d29260f5303efea868c-Paper-Datasets_and_Benchmarks_Track.pdf
NeurIPS,2024,m3leo_a_multimodal_multilabel_earth_observation_dataset_integrating_interferometric_sar_and_multispectral_data__e87029eb.pdf,"M3LEO: A Multi-Modal, Multi-Label Earth Observation Dataset Integrating Interferometric SAR and Multispectral Data","Matthew Allen, Francisco Dorr, Joseph Alejandro Gallego Mejia, Laura Martínez-Ferrer, Anna Jungbluth, Freddie Kalaitzis, Raul Ramos-Pollán",datasets_and_benchmarks_track,https://proceedings.neurips.cc/paper_files/paper/2024/file/bd194b579f60879e04ca9ce8a4ea5da1-Paper-Datasets_and_Benchmarks_Track.pdf
NeurIPS,2024,novobench_benchmarking_deep_learningbased_emphde_novo_sequencing_methods_in_proteomics__cb3779d7.pdf,NovoBench: Benchmarking Deep Learning-based \emph{De Novo} Sequencing Methods in Proteomics,"Jingbo Zhou, Shaorong Chen, Jun Xia,  Sizhe Liu, Tianze Ling, Wenjie Du, Yue Liu, Jianwei Yin, Stan Z. Li",datasets_and_benchmarks_track,https://proceedings.neurips.cc/paper_files/paper/2024/file/bd281779e603522d92aa4f59c36012e4-Paper-Datasets_and_Benchmarks_Track.pdf
NeurIPS,2024,the_prism_alignment_dataset_what_participatory_representative_and_individualised_human_feedback_reveals_about_the_subjective_and_multicultural_alignment_of_large_language_models__d81edcad.pdf,"The PRISM Alignment Dataset: What Participatory, Representative and Individualised Human Feedback Reveals About the Subjective and Multicultural Alignment of Large Language Models","Hannah Rose Kirk, Alexander Whitefield, Paul Rottger, Andrew M. Bean, Katerina Margatina, Rafael Mosquera-Gomez, Juan Ciro, Max Bartolo, Adina Williams, He He, Bertie Vidgen, Scott Hale",datasets_and_benchmarks_track,https://proceedings.neurips.cc/paper_files/paper/2024/file/be2e1b68b44f2419e19f6c35a1b8cf35-Paper-Datasets_and_Benchmarks_Track.pdf
NeurIPS,2024,lean_workbook_a_largescale_lean_problem_set_formalized_from_natural_language_math_problems__b2d552f8.pdf,Lean Workbook: A large-scale Lean problem set formalized from natural language math problems,"Huaiyuan Ying, Zijian Wu, Yihan Geng, JIayu Wang, Dahua Lin, Kai Chen",datasets_and_benchmarks_track,https://proceedings.neurips.cc/paper_files/paper/2024/file/bf236666a2cc5f3ae05d2e08485efc4c-Paper-Datasets_and_Benchmarks_Track.pdf
NeurIPS,2024,realman_a_realrecorded_and_annotated_microphone_array_dataset_for_dynamic_speech_enhancement_and_localization__a983d702.pdf,RealMAN: A Real-Recorded and Annotated Microphone Array Dataset for Dynamic Speech Enhancement and Localization,"Bing Yang, Changsheng Quan, Yabo Wang, Pengyu Wang, Yujie Yang, Ying Fang, Nian Shao, Hui Bu, Xin Xu, Xiaofei Li",datasets_and_benchmarks_track,https://proceedings.neurips.cc/paper_files/paper/2024/file/bf8f6f5b017dc60d0c4e28a7a9a4ee7b-Paper-Datasets_and_Benchmarks_Track.pdf
NeurIPS,2024,redcode_risky_code_execution_and_generation_benchmark_for_code_agents__ca6286c1.pdf,RedCode: Risky Code Execution and Generation Benchmark for Code Agents,"Chengquan Guo, Xun Liu, Chulin Xie, Andy Zhou, Yi Zeng, Zinan Lin, Dawn Song, Bo Li",datasets_and_benchmarks_track,https://proceedings.neurips.cc/paper_files/paper/2024/file/bfd082c452dffb450d5a5202b0419205-Paper-Datasets_and_Benchmarks_Track.pdf
NeurIPS,2024,vocal_call_locator_benchmark_vcl_for_localizing_rodent_vocalizations_from_multichannel_audio__08d5508d.pdf,Vocal Call Locator Benchmark (VCL) for localizing rodent vocalizations from multi-channel audio,"Ralph Peterson, Aramis Tanelus, Christopher Ick, Bartul Mimica, Niegil Francis Muttath Joseph, Violet Ivan, Aman Choudhri, Annegret Falkner, Mala Murthy, David Schneider, Dan Sanes, Alex Williams",datasets_and_benchmarks_track,https://proceedings.neurips.cc/paper_files/paper/2024/file/c00d37d6b04d73b870b963a4d70051c1-Paper-Datasets_and_Benchmarks_Track.pdf
NeurIPS,2024,babilong_testing_the_limits_of_llms_with_long_context_reasoninginahaystack__574f38f7.pdf,BABILong: Testing the Limits of LLMs with Long Context Reasoning-in-a-Haystack,"Yury Kuratov, Aydar Bulatov, Petr Anokhin, Ivan Rodkin, Dmitry Sorokin, Artyom Sorokin, Mikhail Burtsev",datasets_and_benchmarks_track,https://proceedings.neurips.cc/paper_files/paper/2024/file/c0d62e70dbc659cc9bd44cbcf1cb652f-Paper-Datasets_and_Benchmarks_Track.pdf
NeurIPS,2024,egosim_an_egocentric_multiview_simulator_and_real_dataset_for_bodyworn_cameras_during_motion_and_activity__6bde0c91.pdf,EgoSim: An Egocentric Multi-view Simulator and Real Dataset for Body-worn Cameras during Motion and Activity,"Dominik Hollidt, Paul Streli, Jiaxi Jiang, Yasaman Haghighi, Changlin Qian, Xintong Liu, Christian Holz",datasets_and_benchmarks_track,https://proceedings.neurips.cc/paper_files/paper/2024/file/c1017d0a006d31dfbfd4cf1e9189d747-Paper-Datasets_and_Benchmarks_Track.pdf
NeurIPS,2024,networkgym_reinforcement_learning_environments_for_multiaccess_traffic_management_in_network_simulation__f451e25e.pdf,NetworkGym: Reinforcement Learning Environments for Multi-Access Traffic Management in Network Simulation,"Momin Haider, Ming Yin, Menglei Zhang, Arpit Gupta, Jing Zhu, Yu-Xiang Wang",datasets_and_benchmarks_track,https://proceedings.neurips.cc/paper_files/paper/2024/file/c112271dab20d38b43a1c0669f86b4f6-Paper-Datasets_and_Benchmarks_Track.pdf
NeurIPS,2024,ss3dm_benchmarking_streetview_surface_reconstruction_with_a_synthetic_3d_mesh_dataset__117a6385.pdf,SS3DM: Benchmarking Street-View Surface Reconstruction with a Synthetic 3D Mesh Dataset,"Yubin Hu, Kairui Wen, Heng Zhou, Xiaoyang Guo, Yong-jin Liu",datasets_and_benchmarks_track,https://proceedings.neurips.cc/paper_files/paper/2024/file/c11767cd469b8d8bd7f168e61b3cc8bc-Paper-Datasets_and_Benchmarks_Track.pdf
NeurIPS,2024,streambench_towards_benchmarking_continuous_improvement_of_language_agents__f4c5a445.pdf,StreamBench: Towards Benchmarking Continuous Improvement of Language Agents,"Cheng-Kuang Wu, Zhi Rui Tam, Chieh-Yen Lin, Yun-Nung (Vivian) Chen, Hung-yi Lee",datasets_and_benchmarks_track,https://proceedings.neurips.cc/paper_files/paper/2024/file/c189915371c4474fe9789be3728113fc-Paper-Datasets_and_Benchmarks_Track.pdf
NeurIPS,2024,harmony4d_a_video_dataset_for_inthewild_close_human_interactions__8344f4e5.pdf,Harmony4D: A Video Dataset for In-The-Wild Close Human Interactions,"Rawal Khirodkar, Jyun-Ting Song, Jinkun Cao, Zhengyi Luo, Kris Kitani",datasets_and_benchmarks_track,https://proceedings.neurips.cc/paper_files/paper/2024/file/c20b843d0c6b1b40a8e6eb9a44e719c9-Paper-Datasets_and_Benchmarks_Track.pdf
NeurIPS,2024,spider2v_how_far_are_multimodal_agents_from_automating_data_science_and_engineering_workflows__23b8cb09.pdf,Spider2-V: How Far Are Multimodal Agents From Automating Data Science and Engineering Workflows?,"Ruisheng Cao, Fangyu Lei, Haoyuan Wu, Jixuan Chen, Yeqiao Fu, Hongcheng Gao, Xinzhuang Xiong, Hanchong Zhang, Wenjing Hu, Yuchen Mao, Tianbao Xie, Hongshen Xu, Danyang Zhang, Sida Wang, Ruoxi Sun, Pengcheng Yin, Caiming Xiong, Ansong Ni, Qian Liu, Victor Zhong, Lu Chen, Kai Yu, Tao Yu",datasets_and_benchmarks_track,https://proceedings.neurips.cc/paper_files/paper/2024/file/c2f71567cd53464161cab3336e8fc865-Paper-Datasets_and_Benchmarks_Track.pdf
NeurIPS,2024,consent_in_crisis_the_rapid_decline_of_the_ai_data_commons__3d280181.pdf,Consent in Crisis: The Rapid Decline of the AI Data Commons,"Shayne Longpre, Robert Mahari, Ariel Lee, Campbell Lund, Hamidah Oderinwale, William Brannon, Nayan Saxena, Naana Obeng-Marnu, Tobin South, Cole Hunter, Kevin Klyman, Christopher Klamm, Hailey Schoelkopf, Nikhil Singh, Manuel Cherep, Ahmad Anis, An Dinh, Caroline Shamiso Chitongo, Da Yin, Damien Sileo, Deividas Mataciunas, Diganta Misra, Emad Alghamdi, Enrico Shippole, Jianguo Zhang, Joanna Materzynska, Kun Qian, Kushagra Tiwary, Lester James V. Miranda, Manan Dey, Minnie Liang, Mohammed Hamdy, Niklas Muennighoff, Seonghyeon Ye, Seungone Kim, Shrestha Mohanty, Vipul Gupta, Vivek Sharma, Minh Chien Vu, Xuhui Zhou, Yizhi Li, Caiming Xiong, Luis Villa, Stella Biderman, Hanlin Li, Daphne Ippolito, Sara Hooker, Jad Kabbara, Alex Pentland",datasets_and_benchmarks_track,https://proceedings.neurips.cc/paper_files/paper/2024/file/c3738949a80306cc48a8ea8ba0560f9d-Paper-Datasets_and_Benchmarks_Track.pdf
NeurIPS,2024,image_textualization_an_automatic_framework_for_generating_rich_and_detailed_image_descriptions__626cf723.pdf,Image Textualization: An Automatic Framework for Generating Rich and Detailed Image Descriptions,"Renjie Pi, Jianshu Zhang, Jipeng Zhang, Rui Pan, Zhekai Chen, Tong Zhang",datasets_and_benchmarks_track,https://proceedings.neurips.cc/paper_files/paper/2024/file/c37d94c04effc86d72ab2258ba9b76c7-Paper-Datasets_and_Benchmarks_Track.pdf
NeurIPS,2024,the_elephant_in_the_room_towards_a_reliable_timeseries_anomaly_detection_benchmark__24bc88de.pdf,The Elephant in the Room: Towards A Reliable Time-Series Anomaly Detection Benchmark,"Qinghua Liu, John Paparrizos",datasets_and_benchmarks_track,https://proceedings.neurips.cc/paper_files/paper/2024/file/c3f3c690b7a99fba16d0efd35cb83b2c-Paper-Datasets_and_Benchmarks_Track.pdf
NeurIPS,2024,marple_a_benchmark_for_longhorizon_inference__43990d34.pdf,MARPLE: A Benchmark for Long-Horizon Inference,"Emily Jin, Zhuoyi Huang, Jan-Philipp Fraenken, Weiyu Liu, Hannah Cha, Erik Brockbank, Sarah Wu, Ruohan Zhang, Jiajun Wu, Tobias Gerstenberg",datasets_and_benchmarks_track,https://proceedings.neurips.cc/paper_files/paper/2024/file/c4c6b9642f3d1c2bf036bb9575f7b5bf-Paper-Datasets_and_Benchmarks_Track.pdf
NeurIPS,2024,learning_superconductivity_from_ordered_and_disordered_material_structures__1c5d9df2.pdf,Learning Superconductivity from Ordered and Disordered Material Structures,"Pin Chen, Luoxuan Peng, Rui Jiao, Qing Mo, Zhen Wang, Wenbing Huang, Yang Liu, Yutong Lu",datasets_and_benchmarks_track,https://proceedings.neurips.cc/paper_files/paper/2024/file/c4e3b55ed4ac9ba52d7df11f8bddbbf4-Paper-Datasets_and_Benchmarks_Track.pdf
NeurIPS,2024,wikicontradict_a_benchmark_for_evaluating_llms_on_realworld_knowledge_conflicts_from_wikipedia__f6aec5e9.pdf,WikiContradict: A Benchmark for Evaluating LLMs on Real-World Knowledge Conflicts from Wikipedia,"Yufang Hou, Alessandra Pascale, Javier Carnerero-Cano, Tigran Tchrakian, Radu Marinescu, Elizabeth Daly, Inkit Padhi, Prasanna Sattigeri",datasets_and_benchmarks_track,https://proceedings.neurips.cc/paper_files/paper/2024/file/c63819755591ea972f8570beffca6b1b-Paper-Datasets_and_Benchmarks_Track.pdf
NeurIPS,2024,massspecgym_a_benchmark_for_the_discovery_and_identification_of_molecules__b6656e29.pdf,MassSpecGym: A benchmark for the discovery and identification of molecules,"Roman Bushuiev, Anton Bushuiev, Niek de Jonge, Adamo Young, Fleming Kretschmer, Raman Samusevich, Janne Heirman, Fei Wang, Luke Zhang, Kai Dührkop, Marcus Ludwig, Nils Haupt, Apurva Kalia, Corinna Brungs, Robin Schmid, Russell Greiner, Bo Wang, David Wishart, Liping Liu, Juho Rousu, Wout Bittremieux, Hannes Rost, Tytus Mak, Soha Hassoun, Florian Huber, Justin J.J. van der Hooft, Michael Stravs, Sebastian Böcker, Josef Sivic, Tomáš Pluskal",datasets_and_benchmarks_track,https://proceedings.neurips.cc/paper_files/paper/2024/file/c6c31413d5c53b7d1c343c1498734b0f-Paper-Datasets_and_Benchmarks_Track.pdf
NeurIPS,2024,bias_and_volatility_a_statistical_framework_for_evaluating_large_language_models_stereotypes_and_the_associated_generation_inconsistency__1c0797f5.pdf,Bias and Volatility: A Statistical Framework for Evaluating Large Language Model's Stereotypes and the Associated Generation Inconsistency,"Yiran Liu, Ke Yang, Zehan Qi, Xiao Liu, Yang Yu, Cheng Xiang  Zhai",datasets_and_benchmarks_track,https://proceedings.neurips.cc/paper_files/paper/2024/file/c6ec4a25a11393f277cfd64b7ea4d106-Paper-Datasets_and_Benchmarks_Track.pdf
