Conference,Year,Filename,Title,Authors,Category,PDF_URL
NeurIPS,2024,drivaernet_a_largescale_multimodal_car_dataset_with_computational_fluid_dynamics_simulations_and_deep_learning_benchmarks__1f5bb2f1.pdf,DrivAerNet++: A Large-Scale Multimodal Car Dataset with Computational Fluid Dynamics Simulations and Deep Learning Benchmarks,"Mohamed Elrefaie, Florin Morar, Angela Dai, Faez Ahmed",datasets_and_benchmarks_track,https://proceedings.neurips.cc/paper_files/paper/2024/file/013cf29a9e68e4411d0593040a8a1eb3-Paper-Datasets_and_Benchmarks_Track.pdf
NeurIPS,2024,bench2drive_towards_multiability_benchmarking_of_closedloop_endtoend_autonomous_driving__7791cb1e.pdf,Bench2Drive: Towards Multi-Ability Benchmarking of Closed-Loop End-To-End Autonomous Driving,"Xiaosong Jia, Zhenjie Yang, Qifeng Li, Zhiyuan Zhang, Junchi Yan",datasets_and_benchmarks_track,https://proceedings.neurips.cc/paper_files/paper/2024/file/017761f94a1cd66d01c041aff85492c4-Paper-Datasets_and_Benchmarks_Track.pdf
NeurIPS,2024,fedmeki_a_benchmark_for_scaling_medical_foundation_models_via_federated_knowledge_injection__638f20fe.pdf,FEDMEKI: A Benchmark for Scaling Medical Foundation Models via Federated Knowledge Injection,"Jiaqi Wang, Xiaochen Wang, Lingjuan Lyu, Jinghui Chen, Fenglong Ma",datasets_and_benchmarks_track,https://proceedings.neurips.cc/paper_files/paper/2024/file/0235cbb8cd6425d0b55daefce388fc0b-Paper-Datasets_and_Benchmarks_Track.pdf
NeurIPS,2024,gtsinger_a_global_multitechnique_singing_corpus_with_realistic_music_scores_for_all_singing_tasks__7f5b4550.pdf,GTSinger: A Global Multi-Technique Singing Corpus with Realistic Music Scores for All Singing Tasks,"Yu Zhang, Changhao Pan, Wenxiang Guo, Ruiqi Li, Zhiyuan Zhu, Jialei Wang, Wenhao Xu, Jingyu Lu, Zhiqing Hong, Chuxin Wang, Lichao Zhang, Jinzheng He, Ziyue Jiang, Yuxin Chen, Chen Yang, Jiecheng Zhou, Xinyu Cheng, Zhou Zhao",datasets_and_benchmarks_track,https://proceedings.neurips.cc/paper_files/paper/2024/file/023d2c1a17cf35b11a0cbb43a0677c91-Paper-Datasets_and_Benchmarks_Track.pdf
NeurIPS,2024,sim2realfire_a_multimodal_simulation_dataset_for_forecast_and_backtracking_of_realworld_forest_fire__8c30facf.pdf,Sim2Real-Fire: A Multi-modal Simulation Dataset for Forecast and Backtracking of Real-world Forest Fire,"Yanzhi Li, Keqiu Li, LI GUOHUI, zumin wang, Chanqing Ji, Lubo Wang, Die Zuo, Qing Guo, Feng Zhang, Manyu Wang, Di Lin",datasets_and_benchmarks_track,https://proceedings.neurips.cc/paper_files/paper/2024/file/02e978a2cc9a1d0d4376a7deb01db612-Paper-Datasets_and_Benchmarks_Track.pdf
NeurIPS,2024,sciinstruct_a_selfreflective_instruction_annotated_dataset_for_training_scientific_language_models__d922c24d.pdf,SciInstruct: a Self-Reflective Instruction Annotated Dataset for Training Scientific Language Models,"Dan Zhang, Ziniu Hu, Sining Zhoubian, Zhengxiao Du, Kaiyu Yang, Zihan Wang, Yisong Yue, Yuxiao Dong, Jie Tang",datasets_and_benchmarks_track,https://proceedings.neurips.cc/paper_files/paper/2024/file/02ee6b7295f720407b56c457b34c54d5-Paper-Datasets_and_Benchmarks_Track.pdf
NeurIPS,2024,helpsteer_2_opensource_dataset_for_training_topperforming_reward_models__0272f2c2.pdf,HelpSteer 2: Open-source dataset for training top-performing reward models,"Zhilin Wang, Yi Dong, Olivier Delalleau, Jiaqi Zeng, Gerald Shen, Daniel Egert, Jimmy Zhang, Makesh Narsimhan Sreedhar, Oleksii Kuchaiev",datasets_and_benchmarks_track,https://proceedings.neurips.cc/paper_files/paper/2024/file/02fd91a387a6a5a5751e81b58a75af90-Paper-Datasets_and_Benchmarks_Track.pdf
NeurIPS,2024,libmoon_a_gradientbased_multiobjective_optimization_library_in_pytorch__9722abbc.pdf,LibMOON: A Gradient-based MultiObjective OptimizatioN Library in PyTorch,"Xiaoyuan Zhang, Liang ZHAO, Yingying Yu, Xi Lin, Yifan Chen, Han Zhao, Qingfu Zhang",datasets_and_benchmarks_track,https://proceedings.neurips.cc/paper_files/paper/2024/file/03ce71224741e6596059b8680a62978b-Paper-Datasets_and_Benchmarks_Track.pdf
NeurIPS,2024,wildppg_a_realworld_ppg_dataset_of_long_continuous_recordings__13ccb20c.pdf,WildPPG: A Real-World PPG Dataset of Long Continuous Recordings,"Manuel Meier, Berken Utku Demirel, Christian Holz",datasets_and_benchmarks_track,https://proceedings.neurips.cc/paper_files/paper/2024/file/0433292a3eb101df8f4d72a63f5410d4-Paper-Datasets_and_Benchmarks_Track.pdf
NeurIPS,2024,using_unity_to_help_solve_reinforcement_learning__25fb2428.pdf,Using Unity to Help Solve Reinforcement Learning,"Connor Brennan, Andrew Williams, Omar G. Younis, Vedant Vyas, Daria Yasafova, Irina Rish",datasets_and_benchmarks_track,https://proceedings.neurips.cc/paper_files/paper/2024/file/04c0c541d936f7cbfbb21085116236cd-Paper-Datasets_and_Benchmarks_Track.pdf
NeurIPS,2024,a_hitchhikers_guide_to_finegrained_face_forgery_detection_using_common_sense_reasoning__7c113550.pdf,A Hitchhiker's Guide to Fine-Grained Face Forgery Detection Using Common Sense Reasoning,"Niki M Foteinopoulou, Enjie Ghorbel, Djamila Aouada",datasets_and_benchmarks_track,https://proceedings.neurips.cc/paper_files/paper/2024/file/059d2b9188cdb7ae00f4d78cc9469704-Paper-Datasets_and_Benchmarks_Track.pdf
NeurIPS,2024,ultraedit_instructionbased_finegrained_image_editing_at_scale__beeb64cc.pdf,UltraEdit: Instruction-based Fine-Grained Image Editing at Scale,"Haozhe Zhao, Xiaojian (Shawn) Ma, Liang Chen, Shuzheng Si, Rujie Wu, Kaikai An, Peiyu Yu, Minjia Zhang, Qing Li, Baobao Chang",datasets_and_benchmarks_track,https://proceedings.neurips.cc/paper_files/paper/2024/file/05a30a0fc9e6bacdd3abd4ca8508a9e6-Paper-Datasets_and_Benchmarks_Track.pdf
NeurIPS,2024,care_a_benchmark_suite_for_the_classification_and_retrieval_of_enzymes__f033e25f.pdf,CARE: a Benchmark Suite for the Classification and Retrieval of Enzymes,"Jason Yang, Ariane Mora, Shengchao Liu, Bruce Wittmann, Animashree Anandkumar, Frances Arnold, Yisong Yue",datasets_and_benchmarks_track,https://proceedings.neurips.cc/paper_files/paper/2024/file/05a7ad45d75a3082d7a3a70de8743140-Paper-Datasets_and_Benchmarks_Track.pdf
NeurIPS,2024,vrsbench_a_versatile_visionlanguage_benchmark_dataset_for_remote_sensing_image_understanding__8a8608ef.pdf,VRSBench: A Versatile Vision-Language Benchmark Dataset for Remote Sensing Image Understanding,"Xiang Li, Jian Ding, Mohamed Elhoseiny",datasets_and_benchmarks_track,https://proceedings.neurips.cc/paper_files/paper/2024/file/05b7f821234f66b78f99e7803fffa78a-Paper-Datasets_and_Benchmarks_Track.pdf
NeurIPS,2024,solarcube_an_integrative_benchmark_dataset_harnessing_satellite_and_insitu_observations_for_largescale_solar_energy_forecasting__950d8a30.pdf,SolarCube: An Integrative Benchmark Dataset Harnessing Satellite and In-situ Observations for Large-scale Solar Energy Forecasting,"Ruohan Li, Yiqun Xie, Xiaowei Jia, Dongdong Wang, Yanhua Li, Yingxue Zhang, Zhihao Wang, Zhili Li",datasets_and_benchmarks_track,https://proceedings.neurips.cc/paper_files/paper/2024/file/06477eb61ea6b85c6608d42a222462df-Paper-Datasets_and_Benchmarks_Track.pdf
NeurIPS,2024,taskbench_benchmarking_large_language_models_for_task_automation__b4190ad2.pdf,TaskBench: Benchmarking Large Language Models for Task Automation,"Yongliang Shen, Kaitao Song, Xu Tan, Wenqi Zhang, Kan Ren, Siyu Yuan, Weiming Lu, Dongsheng Li, Yueting Zhuang",datasets_and_benchmarks_track,https://proceedings.neurips.cc/paper_files/paper/2024/file/085185ea97db31ae6dcac7497616fd3e-Paper-Datasets_and_Benchmarks_Track.pdf
NeurIPS,2024,findingemo_an_image_dataset_for_emotion_recognition_in_the_wild__2e21c52d.pdf,FindingEmo: An Image Dataset for Emotion Recognition in the Wild,"Laurent Mertens, Elahe Yargholi, Hans Op de Beeck, Jan Van den Stock, Joost Vennekens",datasets_and_benchmarks_track,https://proceedings.neurips.cc/paper_files/paper/2024/file/08a7229eaba3b35cd8f933ac678f2096-Paper-Datasets_and_Benchmarks_Track.pdf
NeurIPS,2024,workarena_towards_compositional_planning_and_reasoningbased_common_knowledge_work_tasks__0fafdcfa.pdf,WorkArena++: Towards Compositional Planning and Reasoning-based Common Knowledge Work Tasks,"Léo Boisvert, Megh Thakkar, Maxime Gasse, Massimo Caccia, Thibault de Chezelles, Quentin Cappart, Nicolas Chapados, Alexandre Lacoste, Alexandre Drouin",datasets_and_benchmarks_track,https://proceedings.neurips.cc/paper_files/paper/2024/file/0b82662b6c32e887bb252a74d8cb2d5e-Paper-Datasets_and_Benchmarks_Track.pdf
NeurIPS,2024,dmcvb_a_benchmark_for_representation_learning_for_control_with_visual_distractors__ca6ba310.pdf,DMC-VB: A Benchmark for Representation Learning for Control with Visual Distractors,"Joseph Ortiz, Antoine Dedieu, Wolfgang Lehrach, J Swaroop Guntupalli, Carter Wendelken, Ahmad Humayun, Sivaramakrishnan Swaminathan, Guangyao Zhou, Miguel Lazaro-Gredilla, Kevin P. Murphy",datasets_and_benchmarks_track,https://proceedings.neurips.cc/paper_files/paper/2024/file/0c946accd3ccc88c09dfae7e1cd40ffe-Paper-Datasets_and_Benchmarks_Track.pdf
NeurIPS,2024,benchx_a_unified_benchmark_framework_for_medical_visionlanguage_pretraining_on_chest_xrays__5c2044a0.pdf,BenchX: A Unified Benchmark Framework for Medical Vision-Language Pretraining on Chest X-Rays,"Yang Zhou, Tan Faith, Yanyu Xu, Sicong Leng, Xinxing Xu, Yong Liu, Rick Siow Mong Goh",datasets_and_benchmarks_track,https://proceedings.neurips.cc/paper_files/paper/2024/file/0cb35e10bf7bb73d10c12414edbd63fd-Paper-Datasets_and_Benchmarks_Track.pdf
NeurIPS,2024,mllmguard_a_multidimensional_safety_evaluation_suite_for_multimodal_large_language_models__360fd3c4.pdf,MLLMGuard: A Multi-dimensional Safety Evaluation Suite for Multimodal Large Language Models,"Tianle Gu, Zeyang Zhou, Kexin Huang, Liang Dandan, Yixu Wang, Haiquan Zhao, Yuanqi Yao, xingge qiao, Keqing wang, Yujiu Yang, Yan Teng, Yu Qiao, Yingchun Wang",datasets_and_benchmarks_track,https://proceedings.neurips.cc/paper_files/paper/2024/file/0d9dcd4ebef57f1839d871fe7d891e91-Paper-Datasets_and_Benchmarks_Track.pdf
NeurIPS,2024,urbandatalayer_a_unified_data_pipeline_for_urban_science__c669ef30.pdf,UrbanDataLayer: A Unified Data Pipeline for Urban Science,"Yiheng Wang, Tianyu Wang, YuYing Zhang, Hongji Zhang, Haoyu Zheng, Guanjie Zheng, Linghe Kong",datasets_and_benchmarks_track,https://proceedings.neurips.cc/paper_files/paper/2024/file/0db7f135f6991e8cec5e516ecc66bfba-Paper-Datasets_and_Benchmarks_Track.pdf
NeurIPS,2024,textspace_graph_foundation_models_comprehensive_benchmarks_and_new_insights__0c7a7ee0.pdf,Text-space Graph Foundation Models: Comprehensive Benchmarks and New Insights,"Zhikai Chen, Haitao Mao, Jingzhe Liu, Yu Song, Bingheng Li, Wei Jin, Bahare Fatemi, Anton Tsitsulin, Bryan Perozzi, Hui Liu, Jiliang Tang",datasets_and_benchmarks_track,https://proceedings.neurips.cc/paper_files/paper/2024/file/0e0b39c69663e9c073739adf547ed778-Paper-Datasets_and_Benchmarks_Track.pdf
NeurIPS,2024,citeme_can_language_models_accurately_cite_scientific_claims__2b5158ad.pdf,CiteME: Can Language Models Accurately Cite Scientific Claims?,"Ori Press, Andreas Hochlehnert, Ameya Prabhu, Vishaal Udandarao, Ofir Press, Matthias Bethge",datasets_and_benchmarks_track,https://proceedings.neurips.cc/paper_files/paper/2024/file/0ef47f7b768e1a012e3d995ac8d8fac7-Paper-Datasets_and_Benchmarks_Track.pdf
NeurIPS,2024,wildguard_open_onestop_moderation_tools_for_safety_risks_jailbreaks_and_refusals_of_llms__b84e514c.pdf,"WildGuard: Open One-stop Moderation Tools for Safety Risks, Jailbreaks, and Refusals of LLMs","Seungju Han, Kavel Rao, Allyson Ettinger, Liwei Jiang, Bill Yuchen Lin, Nathan Lambert, Yejin Choi, Nouha Dziri",datasets_and_benchmarks_track,https://proceedings.neurips.cc/paper_files/paper/2024/file/0f69b4b96a46f284b726fbd70f74fb3b-Paper-Datasets_and_Benchmarks_Track.pdf
NeurIPS,2024,visual_cot_advancing_multimodal_language_models_with_a_comprehensive_dataset_and_benchmark_for_chainofthought_reasoning__4c6f8b96.pdf,Visual CoT: Advancing Multi-Modal Language Models with a Comprehensive Dataset and Benchmark for Chain-of-Thought Reasoning,"Hao Shao, Shengju Qian, Han Xiao, Guanglu Song, ZHUOFAN ZONG, Letian Wang, Yu Liu, Hongsheng Li",datasets_and_benchmarks_track,https://proceedings.neurips.cc/paper_files/paper/2024/file/0ff38d72a2e0aa6dbe42de83a17b2223-Paper-Datasets_and_Benchmarks_Track.pdf
NeurIPS,2024,mmdu_a_multiturn_multiimage_dialog_understanding_benchmark_and_instructiontuning_dataset_for_lvlms__e3250448.pdf,MMDU: A Multi-Turn Multi-Image Dialog Understanding Benchmark and Instruction-Tuning Dataset for LVLMs,"Ziyu Liu, Tao Chu, Yuhang Zang, Xilin Wei, Xiaoyi Dong, Pan Zhang, Zijian Liang, Yuanjun Xiong, Yu Qiao, Dahua Lin, Jiaqi Wang",datasets_and_benchmarks_track,https://proceedings.neurips.cc/paper_files/paper/2024/file/1057053100de064a44286239724f7865-Paper-Datasets_and_Benchmarks_Track.pdf
NeurIPS,2024,vlkeb_a_large_visionlanguage_model_knowledge_editing_benchmark__37b4480a.pdf,VLKEB: A Large Vision-Language Model Knowledge Editing Benchmark,"Han Huang, Haitian Zhong, Tao Yu, Qiang Liu, Shu Wu, Liang Wang, Tieniu Tan",datasets_and_benchmarks_track,https://proceedings.neurips.cc/paper_files/paper/2024/file/1198b53fa686831d5f0c0860d7ec4f34-Paper-Datasets_and_Benchmarks_Track.pdf
NeurIPS,2024,uknow_a_unified_knowledge_protocol_with_multimodal_knowledge_graph_datasets_for_reasoning_and_visionlanguage_pretraining__1bc28109.pdf,UKnow: A Unified Knowledge Protocol with Multimodal Knowledge Graph Datasets for Reasoning and Vision-Language Pre-Training,"Biao Gong, Shuai Tan, Yutong Feng, Xiaoying Xie, Yuyuan Li, Chaochao Chen, Kecheng Zheng, Yujun Shen, Deli Zhao",datasets_and_benchmarks_track,https://proceedings.neurips.cc/paper_files/paper/2024/file/126784e4d5a92afff92d13aee155554b-Paper-Datasets_and_Benchmarks_Track.pdf
NeurIPS,2024,privauditor_benchmarking_data_protection_vulnerabilities_in_llm_adaptation_techniques__8f53b015.pdf,PrivAuditor: Benchmarking Data Protection Vulnerabilities in LLM Adaptation Techniques,"Derui Zhu, Dingfan Chen, Xiongfei Wu, Jiahui Geng, Zhuo Li, Jens Grossklags, Lei Ma",datasets_and_benchmarks_track,https://proceedings.neurips.cc/paper_files/paper/2024/file/12b18a15dcd73e1991e9959a94375fab-Paper-Datasets_and_Benchmarks_Track.pdf
NeurIPS,2024,a_retrospective_on_the_robot_air_hockey_challenge_benchmarking_robust_reliable_and_safe_learning_techniques_for_realworld_robotics__01dbf663.pdf,"A Retrospective on the Robot Air Hockey Challenge: Benchmarking Robust, Reliable, and Safe Learning Techniques for Real-world Robotics","Puze Liu, Jonas Günster, Niklas Funk, Simon Gröger, Dong Chen, Haitham Bou Ammar, Julius Jankowski, Ante Marić, Sylvain Calinon, Andrej Orsula, Miguel Olivares, Hongyi Zhou, Rudolf Lioutikov, Gerhard Neumann, Amarildo Likmeta, Amirhossein Zhalehmehrabi, Thomas Bonenfant, Marcello Restelli, Davide Tateo, Ziyuan Liu, Jan R. Peters",datasets_and_benchmarks_track,https://proceedings.neurips.cc/paper_files/paper/2024/file/12ba5de27afcff1a5c796de4a6392154-Paper-Datasets_and_Benchmarks_Track.pdf
NeurIPS,2024,discoveryworld_a_virtual_environment_for_developing_and_evaluating_automated_scientific_discovery_agents__8bab4507.pdf,DiscoveryWorld: A Virtual Environment for Developing and Evaluating Automated Scientific Discovery Agents,"Peter Jansen, Marc-Alexandre Côté, Tushar Khot, Erin Bransom, Bhavana Dalvi Mishra, Bodhisattwa Prasad Majumder, Oyvind Tafjord, Peter Clark",datasets_and_benchmarks_track,https://proceedings.neurips.cc/paper_files/paper/2024/file/13836f251823945316ae067350a5c366-Paper-Datasets_and_Benchmarks_Track.pdf
NeurIPS,2024,fairjob_a_realworld_dataset_for_fairness_in_online_systems__a722fda3.pdf,FairJob: A Real-World Dataset for Fairness in Online Systems,"Mariia Vladimirova, Federico Pavone, Eustache Diemert",datasets_and_benchmarks_track,https://proceedings.neurips.cc/paper_files/paper/2024/file/142bff4f4c01dd55c4309860ff3a59f1-Paper-Datasets_and_Benchmarks_Track.pdf
NeurIPS,2024,crag__comprehensive_rag_benchmark__76f751ca.pdf,CRAG - Comprehensive RAG Benchmark,"Xiao Yang, Kai Sun, Hao Xin, Yushi Sun, Nikita Bhalla, Xiangsen Chen, Sajal Choudhary, Rongze Gui, Ziran Jiang, Ziyu Jiang, Lingkun Kong, Brian Moran, Jiaqi Wang, Yifan Xu, An Yan, Chenyu Yang, Eting Yuan, Hanwen Zha, Nan Tang, Lei  Chen, Nicolas Scheffer, Yue Liu, Nirav Shah, Rakesh Wanga, Anuj Kumar, Scott Yih, Xin Dong",datasets_and_benchmarks_track,https://proceedings.neurips.cc/paper_files/paper/2024/file/1435d2d0fca85a84d83ddcb754f58c29-Paper-Datasets_and_Benchmarks_Track.pdf
NeurIPS,2024,perteval_unveiling_real_knowledge_capacity_of_llms_with_knowledgeinvariant_perturbations__eaab462c.pdf,PertEval: Unveiling Real Knowledge Capacity of LLMs with Knowledge-Invariant Perturbations,"Jiatong Li, Renjun Hu, Kunzhe Huang, Yan Zhuang, Qi Liu, Mengxiao Zhu, Xing Shi, Wei Lin",datasets_and_benchmarks_track,https://proceedings.neurips.cc/paper_files/paper/2024/file/149578235c90954e4f10e40fa181918f-Paper-Datasets_and_Benchmarks_Track.pdf
NeurIPS,2024,personalized_instancebased_navigation_toward_userspecific_objects_in_realistic_environments__ecb53720.pdf,Personalized Instance-based Navigation Toward User-Specific Objects in Realistic Environments,"Luca Barsellotti, Roberto Bigazzi, Marcella Cornia, Lorenzo Baraldi, Rita Cucchiara",datasets_and_benchmarks_track,https://proceedings.neurips.cc/paper_files/paper/2024/file/1522f1d7ee96fafd08244f0def8a1c05-Paper-Datasets_and_Benchmarks_Track.pdf
NeurIPS,2024,cvqa_culturallydiverse_multilingual_visual_question_answering_benchmark__c888cd86.pdf,CVQA: Culturally-diverse Multilingual Visual Question Answering Benchmark,"David Romero, Chenyang Lyu, Haryo Wibowo, Santiago Góngora, Aishik Mandal, Sukannya Purkayastha, Jesus-German Ortiz-Barajas, Emilio Cueva, Jinheon Baek, Soyeong Jeong, Injy Hamed, Yong Zheng-Xin, Zheng Wei Lim, Paula Silva, Jocelyn Dunstan, Mélanie Jouitteau, David LE MEUR, Joan Nwatu, Ganzorig Batnasan, Munkh-Erdene Otgonbold, Munkhjargal Gochoo, Guido Ivetta, Luciana Benotti, Laura Alonso Alemany, Hernán Maina, Jiahui Geng, Tiago Timponi Torrent, Frederico Belcavello, Marcelo Viridiano, Jan Christian Blaise Cruz, Dan John Velasco, Oana Ignat, Zara Burzo, Chenxi Whitehouse, Artem Abzaliev, Teresa Clifford, Gráinne Caulfield, Teresa Lynn, Christian Salamea-Palacios, Vladimir Araujo, Yova Kementchedjhieva, Mihail Mihaylov, Israel Azime, Henok Ademtew, Bontu Balcha, Naome A. Etori, David Adelani, Rada Mihalcea, Atnafu Lambebo Tonja, Maria Cabrera, Gisela Vallejo, Holy Lovenia, Ruochen Zhang, Marcos Estecha-Garitagoitia, Mario Rodríguez-Cantelar, Toqeer Ehsan, Rendi Chevi, Muhammad Adilazuarda, Ryandito Diandaru, Samuel Cahyawijaya, Fajri Koto, Tatsuki Kuribayashi, Haiyue Song, Aditya Khandavally, Thanmay Jayakumar, Raj Dabre, Mohamed Imam, Kumaranage Nagasinghe, Alina Dragonetti, Luis Fernando D&#x27;Haro, Niyomugisha Olivier, Jay Gala, Pranjal Chitale, Fauzan Farooqui, Thamar Solorio, Alham Aji",datasets_and_benchmarks_track,https://proceedings.neurips.cc/paper_files/paper/2024/file/1568882ba1a50316e87852542523739c-Paper-Datasets_and_Benchmarks_Track.pdf
NeurIPS,2024,effibench_benchmarking_the_efficiency_of_automatically_generated_code__7271393b.pdf,EffiBench: Benchmarking the Efficiency of Automatically Generated Code,"Dong HUANG, Yuhao QING, Weiyi Shang, Heming Cui, Jie Zhang",datasets_and_benchmarks_track,https://proceedings.neurips.cc/paper_files/paper/2024/file/15807b6e09d691fe5e96cdecde6d7b80-Paper-Datasets_and_Benchmarks_Track.pdf
NeurIPS,2024,putnambench_evaluating_neural_theoremprovers_on_the_putnam_mathematical_competition__6385e14b.pdf,PutnamBench: Evaluating Neural Theorem-Provers on the Putnam Mathematical Competition,"George Tsoukalas, Jasper Lee, John Jennings, Jimmy Xin, Michelle Ding, Michael Jennings, Amitayush Thakur, Swarat Chaudhuri",datasets_and_benchmarks_track,https://proceedings.neurips.cc/paper_files/paper/2024/file/1582eaf9e0cf349e1e5a6ee453100aa1-Paper-Datasets_and_Benchmarks_Track.pdf
NeurIPS,2024,asep_benchmarking_deep_learning_methods_for_antibodyspecific_epitope_prediction__b97730b1.pdf,AsEP: Benchmarking Deep Learning Methods for Antibody-specific Epitope Prediction,"ChuNan Liu, Lilian Denzler, Yihong Chen, Andrew Martin, Brooks Paige",datasets_and_benchmarks_track,https://proceedings.neurips.cc/paper_files/paper/2024/file/15add6732964d5b1f0954058bf3ccc88-Paper-Datasets_and_Benchmarks_Track.pdf
NeurIPS,2024,unitox_leveraging_llms_to_curate_a_unified_dataset_of_druginduced_toxicity_from_fda_labels__b40dcce9.pdf,UniTox: Leveraging LLMs to Curate a Unified Dataset of Drug-Induced Toxicity from FDA Labels,"Jacob Silberg, Kyle Swanson, Elana Simon, Angela Zhang, Zaniar Ghazizadeh, Scott Ogden, Hisham Hamadeh, James Y. Zou",datasets_and_benchmarks_track,https://proceedings.neurips.cc/paper_files/paper/2024/file/16659e412de3965fa195ddb9f2c4b356-Paper-Datasets_and_Benchmarks_Track.pdf
NeurIPS,2024,mmmrs_a_multimodal_multigsd_multiscene_remote_sensing_dataset_and_benchmark_for_texttoimage_generation__a0c72ee5.pdf,"MMM-RS: A Multi-modal, Multi-GSD, Multi-scene Remote Sensing  Dataset and Benchmark for Text-to-Image Generation","jialin luo, Yuanzhi Wang, Ziqi Gu, Yide Qiu, Shuaizhen Yao, Fuyun Wang, Chunyan Xu, Wenhua Zhang, Dan Wang, Zhen Cui",datasets_and_benchmarks_track,https://proceedings.neurips.cc/paper_files/paper/2024/file/1697e3fb412da11dc9488249f9e7bbc9-Paper-Datasets_and_Benchmarks_Track.pdf
NeurIPS,2024,drivingdojo_dataset_advancing_interactive_and_knowledgeenriched_driving_world_model__903c9ed4.pdf,DrivingDojo Dataset: Advancing Interactive and Knowledge-Enriched Driving World Model,"Yuqi Wang, Ke Cheng, Jiawei He, Qitai Wang, Hengchen Dai, Yuntao Chen, Fei Xia, ZHAO-XIANG ZHANG",datasets_and_benchmarks_track,https://proceedings.neurips.cc/paper_files/paper/2024/file/178f4666a84ecdd61e3b85145ed56484-Paper-Datasets_and_Benchmarks_Track.pdf
NeurIPS,2024,blurd_benchmarking_and_learning_using_a_unified_rendering_and_diffusion_model__741e49ae.pdf,BLURD: Benchmarking and Learning using a Unified Rendering and Diffusion Model,"Boris Repasky, Ehsan Abbasnejad, Anthony Dick",datasets_and_benchmarks_track,https://proceedings.neurips.cc/paper_files/paper/2024/file/17d25665bf6f46b7b3d32bd5cad3cbb2-Paper-Datasets_and_Benchmarks_Track.pdf
NeurIPS,2024,towards_comprehensive_detection_of_chinese_harmful_memes__ecdbd591.pdf,Towards Comprehensive Detection of Chinese Harmful Memes,"Junyu Lu, Bo Xu, Xiaokun Zhang, Hongbo Wang, Haohao Zhu, Dongyu Zhang, Liang Yang, Hongfei Lin",datasets_and_benchmarks_track,https://proceedings.neurips.cc/paper_files/paper/2024/file/17fc467c11997914127c001fdc801bea-Paper-Datasets_and_Benchmarks_Track.pdf
NeurIPS,2024,textttmodelglue_democratized_llm_scaling_for_a_large_model_zoo_in_the_wild__b479e783.pdf,$\texttt{Model-GLUE}$: Democratized LLM Scaling for A Large Model Zoo in the Wild,"Xinyu Zhao, Guoheng Sun, Ruisi Cai, Yukun Zhou, Pingzhi Li, Peihao Wang, Bowen Tan, Yexiao He, Li Chen, Yi Liang, Beidi Chen, Binhang Yuan, Hongyi Wang, Ang Li, Zhangyang &quot;Atlas&quot; Wang, Tianlong Chen",datasets_and_benchmarks_track,https://proceedings.neurips.cc/paper_files/paper/2024/file/180a476f22a52b8ef14f42b2b927afcc-Paper-Datasets_and_Benchmarks_Track.pdf
NeurIPS,2024,beyond_aesthetics_cultural_competence_in_texttoimage_models__7cbc3d3d.pdf,Beyond Aesthetics: Cultural Competence in Text-to-Image Models,"Nithish Kannen Senthilkumar, Arif Ahmad, Marco Andreetto, Vinodkumar Prabhakaran, Utsav Prabhu, Adji Bousso Dieng, Pushpak Bhattacharyya, Shachi Dave",datasets_and_benchmarks_track,https://proceedings.neurips.cc/paper_files/paper/2024/file/18c669b80d1a8f589713b768bc8fe9a4-Paper-Datasets_and_Benchmarks_Track.pdf
NeurIPS,2024,datacomplm_in_search_of_the_next_generation_of_training_sets_for_language_models__3eaf9ad6.pdf,DataComp-LM: In search of the next generation of training sets for language models,"Jeffrey Li, Alex Fang, Georgios Smyrnis, Maor Ivgi, Matt Jordan, Samir Yitzhak Gadre, Hritik Bansal, Etash Guha, Sedrick Scott Keh, Kushal Arora, Saurabh Garg, Rui Xin, Niklas Muennighoff, Reinhard Heckel, Jean Mercat, Mayee Chen, Suchin Gururangan, Mitchell Wortsman, Alon Albalak, Yonatan Bitton, Marianna Nezhurina, Amro Abbas, Cheng-Yu Hsieh, Dhruba Ghosh, Josh Gardner, Maciej Kilian, Hanlin Zhang, Rulin Shao, Sarah Pratt, Sunny Sanyal, Gabriel Ilharco, Giannis Daras, Kalyani Marathe, Aaron Gokaslan, Jieyu Zhang, Khyathi Chandu, Thao Nguyen, Igor Vasiljevic, Sham Kakade, Shuran Song, Sujay Sanghavi, Fartash Faghri, Sewoong Oh, Luke Zettlemoyer, Kyle Lo, Alaaeldin El-Nouby, Hadi Pouransari, Alexander Toshev, Stephanie Wang, Dirk Groeneveld, Luca Soldaini, Pang Wei W. Koh, Jenia Jitsev, Thomas Kollar, Alex Dimakis, Yair Carmon, Achal Dave, Ludwig Schmidt, Vaishaal Shankar",datasets_and_benchmarks_track,https://proceedings.neurips.cc/paper_files/paper/2024/file/19e4ea30dded58259665db375885e412-Paper-Datasets_and_Benchmarks_Track.pdf
NeurIPS,2024,progressgym_alignment_with_a_millennium_of_moral_progress__e65989eb.pdf,ProgressGym: Alignment with a Millennium of Moral Progress,"Tianyi (Alex) Qiu, Yang Zhang, Xuchuan Huang, Jasmine Li, Jiaming Ji, Yaodong Yang",datasets_and_benchmarks_track,https://proceedings.neurips.cc/paper_files/paper/2024/file/1a6d49c1a298ebb799d005b7b90ab31d-Paper-Datasets_and_Benchmarks_Track.pdf
NeurIPS,2024,ovtb_a_new_largescale_benchmark_for_openvocabulary_multiobject_tracking__a52de0e0.pdf,OVT-B: A New Large-Scale Benchmark for Open-Vocabulary Multi-Object Tracking,"Haiji Liang, Ruize Han",datasets_and_benchmarks_track,https://proceedings.neurips.cc/paper_files/paper/2024/file/1adeeac24ce6168e20bcee85645720e9-Paper-Datasets_and_Benchmarks_Track.pdf
