Conference,Year,Filename,Title,Authors,Category,PDF_URL
AAAI,2021,flowbased_generative_models_for_learning_manifold_to_manifold_mappings__77124c49.pdf,Flow-based Generative Models for Learning Manifold to Manifold Mappings,"Xingjian Zhen, Rudrasis Chakraborty, Liu Yang, Vikas Singh11042-11052",AAAI Technical Track on Machine Learning V,https://cdn.aaai.org/ojs/17318/17318-13-20812-1-2-20210518.pdf
AAAI,2021,meta_label_correction_for_noisy_label_learning__2da3e469.pdf,Meta Label Correction for Noisy Label Learning,"Guoqing Zheng, Ahmed Hassan Awadallah, Susan Dumais11053-11061",AAAI Technical Track on Machine Learning V,https://cdn.aaai.org/ojs/17319/17319-13-20813-1-2-20210518.pdf
AAAI,2021,going_deeper_with_directlytrained_larger_spiking_neural_networks__1ba1e32d.pdf,Going Deeper With Directly-Trained Larger Spiking Neural Networks,"Hanle Zheng, Yujie Wu, Lei Deng, Yifan Hu, Guoqi Li11062-11070",AAAI Technical Track on Machine Learning V,https://cdn.aaai.org/ojs/17320/17320-13-20814-1-2-20210518.pdf
AAAI,2021,fullyconnected_tensor_network_decomposition_and_its_application_to_higherorder_tensor_completion__0d2bf626.pdf,Fully-Connected Tensor Network Decomposition and Its Application to Higher-Order Tensor Completion,"Yu-Bang Zheng, Ting-Zhu Huang, Xi-Le Zhao, Qibin Zhao, Tai-Xiang Jiang11071-11078",AAAI Technical Track on Machine Learning V,https://cdn.aaai.org/ojs/17321/17321-13-20815-1-2-20210518.pdf
AAAI,2021,how_does_the_combined_risk_affect_the_performance_of_unsupervised_domain_adaptation_approaches__28c89a26.pdf,How Does the Combined Risk Affect the Performance of Unsupervised Domain Adaptation Approaches?,"Li Zhong, Zhen Fang, Feng Liu, Jie Lu, Bo Yuan, Guangquan Zhang11079-11087",AAAI Technical Track on Machine Learning V,https://cdn.aaai.org/ojs/17322/17322-13-20816-1-2-20210518.pdf
AAAI,2021,identityaware_graph_neural_networks__2069b0b1.pdf,Identity-aware Graph Neural Networks,"Jiaxuan You, Jonathan M Gomes-Selman, Rex Ying, Jure Leskovec10737-10745",AAAI Technical Track on Machine Learning V,https://cdn.aaai.org/ojs/17283/17283-13-20777-1-2-20210518.pdf
AAAI,2021,how_does_data_augmentation_affect_privacy_in_machine_learning__41c78ffd.pdf,How Does Data Augmentation Affect Privacy in Machine Learning?,"Da Yu, Huishuai Zhang, Wei Chen, Jian Yin, Tie-Yan Liu10746-10753",AAAI Technical Track on Machine Learning V,https://cdn.aaai.org/ojs/17284/17284-13-20778-1-2-20210518.pdf
AAAI,2021,dast_unsupervised_domain_adaptation_in_semantic_segmentation_based_on_discriminator_attention_and_selftraining__c653b434.pdf,DAST: Unsupervised Domain Adaptation in Semantic Segmentation Based on Discriminator Attention and Self-Training,"Fei Yu, Mo Zhang, Hexin Dong, Sheng Hu, Bin Dong, Li Zhang10754-10762",AAAI Technical Track on Machine Learning V,https://cdn.aaai.org/ojs/17285/17285-13-20779-1-2-20210518.pdf
AAAI,2021,anyprecision_deep_neural_networks__6b326a59.pdf,Any-Precision Deep Neural Networks,"Haichao Yu, Haoxiang Li, Humphrey Shi, Thomas S. Huang, Gang Hua10763-10771",AAAI Technical Track on Machine Learning V,https://cdn.aaai.org/ojs/17286/17286-13-20780-1-2-20210518.pdf
AAAI,2021,personalized_adaptive_meta_learning_for_coldstart_user_preference_prediction__cf131b59.pdf,Personalized Adaptive Meta Learning for Cold-start User Preference Prediction,"Runsheng Yu, Yu Gong, Xu He, Yu Zhu, Qingwen Liu, Wenwu Ou, Bo An10772-10780",AAAI Technical Track on Machine Learning V,https://cdn.aaai.org/ojs/17287/17287-13-20781-1-2-20210518.pdf
AAAI,2021,measuring_dependence_with_matrixbased_entropy_functional__0f1b76a9.pdf,Measuring Dependence with Matrix-based Entropy Functional,"Shujian Yu, Francesco Alesiani, Xi Yu, Robert Jenssen, Jose Principe10781-10789",AAAI Technical Track on Machine Learning V,https://cdn.aaai.org/ojs/17288/17288-13-20782-1-2-20210518.pdf
AAAI,2021,learning_modalityspecific_representations_with_selfsupervised_multitask_learning_for_multimodal_sentiment_analysis__21929d06.pdf,Learning Modality-Specific Representations with Self-Supervised Multi-Task Learning for Multimodal Sentiment Analysis,"Wenmeng Yu, Hua Xu, Ziqi Yuan, Jiele Wu10790-10797",AAAI Technical Track on Machine Learning V,https://cdn.aaai.org/ojs/17289/17289-13-20783-1-2-20210518.pdf
AAAI,2021,knowledgeguided_object_discovery_with_acquired_deep_impressions__2eb90c0f.pdf,Knowledge-Guided Object Discovery with Acquired Deep Impressions,"Jinyang Yuan, Bin Li, Xiangyang Xue10798-10806",AAAI Technical Track on Machine Learning V,https://cdn.aaai.org/ojs/17290/17290-13-20784-1-2-20210518.pdf
AAAI,2021,curse_or_redemption_how_data_heterogeneity_affects_the_robustness_of_federated_learning__eb2e6a1d.pdf,Curse or Redemption? How Data Heterogeneity Affects the Robustness of Federated Learning,"Syed Zawad, Ahsan Ali, Pin-Yu Chen, Ali Anwar, Yi Zhou, Nathalie Baracaldo, Yuan Tian, Feng Yan10807-10814",AAAI Technical Track on Machine Learning V,https://cdn.aaai.org/ojs/17291/17291-13-20785-1-2-20210518.pdf
AAAI,2021,are_adversarial_examples_created_equal_a_learnable_weighted_minimax_risk_for_robustness_under_nonuniform_attacks__813ae239.pdf,Are Adversarial Examples Created Equal? A Learnable Weighted Minimax Risk for Robustness under Non-uniform Attacks,"Huimin Zeng, Chen Zhu, Tom Goldstein, Furong Huang10815-10823",AAAI Technical Track on Machine Learning V,https://cdn.aaai.org/ojs/17292/17292-13-20786-1-2-20210518.pdf
AAAI,2021,contrastive_selfsupervised_learning_for_graph_classification__7f45fbd1.pdf,Contrastive Self-supervised Learning for Graph Classification,"Jiaqi Zeng, Pengtao Xie10824-10832",AAAI Technical Track on Machine Learning V,https://cdn.aaai.org/ojs/17293/17293-13-20787-1-2-20210518.pdf
AAAI,2021,datadriven_competitive_algorithms_for_online_knapsack_and_set_cover__dcb1f1bd.pdf,Data-driven Competitive Algorithms for Online Knapsack and Set Cover,"Ali Zeynali, Bo Sun, Mohammad Hajiesmaili, Adam Wierman10833-10841",AAAI Technical Track on Machine Learning V,https://cdn.aaai.org/ojs/17294/17294-13-20788-1-2-20210518.pdf
AAAI,2021,a_hybrid_stochastic_gradient_hamiltonian_monte_carlo_method__021cd44e.pdf,A Hybrid Stochastic Gradient Hamiltonian Monte Carlo Method,"Chao Zhang, Zhijian Li, Zebang Shen, Jiahao Xie, Hui Qian10842-10850",AAAI Technical Track on Machine Learning V,https://cdn.aaai.org/ojs/17295/17295-13-20789-1-2-20210518.pdf
AAAI,2021,cloudlstm_a_recurrent_neural_model_for_spatiotemporal_pointcloud_stream_forecasting__16dd898b.pdf,CloudLSTM: A Recurrent Neural Model for Spatiotemporal Point-cloud Stream Forecasting,"Chaoyun Zhang, Marco Fiore, Iain Murray, Paul Patras10851-10858",AAAI Technical Track on Machine Learning V,https://cdn.aaai.org/ojs/17296/17296-13-20790-1-2-20210518.pdf
AAAI,2021,exploration_by_maximizing_renyi_entropy_for_rewardfree_rl_framework__9933a28f.pdf,Exploration by Maximizing Renyi Entropy for Reward-Free RL Framework,"Chuheng Zhang, Yuanying Cai, Longbo Huang, Jian Li10859-10867",AAAI Technical Track on Machine Learning V,https://cdn.aaai.org/ojs/17297/17297-13-20791-1-2-20210518.pdf
AAAI,2021,efficient_folded_attention_for_medical_image_reconstruction_and_segmentation__5311c601.pdf,Efficient Folded Attention for Medical Image Reconstruction and Segmentation,"Hang Zhang, Jinwei Zhang, Rongguang Wang, Qihao Zhang, Pascal Spincemaille, Thanh D. Nguyen, Yi Wang10868-10876",AAAI Technical Track on Machine Learning V,https://cdn.aaai.org/ojs/17298/17298-13-20792-1-2-20210518.pdf
AAAI,2021,interpreting_multivariate_shapley_interactions_in_dnns__cbc1bee0.pdf,Interpreting Multivariate Shapley Interactions in DNNs,"Hao Zhang, Yichen Xie, Longjie Zheng, Die Zhang, Quanshi Zhang10877-10886",AAAI Technical Track on Machine Learning V,https://cdn.aaai.org/ojs/17299/17299-13-20793-1-2-20210518.pdf
AAAI,2021,sample_efficient_reinforcement_learning_with_reinforce__93a2e491.pdf,Sample Efficient Reinforcement Learning with REINFORCE,"Junzi Zhang, Jongho Kim, Brendan O'Donoghue, Stephen Boyd10887-10895",AAAI Technical Track on Machine Learning V,https://cdn.aaai.org/ojs/17300/17300-13-20794-1-2-20210518.pdf
AAAI,2021,secure_bilevel_asynchronous_vertical_federated_learning_with_backward_updating__89cb5b80.pdf,Secure Bilevel Asynchronous Vertical Federated Learning with Backward Updating,"Qingsong Zhang, Bin Gu, Cheng Deng, Heng Huang10896-10904",AAAI Technical Track on Machine Learning V,https://cdn.aaai.org/ojs/17301/17301-13-20795-1-2-20210518.pdf
AAAI,2021,meanvariance_policy_iteration_for_riskaverse_reinforcement_learning__8c6062c9.pdf,Mean-Variance Policy Iteration for Risk-Averse Reinforcement Learning,"Shangtong Zhang, Bo Liu, Shimon Whiteson10905-10913",AAAI Technical Track on Machine Learning V,https://cdn.aaai.org/ojs/17302/17302-13-20796-1-2-20210518.pdf
AAAI,2021,toward_understanding_the_influence_of_individual_clients_in_federated_learning__02dcc09e.pdf,Toward Understanding the Influence of Individual Clients in Federated Learning,"Yihao Xue, Chaoyue Niu, Zhenzhe Zheng, Shaojie Tang, Chengfei Lyu, Fan Wu, Guihai Chen10560-10567",AAAI Technical Track on Machine Learning V,https://cdn.aaai.org/ojs/17263/17263-13-20757-1-2-20210518.pdf
AAAI,2021,adversarial_partial_multilabel_learning_with_label_disambiguation__50c156a1.pdf,Adversarial Partial Multi-Label Learning with Label Disambiguation,"Yan Yan, Yuhong Guo10568-10576",AAAI Technical Track on Machine Learning V,https://cdn.aaai.org/ojs/17264/17264-13-20758-1-2-20210518.pdf
AAAI,2021,near_lossless_transfer_learning_for_spiking_neural_networks__06299649.pdf,Near Lossless Transfer Learning for Spiking Neural Networks,"Zhanglu Yan, Jun Zhou, Weng-Fai Wong10577-10584",AAAI Technical Track on Machine Learning V,https://cdn.aaai.org/ojs/17265/17265-13-20759-1-2-20210518.pdf
AAAI,2021,dehib_deep_hidden_backdoor_attack_on_semisupervised_learning_via_adversarial_perturbation__6ed955cc.pdf,DeHiB: Deep Hidden Backdoor Attack on Semi-supervised Learning via Adversarial Perturbation,"Zhicong Yan, Gaolei Li, Yuan TIan, Jun Wu, Shenghong Li, Mingzhe Chen, H. Vincent Poor10585-10593",AAAI Technical Track on Machine Learning V,https://cdn.aaai.org/ojs/17266/17266-13-20760-1-2-20210518.pdf
AAAI,2021,robust_bandit_learning_with_imperfect_context__427b15ab.pdf,Robust Bandit Learning with Imperfect Context,"Jianyi Yang, Shaolei Ren10594-10602",AAAI Technical Track on Machine Learning V,https://cdn.aaai.org/ojs/17267/17267-13-20761-1-2-20210518.pdf
AAAI,2021,hierarchical_graph_capsule_network__c5781d35.pdf,Hierarchical Graph Capsule Network,"Jinyu Yang, Peilin Zhao, Yu Rong, Chaochao Yan, Chunyuan Li, Hehuan Ma, Junzhou Huang10603-10611",AAAI Technical Track on Machine Learning V,https://cdn.aaai.org/ojs/17268/17268-13-20762-1-2-20210518.pdf
AAAI,2021,fracbits_mixed_precision_quantization_via_fractional_bitwidths__4e8bf7a1.pdf,FracBits: Mixed Precision Quantization via Fractional Bit-Widths,"Linjie Yang, Qing Jin10612-10620",AAAI Technical Track on Machine Learning V,https://cdn.aaai.org/ojs/17269/17269-13-20763-1-2-20210518.pdf
AAAI,2021,on_convergence_of_gradient_expected_sarsaλ__e03cf275.pdf,On Convergence of Gradient Expected Sarsa(λ),"Long Yang, Gang Zheng, Yu Zhang, Qian Zheng, Pengfei Li, Gang Pan10621-10629",AAAI Technical Track on Machine Learning V,https://cdn.aaai.org/ojs/17270/17270-13-20764-1-2-20210518.pdf
AAAI,2021,sample_complexity_of_policy_gradient_finding_secondorder_stationary_points__15b458a0.pdf,Sample Complexity of Policy Gradient Finding Second-Order Stationary Points,"Long Yang, Qian Zheng, Gang Pan10630-10638",AAAI Technical Track on Machine Learning V,https://cdn.aaai.org/ojs/17271/17271-13-20765-1-2-20210518.pdf
AAAI,2021,wcsac_worstcase_soft_actor_critic_for_safetyconstrained_reinforcement_learning__bb1113ba.pdf,WCSAC: Worst-Case Soft Actor Critic for Safety-Constrained Reinforcement Learning,"Qisong Yang, Thiago D. Simão, Simon H Tindemans, Matthijs  T. J. Spaan10639-10646",AAAI Technical Track on Machine Learning V,https://cdn.aaai.org/ojs/17272/17272-13-20766-1-2-20210518.pdf
AAAI,2021,characterizing_the_evasion_attackability_of_multilabel_classifiers__18ad4cbf.pdf,Characterizing the Evasion Attackability of Multi-label Classifiers,"Zhuo Yang, Yufei Han, Xiangliang Zhang10647-10655",AAAI Technical Track on Machine Learning V,https://cdn.aaai.org/ojs/17273/17273-13-20767-1-2-20210518.pdf
AAAI,2021,seco_exploring_sequence_supervision_for_unsupervised_representation_learning__fa5ea135.pdf,SeCo: Exploring Sequence Supervision for Unsupervised Representation Learning,"Ting Yao, Yiheng Zhang, Zhaofan Qiu, Yingwei Pan, Tao Mei10656-10664",AAAI Technical Track on Machine Learning V,https://cdn.aaai.org/ojs/17274/17274-13-20768-1-2-20210518.pdf
AAAI,2021,adahessian_an_adaptive_second_order_optimizer_for_machine_learning__b46fd732.pdf,ADAHESSIAN: An Adaptive Second Order Optimizer for Machine Learning,"Zhewei Yao, Amir Gholami, Sheng Shen, Mustafa Mustafa, Kurt Keutzer, Michael Mahoney10665-10673",AAAI Technical Track on Machine Learning V,https://cdn.aaai.org/ojs/17275/17275-13-20769-1-2-20210518.pdf
AAAI,2021,improving_sample_efficiency_in_modelfree_reinforcement_learning_from_images__31c472a4.pdf,Improving Sample Efficiency in Model-Free Reinforcement Learning from Images,"Denis Yarats, Amy Zhang, Ilya Kostrikov, Brandon Amos, Joelle Pineau, Rob Fergus10674-10681",AAAI Technical Track on Machine Learning V,https://cdn.aaai.org/ojs/17276/17276-13-20770-1-2-20210518.pdf
AAAI,2021,task_cooperation_for_semisupervised_fewshot_learning__17ac56fd.pdf,Task Cooperation for Semi-Supervised Few-Shot Learning,"Han-Jia Ye, Xin-Chun Li, De-Chuan Zhan10682-10690",AAAI Technical Track on Machine Learning V,https://cdn.aaai.org/ojs/17277/17277-13-20771-1-2-20210518.pdf
AAAI,2021,amata_an_annealing_mechanism_for_adversarial_training_acceleration__2889784e.pdf,Amata: An Annealing Mechanism for Adversarial Training Acceleration,"Nanyang Ye, Qianxiao Li, Xiao-Yun Zhou, Zhanxing Zhu10691-10699",AAAI Technical Track on Machine Learning V,https://cdn.aaai.org/ojs/17278/17278-13-20772-1-2-20210518.pdf
AAAI,2021,sequential_generative_exploration_model_for_partially_observable_reinforcement_learning__de734111.pdf,Sequential Generative Exploration Model for Partially Observable Reinforcement Learning,"Haiyan Yin, Jianda Chen, Sinno Jialin Pan, Sebastian Tschiatschek10700-10708",AAAI Technical Track on Machine Learning V,https://cdn.aaai.org/ojs/17279/17279-13-20773-1-2-20210518.pdf
AAAI,2021,enhanced_audio_tagging_via_multi_to_singlemodal_teacherstudent_mutual_learning__59d9fad6.pdf,Enhanced Audio Tagging via Multi- to Single-Modal Teacher-Student Mutual Learning,"Yifang Yin, Harsh Shrivastava, Ying Zhang, Zhenguang Liu, Rajiv Ratn Shah, Roger Zimmermann10709-10717",AAAI Technical Track on Machine Learning V,https://cdn.aaai.org/ojs/17280/17280-13-20774-1-2-20210518.pdf
AAAI,2021,imagetoimage_retrieval_by_learning_similarity_between_scene_graphs__832df19c.pdf,Image-to-Image Retrieval by Learning Similarity between Scene Graphs,"Sangwoong Yoon, Woo Young Kang, Sungwook Jeon, SeongEun Lee, Changjin Han, Jonghun Park, Eun-Sol Kim10718-10726",AAAI Technical Track on Machine Learning V,https://cdn.aaai.org/ojs/17281/17281-13-20775-1-2-20210518.pdf
AAAI,2021,learning_interpretable_models_for_coupled_networks_under_domain_constraints__0a94bc6c.pdf,Learning Interpretable Models for Coupled Networks Under Domain Constraints,"Hongyuan You, Sikun Lin, Ambuj Singh10727-10736",AAAI Technical Track on Machine Learning V,https://cdn.aaai.org/ojs/17282/17282-13-20776-1-2-20210518.pdf
AAAI,2021,neural_architecture_search_as_sparse_supernet__39f3391e.pdf,Neural Architecture Search as Sparse Supernet,"Yan Wu, Aoming Liu, Zhiwu Huang, Siwei Zhang, Luc Van Gool10379-10387",AAAI Technical Track on Machine Learning V,https://cdn.aaai.org/ojs/17243/17243-13-20737-1-2-20210518.pdf
AAAI,2021,learning_to_purify_noisy_labels_via_meta_soft_label_corrector__9ffee8cf.pdf,Learning to Purify Noisy Labels via Meta Soft Label Corrector,"Yichen Wu, Jun Shu, Qi Xie, Qian Zhao, Deyu Meng10388-10396",AAAI Technical Track on Machine Learning V,https://cdn.aaai.org/ojs/17244/17244-13-20738-1-2-20210518.pdf
AAAI,2021,nearoptimal_mnl_bandits_under_risk_criteria__217cc6f6.pdf,Near-Optimal MNL Bandits Under Risk Criteria,"Guangyu Xi, Chao Tao, Yuan Zhou10397-10404",AAAI Technical Track on Machine Learning V,https://cdn.aaai.org/ojs/17245/17245-13-20739-1-2-20210518.pdf
AAAI,2021,communicationefficient_frankwolfe_algorithm_for_nonconvex_decentralized_distributed_learning__ddb10491.pdf,Communication-Efficient Frank-Wolfe Algorithm for Nonconvex Decentralized Distributed Learning,"Wenhan Xian, Feihu Huang, Heng Huang10405-10413",AAAI Technical Track on Machine Learning V,https://cdn.aaai.org/ojs/17246/17246-13-20740-1-2-20210518.pdf
AAAI,2021,physicsconstrained_automatic_feature_engineering_for_predictive_modeling_in_materials_science__2421c751.pdf,Physics-constrained Automatic Feature Engineering for Predictive Modeling in Materials Science,"Ziyu Xiang, Mingzhou Fan, Guillermo Vázquez Tovar, William Trehern, Byung-Jun Yoon, Xiaofeng Qian, Raymundo Arroyave, Xiaoning Qian10414-10421",AAAI Technical Track on Machine Learning V,https://cdn.aaai.org/ojs/17247/17247-13-20741-1-2-20210518.pdf
AAAI,2021,distant_transfer_learning_via_deep_random_walk__f6e44a04.pdf,Distant Transfer Learning via Deep Random Walk,"Qiao Xiao, Yu Zhang10422-10429",AAAI Technical Track on Machine Learning V,https://cdn.aaai.org/ojs/17248/17248-13-20742-1-2-20210518.pdf
AAAI,2021,learning_cycleconsistent_cooperative_networks_via_alternating_mcmc_teaching_for_unsupervised_crossdomain_translation__b2f2d7b6.pdf,Learning Cycle-Consistent Cooperative Networks via Alternating MCMC Teaching for Unsupervised Cross-Domain Translation,"Jianwen Xie, Zilong Zheng, Xiaolin Fang, Song-Chun Zhu, Ying Nian Wu10430-10440",AAAI Technical Track on Machine Learning V,https://cdn.aaai.org/ojs/17249/17249-13-20743-1-2-20210518.pdf
AAAI,2021,learning_energybased_model_with_variational_autoencoder_as_amortized_sampler__ac50fd07.pdf,Learning Energy-Based Model with Variational Auto-Encoder as Amortized Sampler,"Jianwen Xie, Zilong Zheng, Ping Li10441-10451",AAAI Technical Track on Machine Learning V,https://cdn.aaai.org/ojs/17250/17250-13-20744-1-2-20210518.pdf
AAAI,2021,domain_adaptation_in_reinforcement_learning_via_latent_unified_state_representation__93a278b3.pdf,Domain Adaptation In Reinforcement Learning Via Latent Unified State Representation,"Jinwei Xing, Takashi Nagata, Kexin Chen, Xinyun Zou, Emre Neftci, Jeffrey L. Krichmar10452-10459",AAAI Technical Track on Machine Learning V,https://cdn.aaai.org/ojs/17251/17251-13-20745-1-2-20210518.pdf
AAAI,2021,nonasymptotic_convergence_of_adamtype_reinforcement_learning_algorithms_under_markovian_sampling__305b3055.pdf,Non-asymptotic Convergence of Adam-type Reinforcement Learning Algorithms under Markovian Sampling,"Huaqing Xiong, Tengyu Xu, Yingbin Liang, Wei  Zhang10460-10468",AAAI Technical Track on Machine Learning V,https://cdn.aaai.org/ojs/17252/17252-13-20746-1-2-20210518.pdf
AAAI,2021,variational_disentanglement_for_rare_event_modeling__7e6a3ca6.pdf,Variational Disentanglement for Rare Event Modeling,"Zidi Xiu, Chenyang Tao, Michael Gao, Connor Davis, Benjamin A. Goldstein, Ricardo Henao10469-10477",AAAI Technical Track on Machine Learning V,https://cdn.aaai.org/ojs/17253/17253-13-20747-1-2-20210518.pdf
AAAI,2021,stepahead_error_feedback_for_distributed_training_with_compressed_gradient__3d88b58a.pdf,Step-Ahead Error Feedback for Distributed Training with Compressed Gradient,"An Xu, Zhouyuan Huo, Heng Huang10478-10486",AAAI Technical Track on Machine Learning V,https://cdn.aaai.org/ojs/17254/17254-13-20748-1-2-20210518.pdf
AAAI,2021,isolation_graph_kernel__9f2be93d.pdf,Isolation Graph Kernel,"Bi-Cun Xu, Kai Ming Ting, Yuan Jiang10487-10495",AAAI Technical Track on Machine Learning V,https://cdn.aaai.org/ojs/17255/17255-13-20749-1-2-20210518.pdf
AAAI,2021,multitask_recurrent_modular_networks__b2ba6d51.pdf,Multi-Task Recurrent Modular Networks,"Dongkuan Xu, Wei Cheng, Xin Dong, Bo Zong, Wenchao Yu, Jingchao Ni, Dongjin Song, Xuchao Zhang, Haifeng Chen, Xiang Zhang10496-10504",AAAI Technical Track on Machine Learning V,https://cdn.aaai.org/ojs/17256/17256-13-20750-1-2-20210518.pdf
AAAI,2021,learning_graphons_via_structured_gromovwasserstein_barycenters__20b22bbe.pdf,Learning Graphons via Structured Gromov-Wasserstein Barycenters,"Hongteng Xu, Dixin Luo, Lawrence Carin, Hongyuan Zha10505-10513",AAAI Technical Track on Machine Learning V,https://cdn.aaai.org/ojs/17257/17257-13-20751-1-2-20210518.pdf
AAAI,2021,towards_generalized_implementation_of_wasserstein_distance_in_gans__e8219499.pdf,Towards Generalized Implementation of Wasserstein Distance in GANs,Minkai Xu10514-10522,AAAI Technical Track on Machine Learning V,https://cdn.aaai.org/ojs/17258/17258-13-20752-1-2-20210518.pdf
AAAI,2021,towards_feature_space_adversarial_attack_by_style_perturbation__3588c47a.pdf,Towards Feature Space Adversarial Attack by Style Perturbation,"Qiuling Xu, Guanhong Tao, Siyuan Cheng, Xiangyu Zhang10523-10531",AAAI Technical Track on Machine Learning V,https://cdn.aaai.org/ojs/17259/17259-13-20753-1-2-20210518.pdf
AAAI,2021,mufasa_multimodal_fusion_architecture_search_for_electronic_health_records__760df68c.pdf,MUFASA: Multimodal Fusion Architecture Search for Electronic Health Records,"Zhen Xu, David R. So, Andrew  M. Dai10532-10540",AAAI Technical Track on Machine Learning V,https://cdn.aaai.org/ojs/17260/17260-13-20754-1-2-20210518.pdf
AAAI,2021,deep_frequency_principle_towards_understanding_why_deeper_learning_is_faster__4b950da5.pdf,Deep Frequency Principle Towards Understanding Why Deeper Learning Is Faster,"Zhiqin John Xu, Hanxu Zhou10541-10550",AAAI Technical Track on Machine Learning V,https://cdn.aaai.org/ojs/17261/17261-13-20755-1-2-20210518.pdf
AAAI,2021,rethinking_bilevel_optimization_in_neural_architecture_search_a_gibbs_sampling_perspective__e35ec2c0.pdf,Rethinking Bi-Level Optimization in Neural Architecture Search: A Gibbs Sampling Perspective,"Chao Xue, Xiaoxing Wang, Junchi Yan, Yonggang Hu, Xiaokang Yang, Kewei Sun10551-10559",AAAI Technical Track on Machine Learning V,https://cdn.aaai.org/ojs/17262/17262-13-20756-1-2-20210518.pdf
AAAI,2021,learning_set_functions_that_are_sparse_in_nonorthogonal_fourier_bases__dbe2be26.pdf,Learning Set Functions that are Sparse in Non-Orthogonal Fourier Bases,"Chris Wendler, Andisheh Amrollahi, Bastian Seifert, Andreas Krause, Markus Püschel10283-10292",AAAI Technical Track on Machine Learning V,https://cdn.aaai.org/ojs/17232/17232-13-20726-1-2-20210518.pdf
AAAI,2021,bananas_bayesian_optimization_with_neural_architectures_for_neural_architecture_search__2697023b.pdf,BANANAS: Bayesian Optimization with Neural Architectures for Neural Architecture Search,"Colin White, Willie Neiswanger, Yash Savani10293-10301",AAAI Technical Track on Machine Learning V,https://cdn.aaai.org/ojs/17233/17233-13-20727-1-2-20210518.pdf
AAAI,2021,peer_collaborative_learning_for_online_knowledge_distillation__16bc8bdc.pdf,Peer Collaborative Learning for Online Knowledge Distillation,"Guile Wu, Shaogang Gong10302-10310",AAAI Technical Track on Machine Learning V,https://cdn.aaai.org/ojs/17234/17234-13-20728-1-2-20210518.pdf
AAAI,2021,selfsupervised_attentionaware_reinforcement_learning__c6f262b4.pdf,Self-Supervised Attention-Aware Reinforcement Learning,"Haiping Wu, Khimya Khetarpal, Doina Precup10311-10319",AAAI Technical Track on Machine Learning V,https://cdn.aaai.org/ojs/17235/17235-13-20729-1-2-20210518.pdf
AAAI,2021,training_spiking_neural_networks_with_accumulated_spiking_flow__4bfa7ee7.pdf,Training Spiking Neural Networks with Accumulated Spiking Flow,"Hao Wu, Yueyi Zhang, Wenming Weng, Yongting Zhang, Zhiwei Xiong, Zheng-Jun Zha, Xiaoyan Sun, Feng Wu10320-10328",AAAI Technical Track on Machine Learning V,https://cdn.aaai.org/ojs/17236/17236-13-20730-1-2-20210518.pdf
AAAI,2021,fast_and_scalable_adversarial_training_of_kernel_svm_via_doubly_stochastic_gradients__66641bbe.pdf,Fast and Scalable Adversarial Training of Kernel SVM via Doubly Stochastic Gradients,"Huimin Wu, Zhengmian Hu, Bin Gu10329-10337",AAAI Technical Track on Machine Learning V,https://cdn.aaai.org/ojs/17237/17237-13-20731-1-2-20210518.pdf
AAAI,2021,finegrained_generalization_analysis_of_vectorvalued_learning__a651a490.pdf,Fine-grained Generalization Analysis of Vector-Valued Learning,"Liang Wu, Antoine Ledent, Yunwen Lei, Marius Kloft10338-10346",AAAI Technical Track on Machine Learning V,https://cdn.aaai.org/ojs/17238/17238-13-20732-1-2-20210518.pdf
AAAI,2021,frugal_optimization_for_costrelated_hyperparameters__26e17be1.pdf,Frugal Optimization for Cost-related Hyperparameters,"Qingyun Wu, Chi Wang, Silu Huang10347-10354",AAAI Technical Track on Machine Learning V,https://cdn.aaai.org/ojs/17239/17239-13-20733-1-2-20210518.pdf
AAAI,2021,federated_block_coordinate_descent_scheme_for_learning_global_and_personalized_models__6b041bdd.pdf,Federated Block Coordinate Descent Scheme for Learning Global and Personalized Models,"Ruiyuan Wu, Anna Scaglione, Hoi-To Wai, Nurullah Karakoc, Kari Hreinsson, Wing-Kin Ma10355-10362",AAAI Technical Track on Machine Learning V,https://cdn.aaai.org/ojs/17240/17240-13-20734-1-2-20210518.pdf
AAAI,2021,curriculummeta_learning_for_orderrobust_continual_relation_extraction__6d56e691.pdf,Curriculum-Meta Learning for Order-Robust Continual Relation Extraction,"Tongtong Wu, Xuekai Li, Yuan-Fang Li, Gholamreza Haffari, Guilin Qi, Yujin Zhu, Guoqiang Xu10363-10369",AAAI Technical Track on Machine Learning V,https://cdn.aaai.org/ojs/17241/17241-13-20735-1-2-20210518.pdf
AAAI,2021,fractal_autoencoders_for_feature_selection__bcb9303d.pdf,Fractal Autoencoders for Feature Selection,"Xinxing Wu, Qiang Cheng10370-10378",AAAI Technical Track on Machine Learning V,https://cdn.aaai.org/ojs/17242/17242-13-20736-1-2-20210518.pdf
