Conference,Year,Filename,Title,Authors,Category,PDF_URL
AAAI,2021,provable_benefits_of_overparameterization_in_model_compression_from_double_descent_to_pruning_neural_networks__08b39238.pdf,Provable Benefits of Overparameterization in Model Compression: From Double Descent to Pruning Neural Networks,"Xiangyu Chang, Yingcong Li, Samet Oymak, Christos Thrampoulidis6974-6983",AAAI Technical Track on Machine Learning I,https://cdn.aaai.org/ojs/16859/16859-13-20353-1-2-20210518.pdf
AAAI,2021,differentially_private_decomposable_submodular_maximization__082f6e52.pdf,Differentially Private Decomposable Submodular Maximization,"Anamay Chaturvedi, Huy Lê Nguyễn, Lydia Zakynthinou6984-6992",AAAI Technical Track on Machine Learning I,https://cdn.aaai.org/ojs/16860/16860-13-20354-1-2-20210518.pdf
AAAI,2021,using_hindsight_to_anchor_past_knowledge_in_continual_learning__576a813d.pdf,Using Hindsight to Anchor Past Knowledge in Continual Learning,"Arslan Chaudhry, Albert Gordo, Puneet Dokania, Philip Torr, David Lopez-Paz6993-7001",AAAI Technical Track on Machine Learning I,https://cdn.aaai.org/ojs/16861/16861-13-20355-1-2-20210518.pdf
AAAI,2021,deep_verifier_networks_verification_of_deep_discriminative_models_with_deep_generative_models__887e3904.pdf,Deep Verifier Networks: Verification of Deep Discriminative Models with Deep Generative Models,"Tong Che, Xiaofeng Liu, Site Li, Yubin Ge, Ruixiang Zhang, Caiming Xiong, Yoshua Bengio7002-7010",AAAI Technical Track on Machine Learning I,https://cdn.aaai.org/ojs/16862/16862-13-20356-1-2-20210518.pdf
AAAI,2021,an_enhanced_advising_model_in_teacherstudent_framework_using_state_categorization__bea946ca.pdf,An Enhanced Advising Model in Teacher-Student Framework using State Categorization,"Daksh Anand, Vaibhav Gupta, Praveen Paruchuri, Balaraman Ravindran6653-6660",AAAI Technical Track on Machine Learning I,https://cdn.aaai.org/ojs/16823/16823-13-20317-1-2-20210518.pdf
AAAI,2021,on_lipschitz_regularization_of_convolutional_layers_using_toeplitz_matrix_theory__88377ec9.pdf,On Lipschitz Regularization of Convolutional Layers using Toeplitz Matrix Theory,"Alexandre Araujo, Benjamin Negrevergne, Yann Chevaleyre, Jamal Atif6661-6669",AAAI Technical Track on Machine Learning I,https://cdn.aaai.org/ojs/16824/16824-13-20318-1-2-20210518.pdf
AAAI,2021,the_tractability_of_shapscorebased_explanations_for_classification_over_deterministic_and_decomposable_boolean_circuits__f646627a.pdf,The Tractability of SHAP-Score-Based Explanations for Classification over Deterministic and Decomposable Boolean Circuits,"Marcelo Arenas, Pablo Barceló, Leopoldo Bertossi, Mikaël Monet6670-6678",AAAI Technical Track on Machine Learning I,https://cdn.aaai.org/ojs/16825/16825-13-20319-1-2-20210518.pdf
AAAI,2021,tabnet_attentive_interpretable_tabular_learning__326ef790.pdf,TabNet: Attentive Interpretable Tabular Learning,"Sercan Ö. Arik, Tomas Pfister6679-6687",AAAI Technical Track on Machine Learning I,https://cdn.aaai.org/ojs/16826/16826-13-20320-1-2-20210518.pdf
AAAI,2021,robust_model_compression_using_deep_hypotheses__dbd6d19f.pdf,Robust Model Compression Using Deep Hypotheses,"Omri Armstrong, Ran Gilad-Bachrach6688-6695",AAAI Technical Track on Machine Learning I,https://cdn.aaai.org/ojs/16827/16827-13-20321-1-2-20210518.pdf
AAAI,2021,deep_radialbasis_value_functions_for_continuous_control__d70cec71.pdf,Deep Radial-Basis Value Functions for Continuous Control,"Kavosh Asadi, Neev Parikh, Ronald E. Parr, George D. Konidaris, Michael L. Littman6696-6704",AAAI Technical Track on Machine Learning I,https://cdn.aaai.org/ojs/16828/16828-13-20322-1-2-20210518.pdf
AAAI,2021,decaug_outofdistribution_generalization_via_decomposed_feature_representation_and_semantic_augmentation__faa69b16.pdf,DecAug: Out-of-Distribution Generalization via Decomposed Feature Representation and Semantic Augmentation,"Haoyue Bai, Rui Sun, Lanqing Hong, Fengwei Zhou, Nanyang Ye, Han-Jia Ye, S.-H. Gary Chan, Zhenguo Li6705-6713",AAAI Technical Track on Machine Learning I,https://cdn.aaai.org/ojs/16829/16829-13-20323-1-2-20210518.pdf
AAAI,2021,correlative_channelaware_fusion_for_multiview_time_series_classification__7fd4dcd0.pdf,Correlative Channel-Aware Fusion for Multi-View Time Series Classification,"Yue Bai, Lichen Wang, Zhiqiang Tao, Sheng Li, Yun Fu6714-6722",AAAI Technical Track on Machine Learning I,https://cdn.aaai.org/ojs/16830/16830-13-20324-1-2-20210518.pdf
AAAI,2021,deterministic_minibatch_sequencing_for_training_deep_neural_networks__44d9e24b.pdf,Deterministic Mini-batch Sequencing for Training Deep Neural Networks,"Subhankar Banerjee, Shayok Chakraborty6723-6731",AAAI Technical Track on Machine Learning I,https://cdn.aaai.org/ojs/16831/16831-13-20325-1-2-20210518.pdf
AAAI,2021,relative_variational_intrinsic_control__bdf1135d.pdf,Relative Variational Intrinsic Control,"Kate Baumli, David Warde-Farley, Steven Hansen, Volodymyr Mnih6732-6740",AAAI Technical Track on Machine Learning I,https://cdn.aaai.org/ojs/16832/16832-13-20326-1-2-20210518.pdf
AAAI,2021,a_theory_of_independent_mechanisms_for_extrapolation_in_generative_models__2867bc4d.pdf,A Theory of Independent Mechanisms for Extrapolation in Generative Models,"Michel Besserve, Remy Sun, Dominik Janzing, Bernhard Schölkopf6741-6749",AAAI Technical Track on Machine Learning I,https://cdn.aaai.org/ojs/16833/16833-13-20327-1-2-20210518.pdf
AAAI,2021,exgan_adversarial_generation_of_extreme_samples__32b58bb5.pdf,ExGAN: Adversarial Generation of Extreme Samples,"Siddharth Bhatia, Arjit Jain, Bryan Hooi6750-6758",AAAI Technical Track on Machine Learning I,https://cdn.aaai.org/ojs/16834/16834-13-20328-1-2-20210518.pdf
AAAI,2021,ordinal_historical_dependence_in_graphical_event_models_with_tree_representations__fb92f7e3.pdf,Ordinal Historical Dependence in Graphical Event Models with Tree Representations,"Debarun Bhattacharjya, Tian Gao, Dharmashankar Subramanian6759-6767",AAAI Technical Track on Machine Learning I,https://cdn.aaai.org/ojs/16835/16835-13-20329-1-2-20210518.pdf
AAAI,2021,characterizing_the_loss_landscape_in_nonnegative_matrix_factorization__8010a771.pdf,Characterizing the Loss Landscape in Non-Negative Matrix Factorization,"Johan Bjorck, Anmol Kabra, Kilian Q. Weinberger, Carla Gomes6768-6776",AAAI Technical Track on Machine Learning I,https://cdn.aaai.org/ojs/16836/16836-13-20330-1-2-20210518.pdf
AAAI,2021,understanding_decoupled_and_early_weight_decay__04b602ce.pdf,Understanding Decoupled and Early Weight Decay,"Johan Bjorck, Kilian Q. Weinberger, Carla Gomes6777-6785",AAAI Technical Track on Machine Learning I,https://cdn.aaai.org/ojs/16837/16837-13-20331-1-2-20210518.pdf
AAAI,2021,communicationaware_collaborative_learning__11834cb5.pdf,Communication-Aware Collaborative Learning,"Avrim Blum, Shelby Heinecke, Lev Reyzin6786-6793",AAAI Technical Track on Machine Learning I,https://cdn.aaai.org/ojs/16838/16838-13-20332-1-2-20210518.pdf
AAAI,2021,stochastic_precision_ensemble_selfknowledge_distillation_for_quantized_deep_neural_networks__4ff19992.pdf,Stochastic Precision Ensemble: Self-Knowledge Distillation for Quantized Deep Neural Networks,"Yoonho Boo, Sungho Shin, Jungwook Choi, Wonyong Sung6794-6802",AAAI Technical Track on Machine Learning I,https://cdn.aaai.org/ojs/16839/16839-13-20333-1-2-20210518.pdf
AAAI,2021,fast_training_of_provably_robust_neural_networks_by_singleprop__27d124a3.pdf,Fast Training of Provably Robust Neural Networks by SingleProp,"Akhilan Boopathy, Lily Weng, Sijia Liu, Pin-Yu Chen, Gaoyuan Zhang, Luca Daniel6803-6811",AAAI Technical Track on Machine Learning I,https://cdn.aaai.org/ojs/16840/16840-13-20334-1-2-20210518.pdf
AAAI,2021,samplespecific_output_constraints_for_neural_networks__aef50896.pdf,Sample-Specific Output Constraints for Neural Networks,"Mathis Brosowsky, Florian Keck, Olaf Dünkel, Marius Zöllner6812-6821",AAAI Technical Track on Machine Learning I,https://cdn.aaai.org/ojs/16841/16841-13-20335-1-2-20210518.pdf
AAAI,2021,fairness_semisupervised_learning_and_more_a_general_framework_for_clustering_with_stochastic_pairwise_constraints__b9b9ad58.pdf,"Fairness, Semi-Supervised Learning, and More: A General Framework for Clustering with Stochastic Pairwise Constraints","Brian Brubach, Darshan Chakrabarti, John P. Dickerson, Aravind Srinivasan, Leonidas Tsepenekas6822-6830",AAAI Technical Track on Machine Learning I,https://cdn.aaai.org/ojs/16842/16842-13-20336-1-2-20210518.pdf
AAAI,2021,swift_scalable_wasserstein_factorization_for_sparse_nonnegative_tensors__5e7ef2b7.pdf,SWIFT: Scalable Wasserstein Factorization for Sparse Nonnegative Tensors,"Ardavan Afshar, Kejing Yin, Sherry Yan, Cheng Qian, Joyce Ho, Haesun Park, Jimeng Sun6548-6556",AAAI Technical Track on Machine Learning I,https://cdn.aaai.org/ojs/16811/16811-13-20305-1-2-20210518.pdf
AAAI,2021,dart_adaptive_accept_reject_algorithm_for_nonlinear_combinatorial_bandits__92b09a83.pdf,DART: Adaptive Accept Reject Algorithm for Non-Linear Combinatorial Bandits,"Mridul Agarwal, Vaneet Aggarwal, Abhishek Kumar Umrawal, Chris Quinn6557-6565",AAAI Technical Track on Machine Learning I,https://cdn.aaai.org/ojs/16812/16812-13-20306-1-2-20210518.pdf
AAAI,2021,improved_worstcase_regret_bounds_for_randomized_leastsquares_value_iteration__aa36e86b.pdf,Improved Worst-Case Regret Bounds for Randomized Least-Squares Value Iteration,"Priyank Agrawal, Jinglin Chen, Nan Jiang6566-6573",AAAI Technical Track on Machine Learning I,https://cdn.aaai.org/ojs/16813/16813-13-20307-1-2-20210518.pdf
AAAI,2021,semisupervised_sequence_classification_through_change_point_detection__68568b35.pdf,Semi-supervised Sequence Classification through Change Point Detection,"Nauman Ahad, Mark A. Davenport6574-6581",AAAI Technical Track on Machine Learning I,https://cdn.aaai.org/ojs/16814/16814-13-20308-1-2-20210518.pdf
AAAI,2021,learning_invariant_representations_using_inverse_contrastive_loss__ae0ad441.pdf,Learning Invariant Representations using Inverse  Contrastive Loss,"Aditya Kumar Akash, Vishnu  Suresh Lokhande, Sathya N. Ravi, Vikas Singh6582-6591",AAAI Technical Track on Machine Learning I,https://cdn.aaai.org/ojs/16815/16815-13-20309-1-2-20210518.pdf
AAAI,2021,learned_biresolution_image_coding_using_generalized_octave_convolutions__e57c44cf.pdf,Learned Bi-Resolution Image Coding using Generalized Octave Convolutions,"Mohammad Akbari, Jie Liang, Jingning Han, Chengjie Tu6592-6599",AAAI Technical Track on Machine Learning I,https://cdn.aaai.org/ojs/16816/16816-13-20310-1-2-20210518.pdf
AAAI,2021,deep_bayesian_quadrature_policy_optimization__7cb25676.pdf,Deep Bayesian Quadrature Policy Optimization,"Ravi Tej Akella, Kamyar Azizzadenesheli, Mohammad Ghavamzadeh, Animashree Anandkumar, Yisong Yue6600-6608",AAAI Technical Track on Machine Learning I,https://cdn.aaai.org/ojs/16817/16817-13-20311-1-2-20210518.pdf
AAAI,2021,etree_learning_treestructured_embeddings__f1386cc2.pdf,eTREE: Learning Tree-structured Embeddings,"Faisal M. Almutairi, Yunlong Wang, Dong Wang, Emily Zhao, Nicholas D. Sidiropoulos6609-6617",AAAI Technical Track on Machine Learning I,https://cdn.aaai.org/ojs/16818/16818-13-20312-1-2-20210518.pdf
AAAI,2021,does_explainable_artificial_intelligence_improve_human_decisionmaking__569b4402.pdf,Does Explainable Artificial Intelligence Improve Human Decision-Making?,"Yasmeen Alufaisan, Laura R. Marusich, Jonathan Z. Bakdash, Yan Zhou, Murat Kantarcioglu6618-6626",AAAI Technical Track on Machine Learning I,https://cdn.aaai.org/ojs/16819/16819-13-20313-1-2-20210518.pdf
AAAI,2021,decentralized_multiagent_linear_bandits_with_safety_constraints__1b6d740b.pdf,Decentralized Multi-Agent Linear Bandits with Safety Constraints,"Sanae Amani, Christos Thrampoulidis6627-6635",AAAI Technical Track on Machine Learning I,https://cdn.aaai.org/ojs/16820/16820-13-20314-1-2-20210518.pdf
AAAI,2021,computing_an_efficient_exploration_basis_for_learning_with_univariate_polynomial_features__99a2bdcd.pdf,Computing an Efficient Exploration Basis for Learning with Univariate Polynomial Features,"Chaitanya Amballa, Manu K. Gupta, Sanjay P. Bhat6636-6643",AAAI Technical Track on Machine Learning I,https://cdn.aaai.org/ojs/16821/16821-13-20315-1-2-20210518.pdf
AAAI,2021,noise_estimation_using_density_estimation_for_selfsupervised_multimodal_learning__c05fa8d0.pdf,Noise Estimation Using Density Estimation for Self-Supervised Multimodal Learning,"Elad Amrani, Rami Ben-Ari, Daniel Rotman, Alex Bronstein6644-6652",AAAI Technical Track on Machine Learning I,https://cdn.aaai.org/ojs/16822/16822-13-20316-1-2-20210518.pdf
AAAI,2021,hypothesis_disparity_regularized_mutual_information_maximization__397310a5.pdf,Hypothesis Disparity Regularized Mutual Information Maximization,"Qicheng Lao, Xiang Jiang, Mohammad Havaei8243-8251",AAAI Technical Track on Machine Learning II,https://cdn.aaai.org/ojs/17003/17003-13-20497-1-2-20210518.pdf
AAAI,2021,query_training_learning_a_worse_model_to_infer_better_marginals_in_undirected_graphical_models_with_hidden_variables__ed6c31df.pdf,Query Training: Learning a Worse Model to Infer Better Marginals in Undirected Graphical Models with Hidden Variables,"Miguel Lázaro-Gredilla, Wolfgang Lehrach, Nishad Gothoskar, Guangyao Zhou, Antoine Dedieu, Dileep George8252-8260",AAAI Technical Track on Machine Learning II,https://cdn.aaai.org/ojs/17004/17004-13-20498-1-2-20210518.pdf
AAAI,2021,metrics_and_continuity_in_reinforcement_learning__1960888a.pdf,Metrics and Continuity in Reinforcement Learning,"Charline Le Lan, Marc G. Bellemare, Pablo Samuel Castro8261-8269",AAAI Technical Track on Machine Learning II,https://cdn.aaai.org/ojs/17005/17005-13-20499-1-2-20210518.pdf
AAAI,2021,lipschitz_lifelong_reinforcement_learning__165be451.pdf,Lipschitz Lifelong Reinforcement Learning,"Erwan Lecarpentier, David Abel, Kavosh Asadi, Yuu Jinnai, Emmanuel Rachelson, Michael L. Littman8270-8278",AAAI Technical Track on Machine Learning II,https://cdn.aaai.org/ojs/17006/17006-13-20500-1-2-20210518.pdf
AAAI,2021,normbased_generalisation_bounds_for_deep_multiclass_convolutional_neural_networks__74dab2b7.pdf,Norm-Based Generalisation Bounds for Deep Multi-Class Convolutional Neural Networks,"Antoine Ledent, Waleed Mustafa, Yunwen Lei, Marius Kloft8279-8287",AAAI Technical Track on Machine Learning II,https://cdn.aaai.org/ojs/17007/17007-13-20501-1-2-20210518.pdf
AAAI,2021,learnable_dynamic_temporal_pooling_for_time_series_classification__b65a8f15.pdf,Learnable Dynamic Temporal Pooling for Time Series Classification,"Dongha Lee, Seonghyeon Lee, Hwanjo Yu8288-8296",AAAI Technical Track on Machine Learning II,https://cdn.aaai.org/ojs/17008/17008-13-20502-1-2-20210518.pdf
AAAI,2021,interpretable_embedding_procedure_knowledge_transfer_via_stacked_principal_component_analysis_and_graph_neural_network__f95bc23c.pdf,Interpretable Embedding Procedure Knowledge Transfer via Stacked Principal Component Analysis and Graph Neural Network,"Seunghyun Lee, Byung Cheol Song8297-8305",AAAI Technical Track on Machine Learning II,https://cdn.aaai.org/ojs/17009/17009-13-20503-1-2-20210518.pdf
AAAI,2021,unsupervised_domain_adaptation_for_semantic_segmentation_by_content_transfer__9abc8e67.pdf,Unsupervised Domain Adaptation for Semantic Segmentation by Content Transfer,"Suhyeon Lee, Junhyuk Hyun, Hongje Seong, Euntai Kim8306-8315",AAAI Technical Track on Machine Learning II,https://cdn.aaai.org/ojs/17010/17010-13-20504-1-2-20210518.pdf
AAAI,2021,memory_and_computationefficient_kernel_svm_via_binary_embedding_and_ternary_model_coefficients__c3db5154.pdf,Memory and Computation-Efficient Kernel SVM via Binary Embedding and Ternary Model Coefficients,"Zijian Lei, Liang Lan8316-8323",AAAI Technical Track on Machine Learning II,https://cdn.aaai.org/ojs/17011/17011-13-20505-1-2-20210518.pdf
AAAI,2021,enhancing_parameterfree_frank_wolfe_with_an_extra_subproblem__bd039642.pdf,Enhancing Parameter-Free Frank Wolfe with an Extra Subproblem,"Bingcong Li, Lingda Wang, Georgios B. Giannakis, Zhizhen Zhao8324-8331",AAAI Technical Track on Machine Learning II,https://cdn.aaai.org/ojs/17012/17012-13-20506-1-2-20210518.pdf
AAAI,2021,unsupervised_active_learning_via_subspace_learning__2e7b5b04.pdf,Unsupervised Active Learning via Subspace Learning,"Changsheng Li, Kaihang Mao, Lingyan Liang, Dongchun Ren, Wei Zhang, Ye Yuan, Guoren Wang8332-8339",AAAI Technical Track on Machine Learning II,https://cdn.aaai.org/ojs/17013/17013-13-20507-1-2-20210518.pdf
AAAI,2021,lrsc_learning_representations_for_subspace_clustering__9dd72406.pdf,LRSC: Learning Representations for Subspace Clustering,"Changsheng Li, Chen Yang, Bo Liu, Ye Yuan, Guoren Wang8340-8348",AAAI Technical Track on Machine Learning II,https://cdn.aaai.org/ojs/17014/17014-13-20508-1-2-20210518.pdf
AAAI,2021,got_a_growing_tree_model_for_clustering_ensemble__66dd4bb2.pdf,GoT: a Growing Tree Model for Clustering Ensemble,"Feijiang Li, Yuhua Qian, Jieting Wang8349-8356",AAAI Technical Track on Machine Learning II,https://cdn.aaai.org/ojs/17015/17015-13-20509-1-2-20210518.pdf
AAAI,2021,vsql_variational_shadow_quantum_learning_for_classification__c0c22a28.pdf,VSQL: Variational Shadow Quantum Learning for Classification,"Guangxi Li, Zhixin Song, Xin Wang8357-8365",AAAI Technical Track on Machine Learning II,https://cdn.aaai.org/ojs/17016/17016-13-20510-1-2-20210518.pdf
AAAI,2021,high_fidelity_gan_inversion_via_prior_multisubspace_feature_composition__51744a6a.pdf,High Fidelity GAN Inversion via Prior Multi-Subspace Feature Composition,"Guanyue Li, Qianfen Jiao, Sheng Qian, Si Wu, Hau-San Wong8366-8374",AAAI Technical Track on Machine Learning II,https://cdn.aaai.org/ojs/17017/17017-13-20511-1-2-20210518.pdf
AAAI,2021,shapenet_a_shapeletneural_network_approach_for_multivariate_time_series_classification__dcec508a.pdf,ShapeNet: A Shapelet-Neural Network Approach for Multivariate Time Series Classification,"Guozhong Li, Byron Choi, Jianliang Xu, Sourav S Bhowmick, Kwok-Pan Chun, Grace Lai-Hung Wong8375-8383",AAAI Technical Track on Machine Learning II,https://cdn.aaai.org/ojs/17018/17018-13-20512-1-2-20210518.pdf
AAAI,2021,a_bayesian_approach_for_subset_selection_in_contextual_bandits__194fd4a0.pdf,A Bayesian Approach for Subset Selection in Contextual Bandits,"Jialian Li, Chao Du, Jun Zhu8384-8391",AAAI Technical Track on Machine Learning II,https://cdn.aaai.org/ojs/17019/17019-13-20513-1-2-20210518.pdf
AAAI,2021,selfpaced_twodimensional_pca__daaca48f.pdf,Self-Paced Two-dimensional PCA,"Jiangxin Li, Zhao Kang, Chong Peng, Wenyu Chen8392-8400",AAAI Technical Track on Machine Learning II,https://cdn.aaai.org/ojs/17020/17020-13-20514-1-2-20210518.pdf
AAAI,2021,learning_intact_features_by_erasinginpainting_for_fewshot_classification__c8867ca3.pdf,Learning Intact Features by Erasing-Inpainting for Few-shot Classification,"Junjie Li, Zilei Wang, Xiaoming Hu8401-8409",AAAI Technical Track on Machine Learning II,https://cdn.aaai.org/ojs/17021/17021-13-20515-1-2-20210518.pdf
AAAI,2021,tokenaware_virtual_adversarial_training_in_natural_language_understanding__eb4c35da.pdf,Token-Aware Virtual Adversarial Training in Natural Language Understanding,"Linyang Li, Xipeng Qiu8410-8418",AAAI Technical Track on Machine Learning II,https://cdn.aaai.org/ojs/17022/17022-13-20516-1-2-20210518.pdf
AAAI,2021,learning_generalized_relational_heuristic_networks_for_modelagnostic_planning__2e9edf96.pdf,Learning Generalized Relational Heuristic Networks for Model-Agnostic Planning,"Rushang Karia, Siddharth Srivastava8064-8073",AAAI Technical Track on Machine Learning II,https://cdn.aaai.org/ojs/16983/16983-13-20477-1-2-20210518.pdf
AAAI,2021,a_recipe_for_global_convergence_guarantee_in_deep_neural_networks__5bd8cfb3.pdf,A Recipe for Global Convergence Guarantee in Deep Neural Networks,"Kenji Kawaguchi, Qingyun Sun8074-8082",AAAI Technical Track on Machine Learning II,https://cdn.aaai.org/ojs/16984/16984-13-20478-1-2-20210518.pdf
AAAI,2021,bayesian_dynamic_mode_decomposition_with_variational_matrix_factorization__90cb8df1.pdf,Bayesian Dynamic Mode Decomposition with Variational Matrix Factorization,"Takahiro Kawashima, Hayaru Shouno, Hideitsu Hino8083-8091",AAAI Technical Track on Machine Learning II,https://cdn.aaai.org/ojs/16985/16985-13-20479-1-2-20210518.pdf
AAAI,2021,improving_fairness_and_privacy_in_selection_problems__8573e596.pdf,Improving Fairness and Privacy in Selection Problems,"Mohammad Mahdi Khalili, Xueru Zhang, Mahed Abroshan, Somayeh Sojoudi8092-8100",AAAI Technical Track on Machine Learning II,https://cdn.aaai.org/ojs/16986/16986-13-20480-1-2-20210518.pdf
AAAI,2021,a_flexible_framework_for_communicationefficient_machine_learning__7c349850.pdf,A Flexible Framework for Communication-Efficient Machine Learning,"Sarit Khirirat, Sindri Magnússon, Arda Aytekin, Mikael Johansson8101-8109",AAAI Technical Track on Machine Learning II,https://cdn.aaai.org/ojs/16987/16987-13-20481-1-2-20210518.pdf
AAAI,2021,glister_generalization_based_data_subset_selection_for_efficient_and_robust_learning__f42d2d22.pdf,GLISTER: Generalization based Data Subset Selection for Efficient and Robust Learning,"Krishnateja Killamsetty, Durga Sivasubramanian, Ganesh Ramakrishnan, Rishabh Iyer8110-8118",AAAI Technical Track on Machine Learning II,https://cdn.aaai.org/ojs/16988/16988-13-20482-1-2-20210518.pdf
AAAI,2021,understanding_catastrophic_overfitting_in_singlestep_adversarial_training__d7cf7802.pdf,Understanding Catastrophic Overfitting in Single-step Adversarial Training,"Hoki Kim, Woojin Lee, Jaewook Lee8119-8127",AAAI Technical Track on Machine Learning II,https://cdn.aaai.org/ojs/16989/16989-13-20483-1-2-20210518.pdf
AAAI,2021,counterfactual_fairness_with_disentangled_causal_effect_variational_autoencoder__3ac6c489.pdf,Counterfactual Fairness with Disentangled Causal Effect Variational Autoencoder,"Hyemi Kim, Seungjae Shin, JoonHo Jang, Kyungwoo Song, Weonyoung Joo, Wanmo Kang, Il-Chul Moon8128-8136",AAAI Technical Track on Machine Learning II,https://cdn.aaai.org/ojs/16990/16990-13-20484-1-2-20210518.pdf
AAAI,2021,splitandbridge_adaptable_class_incremental_learning_within_a_single_neural_network__25a960ea.pdf,Split-and-Bridge: Adaptable Class Incremental Learning within a Single Neural Network,"Jong-Yeong Kim, Dong-Wan Choi8137-8145",AAAI Technical Track on Machine Learning II,https://cdn.aaai.org/ojs/16991/16991-13-20485-1-2-20210518.pdf
AAAI,2021,dpm_a_novel_training_method_for_physicsinformed_neural_networks_in_extrapolation__c88fa7cd.pdf,DPM: A Novel Training Method for Physics-Informed Neural Networks in Extrapolation,"Jungeun Kim, Kookjin Lee, Dongeun Lee, Sheo Yon Jhin, Noseong Park8146-8154",AAAI Technical Track on Machine Learning II,https://cdn.aaai.org/ojs/16992/16992-13-20486-1-2-20210518.pdf
AAAI,2021,kernelconvoluted_deep_neural_networks_with_data_augmentation__5b7e4a35.pdf,Kernel-convoluted Deep Neural Networks with Data Augmentation,"Minjin Kim, Young-geun Kim, Dongha Kim, Yongdai Kim, Myunghee Cho Paik8155-8162",AAAI Technical Track on Machine Learning II,https://cdn.aaai.org/ojs/16993/16993-13-20487-1-2-20210518.pdf
AAAI,2021,neural_sequencetogrid_module_for_learning_symbolic_rules__23a6de1d.pdf,Neural Sequence-to-grid Module for Learning Symbolic Rules,"Segwang Kim, Hyoungwook Nam, Joonyoung Kim, Kyomin Jung8163-8171",AAAI Technical Track on Machine Learning II,https://cdn.aaai.org/ojs/16994/16994-13-20488-1-2-20210518.pdf
AAAI,2021,visual_concept_reasoning_networks__ae6785df.pdf,Visual Concept Reasoning Networks,"Taesup Kim, Sungwoong Kim, Yoshua Bengio8172-8180",AAAI Technical Track on Machine Learning II,https://cdn.aaai.org/ojs/16995/16995-13-20489-1-2-20210518.pdf
AAAI,2021,sparsity_aware_normalization_for_gans__9099d8e6.pdf,Sparsity Aware Normalization for GANs,"Idan Kligvasser, Tomer Michaeli8181-8190",AAAI Technical Track on Machine Learning II,https://cdn.aaai.org/ojs/16996/16996-13-20490-1-2-20210518.pdf
AAAI,2021,hint_hierarchical_invertible_neural_transport_for_density_estimation_and_bayesian_inference__732bbba1.pdf,HINT: Hierarchical Invertible Neural Transport for Density Estimation and Bayesian Inference,"Jakob Kruse, Gianluca Detommaso, Ullrich Köthe, Robert Scheichl8191-8199",AAAI Technical Track on Machine Learning II,https://cdn.aaai.org/ojs/16997/16997-13-20491-1-2-20210518.pdf
AAAI,2021,nearly_lineartime_parallelizable_algorithms_for_nonmonotone_submodular_maximization__6fa5d656.pdf,"Nearly Linear-Time, Parallelizable Algorithms for Non-Monotone Submodular Maximization",Alan Kuhnle8200-8208,AAAI Technical Track on Machine Learning II,https://cdn.aaai.org/ojs/16998/16998-13-20492-1-2-20210518.pdf
AAAI,2021,asynchronous_optimization_methods_for_efficient_training_of_deep_neural_networks_with_guarantees__e9b75e37.pdf,Asynchronous Optimization Methods for Efficient Training of Deep Neural Networks with Guarantees,"Vyacheslav Kungurtsev, Malcolm Egan, Bapi Chatterjee, Dan Alistarh8209-8216",AAAI Technical Track on Machine Learning II,https://cdn.aaai.org/ojs/16999/16999-13-20493-1-2-20210518.pdf
AAAI,2021,positions_channels_and_layers_fully_generalized_nonlocal_network_for_singer_identification__61a0328a.pdf,"Positions, Channels, and Layers: Fully Generalized Non-Local Network for Singer Identification","I-Yuan Kuo, Wen-Li Wei, Jen-Chun  Lin8217-8225",AAAI Technical Track on Machine Learning II,https://cdn.aaai.org/ojs/17000/17000-13-20494-1-2-20210518.pdf
AAAI,2021,molgrow_a_graph_normalizing_flow_for_hierarchical_molecular_generation__72440ab4.pdf,MolGrow: A Graph Normalizing Flow for Hierarchical Molecular Generation,"Maksim Kuznetsov, Daniil Polykovskiy8226-8234",AAAI Technical Track on Machine Learning II,https://cdn.aaai.org/ojs/17001/17001-13-20495-1-2-20210518.pdf
