Conference,Year,Filename,Title,Authors,Category,PDF_URL
AAAI,2021,online_search_with_maximum_clearance__ac2634ea.pdf,Online Search with Maximum Clearance,"Spyros Angelopoulos, Malachi Voss3642-3650",AAAI Technical Track on Constraint Satisfaction and Optimization,https://cdn.aaai.org/ojs/16480/16480-13-19974-1-2-20210518.pdf
AAAI,2021,relationaware_neighborhood_matching_model_for_entity_alignment__f614076a.pdf,Relation-Aware Neighborhood Matching Model for Entity Alignment,"Yao Zhu, Hongzhi Liu, Zhonghai Wu, Yingpeng Du4749-4756",AAAI Technical Track on Data Mining and Knowledge Management,https://cdn.aaai.org/ojs/16606/16606-13-20100-1-2-20210518.pdf
AAAI,2021,adversarial_directed_graph_embedding__9b0d2cca.pdf,Adversarial Directed Graph Embedding,"Shijie Zhu, Jianxin Li, Hao Peng, Senzhang Wang, Lifang He4741-4748",AAAI Technical Track on Data Mining and Knowledge Management,https://cdn.aaai.org/ojs/16605/16605-13-20099-1-2-20210518.pdf
AAAI,2021,learning_from_history_modeling_temporal_knowledge_graphs_with_sequential_copygeneration_networks__9b434936.pdf,Learning from History: Modeling Temporal Knowledge Graphs with Sequential Copy-Generation Networks,"Cunchao Zhu, Muhao Chen, Changjun Fan, Guangquan Cheng, Yan Zhang4732-4740",AAAI Technical Track on Data Mining and Knowledge Management,https://cdn.aaai.org/ojs/16604/16604-13-20098-1-2-20210518.pdf
AAAI,2021,modeling_heterogeneous_relations_across_multiple_modes_for_potential_crowd_flow_prediction__2514c474.pdf,Modeling Heterogeneous Relations across Multiple Modes for Potential Crowd Flow Prediction,"Qiang Zhou, Jingjing Gu, Xinjiang Lu, Fuzhen Zhuang, Yanchao Zhao, Qiuhong Wang, Xiao Zhang4723-4731",AAAI Technical Track on Data Mining and Knowledge Management,https://cdn.aaai.org/ojs/16603/16603-13-20097-1-2-20210518.pdf
AAAI,2021,a_unified_pretraining_framework_for_passage_ranking_and_expansion__1c829e3b.pdf,A Unified Pretraining Framework for Passage Ranking and Expansion,"Ming Yan, Chenliang Li, Bin Bi, Wei Wang, Songfang Huang4555-4563",AAAI Technical Track on Data Mining and Knowledge Management,https://cdn.aaai.org/ojs/16584/16584-13-20078-1-2-20210518.pdf
AAAI,2021,transformerstyle_relational_reasoning_with_dynamic_memory_updating_for_temporal_network_modeling__63b01712.pdf,Transformer-Style Relational Reasoning with Dynamic Memory Updating for Temporal Network Modeling,"Dongkuan Xu, Junjie Liang, Wei Cheng, Hua Wei, Haifeng Chen, Xiang Zhang4546-4554",AAAI Technical Track on Data Mining and Knowledge Management,https://cdn.aaai.org/ojs/16583/16583-13-20077-1-2-20210518.pdf
AAAI,2021,dynamic_knowledge_graph_alignment__b341cc54.pdf,Dynamic Knowledge Graph Alignment,"Yuchen Yan, Lihui Liu, Yikun Ban, Baoyu Jing, Hanghang Tong4564-4572",AAAI Technical Track on Data Mining and Knowledge Management,https://cdn.aaai.org/ojs/16585/16585-13-20079-1-2-20210518.pdf
AAAI,2021,rethinking_graph_regularization_for_graph_neural_networks__da0eaf20.pdf,Rethinking Graph Regularization for Graph Neural Networks,"Han Yang, Kaili Ma, James Cheng4573-4581",AAAI Technical Track on Data Mining and Knowledge Management,https://cdn.aaai.org/ojs/16586/16586-13-20080-1-2-20210518.pdf
AAAI,2021,capturing_delayed_feedback_in_conversion_rate_prediction_via_elapsedtime_sampling__59f3bb4d.pdf,Capturing Delayed Feedback in Conversion Rate Prediction via Elapsed-Time Sampling,"Jia-Qi Yang, Xiang Li, Shuguang Han, Tao Zhuang, De-Chuan Zhan, Xiaoyi Zeng, Bin Tong4582-4589",AAAI Technical Track on Data Mining and Knowledge Management,https://cdn.aaai.org/ojs/16587/16587-13-20081-1-2-20210518.pdf
AAAI,2021,why_do_attributes_propagate_in_graph_convolutional_neural_networks__048a23fe.pdf,Why Do Attributes Propagate in Graph Convolutional Neural Networks?,"Liang Yang, Chuan Wang, Junhua Gu, Xiaochun Cao, Bingxin Niu4590-4598",AAAI Technical Track on Data Mining and Knowledge Management,https://cdn.aaai.org/ojs/16588/16588-13-20082-1-2-20210518.pdf
AAAI,2021,relaxed_clustered_hawkes_process_for_student_procrastination_modeling_in_moocs__3cc4d15d.pdf,Relaxed Clustered Hawkes Process for Student Procrastination Modeling in MOOCs,"Mengfan Yao, Siqian Zhao, Shaghayegh Sahebi, Reza Feyzi Behnagh4599-4607",AAAI Technical Track on Data Mining and Knowledge Management,https://cdn.aaai.org/ojs/16589/16589-13-20083-1-2-20210518.pdf
AAAI,2021,interpretable_clustering_on_dynamic_graphs_with_recurrent_graph_neural_networks__8c0ec0dd.pdf,Interpretable Clustering on Dynamic Graphs with Recurrent Graph Neural Networks,"Yuhang Yao, Carlee Joe-Wong4608-4616",AAAI Technical Track on Data Mining and Knowledge Management,https://cdn.aaai.org/ojs/16590/16590-13-20084-1-2-20210518.pdf
AAAI,2021,coupled_layerwise_graph_convolution_for_transportation_demand_prediction__5eaf7c2c.pdf,Coupled Layer-wise Graph Convolution for Transportation Demand Prediction,"Junchen Ye, Leilei Sun, Bowen Du, Yanjie Fu, Hui Xiong4617-4625",AAAI Technical Track on Data Mining and Knowledge Management,https://cdn.aaai.org/ojs/16591/16591-13-20085-1-2-20210518.pdf
AAAI,2021,deep_graphneighbor_coherence_preserving_network_for_unsupervised_crossmodal_hashing__65f16d0c.pdf,Deep Graph-neighbor Coherence Preserving Network for Unsupervised Cross-modal Hashing,"Jun Yu, Hao Zhou, Yibing Zhan, Dacheng Tao4626-4634",AAAI Technical Track on Data Mining and Knowledge Management,https://cdn.aaai.org/ojs/16592/16592-13-20086-1-2-20210518.pdf
AAAI,2021,selfsupervised_prototype_representation_learning_for_eventbased_corporate_profiling__4a7bb511.pdf,Self-Supervised Prototype Representation Learning for Event-Based Corporate Profiling,"Zixuan Yuan, Hao Liu, Renjun Hu, Denghui Zhang, Hui Xiong4644-4652",AAAI Technical Track on Data Mining and Knowledge Management,https://cdn.aaai.org/ojs/16594/16594-13-20088-1-2-20210518.pdf
AAAI,2021,dual_sparse_attention_network_for_sessionbased_recommendation__19869b1f.pdf,Dual Sparse Attention Network For Session-based Recommendation,"Jiahao Yuan, Zihan Song, Mingyou Sun, Xiaoling Wang, Wayne Xin Zhao4635-4643",AAAI Technical Track on Data Mining and Knowledge Management,https://cdn.aaai.org/ojs/16593/16593-13-20087-1-2-20210518.pdf
AAAI,2021,overcoming_catastrophic_forgetting_in_graph_neural_networks_with_experience_replay__1fe084bc.pdf,Overcoming Catastrophic Forgetting in Graph Neural Networks with Experience Replay,"Fan Zhou, Chengtai Cao4714-4722",AAAI Technical Track on Data Mining and Knowledge Management,https://cdn.aaai.org/ojs/16602/16602-13-20096-1-2-20210518.pdf
AAAI,2021,coldstart_sequential_recommendation_via_meta_learner__403ce67d.pdf,Cold-start Sequential Recommendation via Meta Learner,"Yujia Zheng, Siyi Liu, Zekun Li, Shu Wu4706-4713",AAAI Technical Track on Data Mining and Knowledge Management,https://cdn.aaai.org/ojs/16601/16601-13-20095-1-2-20210518.pdf
AAAI,2021,heterogeneous_graph_structure_learning_for_graph_neural_networks__ad2396d6.pdf,Heterogeneous Graph Structure Learning for Graph Neural Networks,"Jianan Zhao, Xiao Wang, Chuan Shi, Binbin Hu, Guojie Song, Yanfang Ye4697-4705",AAAI Technical Track on Data Mining and Knowledge Management,https://cdn.aaai.org/ojs/16600/16600-13-20094-1-2-20210518.pdf
AAAI,2021,a_graphbased_relevance_matching_model_for_adhoc_retrieval__74d331d4.pdf,A Graph-based Relevance Matching Model for Ad-hoc Retrieval,"Yufeng Zhang, Jinghao Zhang, Zeyu Cui, Shu Wu, Liang Wang4688-4696",AAAI Technical Track on Data Mining and Knowledge Management,https://cdn.aaai.org/ojs/16599/16599-13-20093-1-2-20210518.pdf
AAAI,2021,generalized_relation_learning_with_semantic_correlation_awareness_for_link_prediction__0506d3e0.pdf,Generalized Relation Learning with Semantic Correlation Awareness for Link Prediction,"Yao Zhang, Xu Zhang, Jun Wang, Hongru Liang, Wenqiang Lei, Zhe Sun, Adam Jatowt, Zhenglu Yang4679-4687",AAAI Technical Track on Data Mining and Knowledge Management,https://cdn.aaai.org/ojs/16598/16598-13-20092-1-2-20210518.pdf
AAAI,2021,tripartite_collaborative_filtering_with_observability_and_selection_for_debiasing_rating_estimation_on_missingnotatrandom_data__0088c2a0.pdf,Tripartite Collaborative Filtering with Observability and Selection for Debiasing Rating Estimation on Missing-Not-at-Random Data,"Qi Zhang, Longbing Cao, Chongyang Shi, Liang Hu4671-4678",AAAI Technical Track on Data Mining and Knowledge Management,https://cdn.aaai.org/ojs/16597/16597-13-20091-1-2-20210518.pdf
AAAI,2021,taxonomy_completion_via_triplet_matching_network__f4612696.pdf,Taxonomy Completion via Triplet Matching Network,"Jieyu Zhang, Xiangchen Song, Ying Zeng, Jiaze Chen, Jiaming Shen, Yuning Mao, Lei Li4662-4670",AAAI Technical Track on Data Mining and Knowledge Management,https://cdn.aaai.org/ojs/16596/16596-13-20090-1-2-20210518.pdf
AAAI,2021,augsplicing_synchronized_behavior_detection_in_streaming_tensors__58f1b8f5.pdf,AugSplicing: Synchronized Behavior Detection in Streaming Tensors,"Jiabao Zhang, Shenghua Liu, Wenting Hou, Siddharth Bhatia, Huawei Shen, Wenjian Yu, Xueqi Cheng4653-4661",AAAI Technical Track on Data Mining and Knowledge Management,https://cdn.aaai.org/ojs/16595/16595-13-20089-1-2-20210518.pdf
AAAI,2021,hyperbolic_variational_graph_neural_network_for_modeling_dynamic_graphs__a3ed1867.pdf,Hyperbolic Variational Graph Neural Network for Modeling Dynamic Graphs,"Li Sun, Zhongbao Zhang, Jiawei Zhang, Feiyang Wang, Hao Peng, Sen Su, Philip  S. Yu4375-4383",AAAI Technical Track on Data Mining and Knowledge Management,https://cdn.aaai.org/ojs/16563/16563-13-20057-1-2-20210518.pdf
AAAI,2021,dynamic_memory_based_attention_network_for_sequential_recommendation__4dcc2d2b.pdf,Dynamic Memory based Attention Network for Sequential Recommendation,"Qiaoyu Tan, Jianwei Zhang, Ninghao Liu, Xiao Huang, Hongxia Yang, Jingren Zhou, Xia Hu4384-4392",AAAI Technical Track on Data Mining and Knowledge Management,https://cdn.aaai.org/ojs/16564/16564-13-20058-1-2-20210518.pdf
AAAI,2021,gaussianpatha_bayesian_multihop_reasoning_framework_for_knowledge_graph_reasoning__352de439.pdf,GaussianPath:A Bayesian Multi-Hop Reasoning Framework for Knowledge Graph Reasoning,"Guojia Wan, Bo Du4393-4401",AAAI Technical Track on Data Mining and Knowledge Management,https://cdn.aaai.org/ojs/16565/16565-13-20059-1-2-20210518.pdf
AAAI,2021,gsnet_learning_spatialtemporal_correlations_from_geographical_and_semantic_aspects_for_traffic_accident_risk_forecasting__e5a1f2e5.pdf,GSNet: Learning Spatial-Temporal Correlations from Geographical and Semantic Aspects for Traffic Accident Risk Forecasting,"Beibei Wang, Youfang Lin, Shengnan Guo, Huaiyu Wan4402-4409",AAAI Technical Track on Data Mining and Knowledge Management,https://cdn.aaai.org/ojs/16566/16566-13-20060-1-2-20210518.pdf
AAAI,2021,reinforced_imitative_graph_representation_learning_for_mobile_user_profiling_an_adversarial_training_perspective__a251a6e1.pdf,Reinforced Imitative Graph Representation Learning for Mobile User Profiling: An Adversarial Training Perspective,"Dongjie Wang, Pengyang Wang, Kunpeng Liu, Yuanchun Zhou, Charles E Hughes, Yanjie Fu4410-4417",AAAI Technical Track on Data Mining and Knowledge Management,https://cdn.aaai.org/ojs/16567/16567-13-20061-1-2-20210518.pdf
AAAI,2021,coupling_macrosectormicro_financial_indicators_for_learning_stock_representations_with_less_uncertainty__0c3bae49.pdf,Coupling Macro-Sector-Micro Financial Indicators for Learning Stock Representations with Less Uncertainty,"Guifeng Wang, Longbing Cao, Hongke Zhao, Qi Liu, Enhong Chen4418-4426",AAAI Technical Track on Data Mining and Knowledge Management,https://cdn.aaai.org/ojs/16568/16568-13-20062-1-2-20210518.pdf
AAAI,2021,attnmove_history_enhanced_trajectory_recovery_via_attentional_network__b64e9830.pdf,AttnMove: History Enhanced Trajectory Recovery via Attentional Network,"Tong Xia, Yunhan Qi, Jie Feng, Fengli Xu, Funing Sun, Diansheng Guo, Yong Li4494-4502",AAAI Technical Track on Data Mining and Knowledge Management,https://cdn.aaai.org/ojs/16577/16577-13-20071-1-2-20210518.pdf
AAAI,2021,reinforcement_learning_with_a_disentangled_universal_value_function_for_item_recommendation__4cdfd647.pdf,Reinforcement Learning with a Disentangled Universal Value Function for Item Recommendation,"Kai Wang, Zhene Zou, Qilin Deng, Jianrong Tao, Runze Wu, Changjie Fan, Liang Chen, Peng Cui4427-4435",AAAI Technical Track on Data Mining and Knowledge Management,https://cdn.aaai.org/ojs/16569/16569-13-20063-1-2-20210518.pdf
AAAI,2021,learning_to_recommend_from_sparse_data_via_generative_user_feedback__50897c69.pdf,Learning to Recommend from Sparse Data via Generative User Feedback,Wenlin Wang4436-4444,AAAI Technical Track on Data Mining and Knowledge Management,https://cdn.aaai.org/ojs/16570/16570-13-20064-1-2-20210518.pdf
AAAI,2021,how_do_we_move_modeling_human_movement_with_system_dynamics__cdcf6ac2.pdf,How Do We Move: Modeling Human Movement with System Dynamics,"Hua Wei, Dongkuan Xu, Junjie Liang, Zhenhui (Jessie) Li4445-4452",AAAI Technical Track on Data Mining and Knowledge Management,https://cdn.aaai.org/ojs/16571/16571-13-20065-1-2-20210518.pdf
AAAI,2021,learning_to_truncate_ranked_lists_for_information_retrieval__aecb5cb2.pdf,Learning to Truncate Ranked Lists for Information Retrieval,"Chen Wu, Ruqing Zhang, Jiafeng Guo, Yixing Fan, Yanyan Lan, Xueqi Cheng4453-4461",AAAI Technical Track on Data Mining and Knowledge Management,https://cdn.aaai.org/ojs/16572/16572-13-20066-1-2-20210518.pdf
AAAI,2021,fairnessaware_news_recommendation_with_decomposed_adversarial_learning__cbb6865e.pdf,Fairness-aware News Recommendation with Decomposed Adversarial Learning,"Chuhan Wu, Fangzhao Wu, Xiting Wang, Yongfeng Huang, Xing Xie4462-4469",AAAI Technical Track on Data Mining and Knowledge Management,https://cdn.aaai.org/ojs/16573/16573-13-20067-1-2-20210518.pdf
AAAI,2021,hybridorder_stochastic_block_model__2e1112c9.pdf,Hybrid-order Stochastic Block Model,"Xunxun Wu, Chang-Dong Wang, Pengfei Jiao4470-4477",AAAI Technical Track on Data Mining and Knowledge Management,https://cdn.aaai.org/ojs/16574/16574-13-20068-1-2-20210518.pdf
AAAI,2021,inductive_graph_neural_networks_for_spatiotemporal_kriging__e0d15302.pdf,Inductive Graph Neural Networks for Spatiotemporal Kriging,"Yuankai Wu, Dingyi Zhuang, Aurelie Labbe, Lijun Sun4478-4485",AAAI Technical Track on Data Mining and Knowledge Management,https://cdn.aaai.org/ojs/16575/16575-13-20069-1-2-20210518.pdf
AAAI,2021,knowledgeenhanced_hierarchical_graph_transformer_network_for_multibehavior_recommendation__d896c1af.pdf,Knowledge-Enhanced Hierarchical Graph Transformer Network for Multi-Behavior Recommendation,"Lianghao Xia, Chao Huang, Yong Xu, Peng Dai, Xiyue Zhang, Hongsheng Yang, Jian Pei, Liefeng Bo4486-4493",AAAI Technical Track on Data Mining and Knowledge Management,https://cdn.aaai.org/ojs/16576/16576-13-20070-1-2-20210518.pdf
AAAI,2021,selfsupervised_hypergraph_convolutional_networks_for_sessionbased_recommendation__6a63c337.pdf,Self-Supervised Hypergraph Convolutional Networks for Session-based Recommendation,"Xin Xia, Hongzhi Yin, Junliang Yu, Qinyong Wang, Lizhen Cui, Xiangliang Zhang4503-4511",AAAI Technical Track on Data Mining and Knowledge Management,https://cdn.aaai.org/ojs/16578/16578-13-20072-1-2-20210518.pdf
AAAI,2021,a_general_offline_reinforcement_learning_framework_for_interactive_recommendation__447580a9.pdf,A General Offline Reinforcement Learning Framework for Interactive Recommendation,"Teng Xiao, Donglin Wang4512-4520",AAAI Technical Track on Data Mining and Knowledge Management,https://cdn.aaai.org/ojs/16579/16579-13-20073-1-2-20210518.pdf
AAAI,2021,hierarchical_reinforcement_learning_for_integrated_recommendation__851378a8.pdf,Hierarchical Reinforcement Learning for Integrated Recommendation,"Ruobing Xie, Shaoliang Zhang, Rui Wang, Feng Xia, Leyu Lin4521-4528",AAAI Technical Track on Data Mining and Knowledge Management,https://cdn.aaai.org/ojs/16580/16580-13-20074-1-2-20210518.pdf
AAAI,2021,outoftown_recommendation_with_travel_intention_modeling__9c86d5b1.pdf,Out-of-Town Recommendation with Travel Intention Modeling,"Haoran Xin, Xinjiang Lu, Tong Xu, Hao Liu, Jingjing Gu, Dejing Dou, Hui Xiong4529-4536",AAAI Technical Track on Data Mining and Knowledge Management,https://cdn.aaai.org/ojs/16581/16581-13-20075-1-2-20210518.pdf
AAAI,2021,towards_consumer_loan_fraud_detection_graph_neural_networks_with_roleconstrained_conditional_random_field__6c5c9b8f.pdf,Towards Consumer Loan Fraud Detection: Graph Neural Networks with Role-Constrained Conditional Random Field,"Bingbing Xu, Huawei Shen, Bingjie Sun, Rong An, Qi Cao, Xueqi Cheng4537-4545",AAAI Technical Track on Data Mining and Knowledge Management,https://cdn.aaai.org/ojs/16582/16582-13-20076-1-2-20210518.pdf
AAAI,2021,group_testing_on_a_network__96bcd5c5.pdf,Group Testing on a Network,"Arlei Silva, Ambuj Singh4348-4356",AAAI Technical Track on Data Mining and Knowledge Management,https://cdn.aaai.org/ojs/16560/16560-13-20054-1-2-20210518.pdf
AAAI,2021,a_hybrid_probabilistic_approach_for_table_understanding__ca888c96.pdf,A Hybrid Probabilistic Approach for Table Understanding,"Kexuan Sun, Harsha Rayudu, Jay Pujara4366-4374",AAAI Technical Track on Data Mining and Knowledge Management,https://cdn.aaai.org/ojs/16562/16562-13-20056-1-2-20210518.pdf
AAAI,2021,detecting_beneficial_feature_interactions_for_recommender_systems__f64b4888.pdf,Detecting Beneficial Feature Interactions for Recommender Systems,"Yixin Su, Rui Zhang, Sarah Erfani, Zhenghua Xu4357-4365",AAAI Technical Track on Data Mining and Knowledge Management,https://cdn.aaai.org/ojs/16561/16561-13-20055-1-2-20210518.pdf
AAAI,2021,knowledgedriven_distractor_generation_for_clozestyle_multiple_choice_questions__4aedd3ba.pdf,Knowledge-Driven Distractor Generation for Cloze-Style Multiple Choice Questions,"Siyu Ren, Kenny Q. Zhu4339-4347",AAAI Technical Track on Data Mining and Knowledge Management,https://cdn.aaai.org/ojs/16559/16559-13-20053-1-2-20210518.pdf
AAAI,2021,rejection_sampling_for_weighted_jaccard_similarity_revisited__de030b3e.pdf,Rejection Sampling for Weighted Jaccard Similarity Revisited,"Xiaoyun Li, Ping Li4197-4205",AAAI Technical Track on Data Mining and Knowledge Management,https://cdn.aaai.org/ojs/16543/16543-13-20037-1-2-20210518.pdf
AAAI,2021,graphmse_efficient_metapath_selection_in_semantically_aligned_feature_space_for_graph_neural_networks__15dc9d21.pdf,GraphMSE: Efficient Meta-path Selection in Semantically Aligned Feature Space for Graph Neural Networks,"Yi Li, Yilun Jin, Guojie Song, Zihao Zhu, Chuan Shi, Yiming Wang4206-4214",AAAI Technical Track on Data Mining and Knowledge Management,https://cdn.aaai.org/ojs/16544/16544-13-20038-1-2-20210518.pdf
AAAI,2021,crossoilfield_reservoir_classification_via_multiscale_sensor_knowledge_transfer__708ba3d0.pdf,Cross-Oilfield Reservoir Classification via Multi-Scale Sensor Knowledge Transfer,"Zhi Li, Zhefeng Wang, Zhicheng Wei, Xiangguang Zhou, Yijun Wang, Baoxing Huai, Qi Liu, Nicholas Jing Yuan, Renbin Gong, Enhong Chen4215-4223",AAAI Technical Track on Data Mining and Knowledge Management,https://cdn.aaai.org/ojs/16545/16545-13-20039-1-2-20210518.pdf
AAAI,2021,fedrec_lossless_federated_recommendation_with_explicit_feedback__c3c86ffc.pdf,FedRec++: Lossless Federated Recommendation with Explicit Feedback,"Feng Liang, Weike Pan, Zhong Ming4224-4231",AAAI Technical Track on Data Mining and Knowledge Management,https://cdn.aaai.org/ojs/16546/16546-13-20040-1-2-20210518.pdf
AAAI,2021,hms_a_hierarchical_solver_with_dependencyenhanced_understanding_for_math_word_problem__fec284b3.pdf,HMS: A Hierarchical Solver with Dependency-Enhanced Understanding for Math Word Problem,"Xin Lin, Zhenya Huang, Hongke Zhao, Enhong Chen, Qi Liu, Hao Wang, Shijin Wang4232-4240",AAAI Technical Track on Data Mining and Knowledge Management,https://cdn.aaai.org/ojs/16547/16547-13-20041-1-2-20210518.pdf
AAAI,2021,pretraining_context_and_time_aware_location_embeddings_from_spatialtemporal_trajectories_for_user_next_location_prediction__ebd477b0.pdf,Pre-training Context and Time Aware Location Embeddings from Spatial-Temporal Trajectories for User Next Location Prediction,"Yan Lin, Huaiyu Wan, Shengnan Guo, Youfang Lin4241-4248",AAAI Technical Track on Data Mining and Knowledge Management,https://cdn.aaai.org/ojs/16548/16548-13-20042-1-2-20210518.pdf
AAAI,2021,noninvasive_selfattention_for_side_information_fusion_in_sequential_recommendation__4532b90a.pdf,Noninvasive Self-attention for Side Information Fusion in Sequential Recommendation,"Chang Liu, Xiaoguang Li, Guohao Cai, Zhenhua Dong, Hong Zhu, Lifeng Shang4249-4256",AAAI Technical Track on Data Mining and Knowledge Management,https://cdn.aaai.org/ojs/16549/16549-13-20043-1-2-20210518.pdf
AAAI,2021,visual_pivoting_for_unsupervised_entity_alignment__a656c48e.pdf,Visual Pivoting for (Unsupervised) Entity Alignment,"Fangyu Liu, Muhao Chen, Dan Roth, Nigel Collier4257-4266",AAAI Technical Track on Data Mining and Knowledge Management,https://cdn.aaai.org/ojs/16550/16550-13-20044-1-2-20210518.pdf
AAAI,2021,learning_to_pretrain_graph_neural_networks__db2e5097.pdf,Learning to Pre-train Graph Neural Networks,"Yuanfu Lu, Xunqiang Jiang, Yuan Fang, Chuan Shi4276-4284",AAAI Technical Track on Data Mining and Knowledge Management,https://cdn.aaai.org/ojs/16552/16552-13-20046-1-2-20210518.pdf
AAAI,2021,knowledgeenhanced_topk_recommendation_in_poincaré_ball__37ac2eec.pdf,Knowledge-Enhanced Top-K Recommendation in Poincaré Ball,"Chen Ma, Liheng Ma, Yingxue Zhang, Haolun Wu, Xue Liu, Mark Coates4285-4293",AAAI Technical Track on Data Mining and Knowledge Management,https://cdn.aaai.org/ojs/16553/16553-13-20047-1-2-20210518.pdf
AAAI,2021,communicative_message_passing_for_inductive_relation_reasoning__b6babe61.pdf,Communicative Message Passing for Inductive Relation Reasoning,"Sijie Mai, Shuangjia Zheng, Yuedong Yang, Haifeng Hu4294-4302",AAAI Technical Track on Data Mining and Knowledge Management,https://cdn.aaai.org/ojs/16554/16554-13-20048-1-2-20210518.pdf
AAAI,2021,learning_accurate_and_interpretable_decision_rule_sets_from_neural_networks__6c16198d.pdf,Learning Accurate and Interpretable Decision Rule Sets from Neural Networks,"Litao Qiao, Weijia Wang, Bill Lin4303-4311",AAAI Technical Track on Data Mining and Knowledge Management,https://cdn.aaai.org/ojs/16555/16555-13-20049-1-2-20210518.pdf
AAAI,2021,robust_spatiotemporal_purchase_prediction_via_deep_meta_learning__eaa777ae.pdf,Robust Spatio-Temporal Purchase Prediction via Deep Meta Learning,"Huiling Qin, Songyu Ke, Xiaodu Yang, Haoran Xu, Xianyuan Zhan, Yu Zheng4312-4319",AAAI Technical Track on Data Mining and Knowledge Management,https://cdn.aaai.org/ojs/16556/16556-13-20050-1-2-20210518.pdf
AAAI,2021,ubert_pretraining_user_representations_for_improved_recommendation__b39c2c56.pdf,U-BERT: Pre-training User Representations for Improved Recommendation,"Zhaopeng Qiu, Xian Wu, Jingyue Gao, Wei Fan4320-4327",AAAI Technical Track on Data Mining and Knowledge Management,https://cdn.aaai.org/ojs/16557/16557-13-20051-1-2-20210518.pdf
AAAI,2021,docparser_hierarchical_document_structure_parsing_from_renderings__03d59427.pdf,DocParser: Hierarchical Document Structure Parsing from Renderings,"Johannes Rausch, Octavio Martinez, Fabian Bissig, Ce Zhang, Stefan Feuerriegel4328-4338",AAAI Technical Track on Data Mining and Knowledge Management,https://cdn.aaai.org/ojs/16558/16558-13-20052-1-2-20210518.pdf
AAAI,2021,relative_and_absolute_location_embedding_for_fewshot_node_classification_on_graph__bb6bb462.pdf,Relative and Absolute Location Embedding for Few-Shot Node Classification on Graph,"Zemin Liu, Yuan Fang, Chenghao Liu, Steven C.H. Hoi4267-4275",AAAI Technical Track on Data Mining and Knowledge Management,https://cdn.aaai.org/ojs/16551/16551-13-20045-1-2-20210518.pdf
AAAI,2021,online_learning_in_variable_feature_spaces_under_incomplete_supervision__1361931e.pdf,Online Learning in Variable Feature Spaces under Incomplete Supervision,"Yi He, Xu Yuan, Sheng Chen, Xindong Wu4106-4114",AAAI Technical Track on Data Mining and Knowledge Management,https://cdn.aaai.org/ojs/16532/16532-13-20026-1-2-20210518.pdf
AAAI,2021,complete_closed_time_intervalsrelated_patterns_mining__a14a44be.pdf,Complete Closed Time Intervals-Related Patterns Mining,"Omer David Harel, Robert Moskovitch4098-4105",AAAI Technical Track on Data Mining and Knowledge Management,https://cdn.aaai.org/ojs/16531/16531-13-20025-1-2-20210518.pdf
AAAI,2021,gan_ensemble_for_anomaly_detection__3bf08b00.pdf,GAN Ensemble for Anomaly Detection,"Xu Han, Xiaohui Chen, Li-Ping Liu4090-4097",AAAI Technical Track on Data Mining and Knowledge Management,https://cdn.aaai.org/ojs/16530/16530-13-20024-1-2-20210518.pdf
AAAI,2021,joint_air_quality_and_weather_prediction_based_on_multiadversarial_spatiotemporal_networks__5dbff4bc.pdf,Joint Air Quality and Weather Prediction Based on Multi-Adversarial Spatiotemporal Networks,"Jindong Han, Hao Liu, Hengshu Zhu, Hui Xiong, Dejing Dou4081-4089",AAAI Technical Track on Data Mining and Knowledge Management,https://cdn.aaai.org/ojs/16529/16529-13-20023-1-2-20210518.pdf
AAAI,2021,neuralac_learning_cooperation_and_competition_effects_for_match_outcome_prediction__c13e33f4.pdf,NeuralAC: Learning Cooperation and Competition Effects for Match Outcome Prediction,"Yin Gu, Qi Liu, Kai Zhang, Zhenya Huang, Runze Wu, Jianrong Tao4072-4080",AAAI Technical Track on Data Mining and Knowledge Management,https://cdn.aaai.org/ojs/16528/16528-13-20022-1-2-20210518.pdf
AAAI,2021,exploiting_behavioral_consistence_for_universal_user_representation__6d6ef6f2.pdf,Exploiting Behavioral Consistence for Universal User Representation,"Jie Gu, Feng Wang, Qinghui Sun, Zhiquan Ye, Xiaoxiao Xu, Jingmin Chen, Jun Zhang4063-4071",AAAI Technical Track on Data Mining and Knowledge Management,https://cdn.aaai.org/ojs/16527/16527-13-20021-1-2-20210518.pdf
