Conference,Year,Filename,Title,Authors,Category,PDF_URL
ICLR,2020,learning_to_learn_by_zerothorder_oracle__7132f49f.pdf,Learning to Learn by Zeroth-Order Oracle,"Yangjun Ruan, Yuanhao Xiong, Sashank Reddi, Sanjiv Kumar, Cho-Jui Hsieh",Accept (Poster),https://openreview.net/pdf?id=ryxz8CVYDH
ICLR,2020,pay_attention_to_features_transfer_learn_faster_cnns__fc0c08bc.pdf,"Pay Attention to Features, Transfer Learn Faster CNNs","Kafeng Wang, Xitong Gao, Yiren Zhao, Xingjian Li, Dejing Dou, Cheng-Zhong Xu",Accept (Poster),https://openreview.net/pdf?id=ryxyCeHtPB
ICLR,2020,diverse_trajectory_forecasting_with_determinantal_point_processes__426deefa.pdf,Diverse Trajectory Forecasting with Determinantal Point Processes,"Ye Yuan, Kris M. Kitani",Accept (Poster),https://openreview.net/pdf?id=ryxnY3NYPS
ICLR,2020,symplectic_odenet_learning_hamiltonian_dynamics_with_control__3e9b43ea.pdf,Symplectic ODE-Net: Learning Hamiltonian Dynamics with Control,"Yaofeng Desmond Zhong, Biswadip Dey, Amit Chakraborty",Accept (Poster),https://openreview.net/pdf?id=ryxmb1rKDS
ICLR,2020,neural_symbolic_reader_scalable_integration_of_distributed_and_symbolic_representations_for_reading_comprehension__d739b666.pdf,Neural Symbolic Reader: Scalable Integration of Distributed and Symbolic Representations for Reading Comprehension,"Xinyun Chen, Chen Liang, Adams Wei Yu, Denny Zhou, Dawn Song, Quoc V. Le",Accept (Spotlight),https://openreview.net/pdf?id=ryxjnREFwH
ICLR,2020,neurquri_neural_question_requirement_inspector_for_answerability_prediction_in_machine_reading_comprehension__a4769aa4.pdf,NeurQuRI: Neural Question Requirement Inspector for Answerability Prediction in Machine Reading Comprehension,"Seohyun Back, Sai Chetan Chinthakindi, Akhil Kedia, Haejun Lee, Jaegul Choo",Accept (Poster),https://openreview.net/pdf?id=ryxgsCVYPr
ICLR,2020,reinforcement_learning_with_competitive_ensembles_of_informationconstrained_primitives__8e68a2b6.pdf,Reinforcement Learning with Competitive  Ensembles of Information-Constrained Primitives,"Anirudh Goyal, Shagun Sodhani, Jonathan Binas, Xue Bin Peng, Sergey Levine, Yoshua Bengio",Accept (Poster),https://openreview.net/pdf?id=ryxgJTEYDr
ICLR,2020,a_closer_look_at_deep_policy_gradients__5dde00e2.pdf,A Closer Look at Deep Policy Gradients,"Andrew Ilyas, Logan Engstrom, Shibani Santurkar, Dimitris Tsipras, Firdaus Janoos, Larry Rudolph, Aleksander Madry",Accept (Talk),https://openreview.net/pdf?id=ryxdEkHtPS
ICLR,2020,a_metatransfer_objective_for_learning_to_disentangle_causal_mechanisms__beaf309c.pdf,A Meta-Transfer Objective for Learning to Disentangle Causal Mechanisms,"Yoshua Bengio, Tristan Deleu, Nasim Rahaman, Nan Rosemary Ke, Sebastien Lachapelle, Olexa Bilaniuk, Anirudh Goyal, Christopher Pal",Accept (Poster),https://openreview.net/pdf?id=ryxWIgBFPS
ICLR,2020,augmenting_noncollaborative_dialog_systems_with_explicit_semantic_and_strategic_dialog_history__6e537e7a.pdf,Augmenting Non-Collaborative Dialog Systems with Explicit Semantic and Strategic Dialog History,"Yiheng Zhou, Yulia Tsvetkov, Alan W Black, Zhou Yu",Accept (Poster),https://openreview.net/pdf?id=ryxQuANKPB
ICLR,2020,robust_training_with_ensemble_consensus__eded819c.pdf,Robust training with ensemble consensus,"Jisoo Lee, Sae-Young Chung",Accept (Poster),https://openreview.net/pdf?id=ryxOUTVYDH
ICLR,2020,gradient_ell_1_regularization_for_quantization_robustness__15e62759.pdf,Gradient $\ell_1$ Regularization for Quantization Robustness,"Milad Alizadeh, Arash Behboodi, Mart van Baalen, Christos Louizos, Tijmen Blankevoort, Max Welling",Accept (Poster),https://openreview.net/pdf?id=ryxK0JBtPr
ICLR,2020,distributionally_robust_neural_networks__8fbbe6e3.pdf,Distributionally Robust Neural Networks,"Shiori Sagawa*, Pang Wei Koh*, Tatsunori B. Hashimoto, Percy Liang",Accept (Poster),https://openreview.net/pdf?id=ryxGuJrFvS
ICLR,2020,infinitehorizon_differentiable_model_predictive_control__6460f7c6.pdf,Infinite-Horizon Differentiable Model Predictive Control,"Sebastian East, Marco Gallieri, Jonathan Masci, Jan Koutnik, Mark Cannon",Accept (Poster),https://openreview.net/pdf?id=ryxC6kSYPr
ICLR,2020,learning_to_coordinate_manipulation_skills_via_skill_behavior_diversification__6f5854bf.pdf,Learning to Coordinate Manipulation Skills via Skill Behavior Diversification,"Youngwoon Lee, Jingyun Yang, Joseph J. Lim",Accept (Poster),https://openreview.net/pdf?id=ryxB2lBtvH
ICLR,2020,hypermodels_for_exploration__afd84dea.pdf,Hypermodels for Exploration,"Vikranth Dwaracherla, Xiuyuan Lu, Morteza Ibrahimi, Ian Osband, Zheng Wen, Benjamin Van Roy",Accept (Poster),https://openreview.net/pdf?id=ryx6WgStPB
ICLR,2020,improved_memory_in_recurrent_neural_networks_with_sequential_nonnormal_dynamics__f17ecc3d.pdf,Improved memory in recurrent neural networks with sequential non-normal dynamics,"Emin Orhan, Xaq Pitkow",Accept (Poster),https://openreview.net/pdf?id=ryx1wRNFvB
ICLR,2020,vqwav2vec_selfsupervised_learning_of_discrete_speech_representations__4e196e5f.pdf,vq-wav2vec: Self-Supervised Learning of Discrete Speech Representations,"Alexei Baevski, Steffen Schneider, Michael Auli",Accept (Poster),https://openreview.net/pdf?id=rylwJxrYDS
ICLR,2020,finding_and_visualizing_weaknesses_of_deep_reinforcement_learning_agents__e82becd5.pdf,Finding and Visualizing Weaknesses of Deep Reinforcement Learning Agents,"Christian Rupprecht, Cyril Ibrahim, Christopher J. Pal",Accept (Poster),https://openreview.net/pdf?id=rylvYaNYDH
ICLR,2020,state_alignmentbased_imitation_learning__bc58cedb.pdf,State Alignment-based Imitation Learning,"Fangchen Liu, Zhan Ling, Tongzhou Mu, Hao Su",Accept (Poster),https://openreview.net/pdf?id=rylrdxHFDr
ICLR,2020,deep_orientation_uncertainty_learning_based_on_a_bingham_loss__448fb59e.pdf,Deep Orientation Uncertainty Learning based on a Bingham Loss,"Igor Gilitschenski, Roshni Sahoo, Wilko Schwarting, Alexander Amini, Sertac Karaman, Daniela Rus",Accept (Poster),https://openreview.net/pdf?id=ryloogSKDS
ICLR,2020,multiplicative_interactions_and_where_to_find_them__9647bd01.pdf,Multiplicative Interactions and Where to Find Them,"Siddhant M. Jayakumar, Wojciech M. Czarnecki, Jacob Menick, Jonathan Schwarz, Jack Rae, Simon Osindero, Yee Whye Teh, Tim Harley, Razvan Pascanu",Accept (Poster),https://openreview.net/pdf?id=rylnK6VtDH
ICLR,2020,critical_initialisation_in_continuous_approximations_of_binary_neural_networks__c4db9469.pdf,Critical initialisation in continuous approximations of binary neural networks,"George Stamatescu, Federica Gerace, Carlo Lucibello, Ian Fuss, Langford White",Accept (Poster),https://openreview.net/pdf?id=rylmoxrFDH
ICLR,2020,robust_subspace_recovery_layer_for_unsupervised_anomaly_detection__a4ac00c2.pdf,Robust Subspace Recovery Layer for Unsupervised Anomaly Detection,"Chieh-Hsin Lai, Dongmian Zou, Gilad Lerman",Accept (Poster),https://openreview.net/pdf?id=rylb3eBtwr
ICLR,2020,a_baseline_for_fewshot_image_classification__56d1c169.pdf,A Baseline for Few-Shot Image Classification,"Guneet Singh Dhillon, Pratik Chaudhari, Avinash Ravichandran, Stefano Soatto",Accept (Poster),https://openreview.net/pdf?id=rylXBkrYDS
ICLR,2020,samplingfree_learning_of_bayesian_quantized_neural_networks__2735f0a6.pdf,Sampling-Free Learning of Bayesian Quantized Neural Networks,"Jiahao Su, Milan Cvitkovic, Furong Huang",Accept (Poster),https://openreview.net/pdf?id=rylVHR4FPB
ICLR,2020,learning_the_arrow_of_time_for_problems_in_reinforcement_learning__68a137e6.pdf,Learning the Arrow of Time for Problems in Reinforcement Learning,"Nasim Rahaman, Steffen Wolf, Anirudh Goyal, Roman Remme, Yoshua Bengio",Accept (Poster),https://openreview.net/pdf?id=rylJkpEtwS
ICLR,2020,learning_to_represent_programs_with_property_signatures__a766f28d.pdf,Learning to Represent Programs with Property Signatures,"Augustus Odena, Charles Sutton",Accept (Poster),https://openreview.net/pdf?id=rylHspEKPr
ICLR,2020,deephoyer_learning_sparser_neural_network_with_differentiable_scaleinvariant_sparsity_measures__ab675941.pdf,DeepHoyer: Learning Sparser Neural Network with Differentiable Scale-Invariant Sparsity Measures,"Huanrui Yang, Wei Wen, Hai Li",Accept (Poster),https://openreview.net/pdf?id=rylBK34FDS
ICLR,2020,lookahead_a_farsighted_alternative_of_magnitudebased_pruning__096f214c.pdf,Lookahead: A Far-sighted Alternative of Magnitude-based Pruning,"Sejun Park*, Jaeho Lee*, Sangwoo Mo, Jinwoo Shin",Accept (Poster),https://openreview.net/pdf?id=ryl3ygHYDB
ICLR,2020,regularizing_activations_in_neural_networks_via_distribution_matching_with_the_wasserstein_metric__6673bbc0.pdf,Regularizing activations in neural networks via distribution matching with the Wasserstein metric,"Taejong Joo, Donggu Kang, Byunghoon Kim",Accept (Poster),https://openreview.net/pdf?id=rygwLgrYPB
ICLR,2020,differenceseeking_generative_adversarial_networkunseen_sample_generation__2331aea0.pdf,Difference-Seeking Generative Adversarial Network--Unseen Sample Generation,"Yi Lin Sung, Sung-Hsien Hsieh, Soo-Chang Pei, Chun-Shien Lu",Accept (Poster),https://openreview.net/pdf?id=rygjmpVFvB
ICLR,2020,deep_audio_priors_emerge_from_harmonic_convolutional_networks__d3a3bded.pdf,Deep Audio Priors Emerge From Harmonic Convolutional Networks,"Zhoutong Zhang, Yunyun Wang, Chuang Gan, Jiajun Wu, Joshua B. Tenenbaum, Antonio Torralba, William T. Freeman",Accept (Poster),https://openreview.net/pdf?id=rygjHxrYDB
ICLR,2020,geometric_analysis_of_nonconvex_optimization_landscapes_for_overcomplete_learning__6f73ec15.pdf,Geometric Analysis of Nonconvex Optimization Landscapes for Overcomplete Learning,"Qing Qu, Yuexiang Zhai, Xiao Li, Yuqian Zhang, Zhihui Zhu",Accept (Talk),https://openreview.net/pdf?id=rygixkHKDH
ICLR,2020,deep_batch_active_learning_by_diverse_uncertain_gradient_lower_bounds__7825bf39.pdf,"Deep Batch Active Learning by Diverse, Uncertain Gradient Lower Bounds","Jordan T. Ash, Chicheng Zhang, Akshay Krishnamurthy, John Langford, Alekh Agarwal",Accept (Talk),https://openreview.net/pdf?id=ryghZJBKPS
ICLR,2020,autoq_automated_kernelwise_neural_network_quantization___b65c70e3.pdf,AutoQ: Automated Kernel-Wise Neural Network Quantization ,"Qian Lou, Feng Guo, Minje Kim, Lantao Liu, Lei Jiang.",Accept (Poster),https://openreview.net/pdf?id=rygfnn4twS
ICLR,2020,behaviour_suite_for_reinforcement_learning__bdeccdd1.pdf,Behaviour Suite for Reinforcement Learning,"Ian Osband, Yotam Doron, Matteo Hessel, John Aslanides, Eren Sezener, Andre Saraiva, Katrina McKinney, Tor Lattimore, Csaba Szepesvari, Satinder Singh, Benjamin Van Roy, Richard Sutton, David Silver, Hado Van Hasselt",Accept (Spotlight),https://openreview.net/pdf?id=rygf-kSYwH
ICLR,2020,disentanglement_by_nonlinear_ica_with_general_incompressibleflow_networks_gin__6d37fe06.pdf,Disentanglement by Nonlinear ICA with General Incompressible-flow Networks (GIN),"Peter Sorrenson, Carsten Rother, Ullrich Köthe",Accept (Spotlight),https://openreview.net/pdf?id=rygeHgSFDH
ICLR,2020,the_curious_case_of_neural_text_degeneration__d34ff120.pdf,The Curious Case of Neural Text Degeneration,"Ari Holtzman, Jan Buys, Li Du, Maxwell Forbes, Yejin Choi",Accept (Poster),https://openreview.net/pdf?id=rygGQyrFvH
ICLR,2020,chameleon_adaptive_code_optimization_for_expedited_deep_neural_network_compilation__9e060fcb.pdf,Chameleon: Adaptive Code Optimization for Expedited Deep Neural Network Compilation,"Byung Hoon Ahn, Prannoy Pilligundla, Amir Yazdanbakhsh, Hadi Esmaeilzadeh",Accept (Poster),https://openreview.net/pdf?id=rygG4AVFvH
ICLR,2020,stochastic_weight_averaging_in_parallel_largebatch_training_that_generalizes_well__94ac1a35.pdf,Stochastic Weight Averaging in Parallel: Large-Batch Training That Generalizes Well,"Vipul Gupta, Santiago Akle Serrano, Dennis DeCoste",Accept (Poster),https://openreview.net/pdf?id=rygFWAEFwS
ICLR,2020,action_semantics_network_considering_the_effects_of_actions_in_multiagent_systems__39490a51.pdf,Action Semantics Network: Considering the Effects of Actions in Multiagent Systems,"Weixun Wang, Tianpei Yang, Yong Liu, Jianye Hao, Xiaotian Hao, Yujing Hu, Yingfeng Chen, Changjie Fan, Yang Gao",Accept (Poster),https://openreview.net/pdf?id=ryg48p4tPH
ICLR,2020,a_constructive_prediction_of_the_generalization_error_across_scales__f4f990e6.pdf,A Constructive Prediction of the Generalization Error Across Scales,"Jonathan S. Rosenfeld, Amir Rosenfeld, Yonatan Belinkov, Nir Shavit",Accept (Poster),https://openreview.net/pdf?id=ryenvpEKDr
ICLR,2020,adversarially_robust_transfer_learning__3dcd19bd.pdf,Adversarially robust transfer learning,"Ali Shafahi, Parsa Saadatpanah, Chen Zhu, Amin Ghiasi, Christoph Studer, David Jacobs, Tom Goldstein",Accept (Poster),https://openreview.net/pdf?id=ryebG04YvB
ICLR,2020,metalearning_acquisition_functions_for_transfer_learning_in_bayesian_optimization__792cb0cf.pdf,Meta-Learning Acquisition Functions for Transfer Learning in Bayesian Optimization,"Michael Volpp, Lukas P. Fröhlich, Kirsten Fischer, Andreas Doerr, Stefan Falkner, Frank Hutter, Christian Daniel",Accept (Spotlight),https://openreview.net/pdf?id=ryeYpJSKwr
ICLR,2020,hypersagnn_a_selfattention_based_graph_neural_network_for_hypergraphs__a5aea412.pdf,Hyper-SAGNN: a self-attention based graph neural network for hypergraphs,"Ruochi Zhang, Yuesong Zou, Jian Ma",Accept (Poster),https://openreview.net/pdf?id=ryeHuJBtPH
ICLR,2020,learning_expensive_coordination_an_eventbased_deep_rl_approach__f0e58799.pdf,Learning Expensive Coordination: An Event-Based Deep RL Approach,"Zhenyu Shi*, Runsheng Yu*, Xinrun Wang*, Rundong Wang, Youzhi Zhang, Hanjiang Lai, Bo An",Accept (Poster),https://openreview.net/pdf?id=ryeG924twB
ICLR,2020,coherent_gradients_an_approach_to_understanding_generalization_in_gradient_descentbased_optimization__b13f6a8b.pdf,Coherent Gradients: An Approach to Understanding Generalization in Gradient Descent-based Optimization,Satrajit Chatterjee,Accept (Poster),https://openreview.net/pdf?id=ryeFY0EFwS
ICLR,2020,sadam_a_variant_of_adam_for_strongly_convex_functions__77e5fa16.pdf,SAdam: A Variant of Adam for Strongly Convex Functions,"Guanghui Wang, Shiyin Lu, Quan Cheng, Wei-wei Tu, Lijun Zhang",Accept (Poster),https://openreview.net/pdf?id=rye5YaEtPr
ICLR,2020,neural_storedprogram_memory__afc868c7.pdf,Neural Stored-program Memory,"Hung Le, Truyen Tran, Svetha Venkatesh",Accept (Poster),https://openreview.net/pdf?id=rkxxA24FDr
ICLR,2020,spikegrad_an_annequivalent_computation_model_for_implementing_backpropagation_with_spikes__e5e388c8.pdf,SpikeGrad: An ANN-equivalent Computation Model for Implementing Backpropagation with Spikes,"Johannes C. Thiele, Olivier Bichler, Antoine Dupret",Accept (Poster),https://openreview.net/pdf?id=rkxs0yHFPH
ICLR,2020,on_mutual_information_maximization_for_representation_learning__8488bb3c.pdf,On Mutual Information Maximization for Representation Learning,"Michael Tschannen, Josip Djolonga, Paul K. Rubenstein, Sylvain Gelly, Mario Lucic",Accept (Poster),https://openreview.net/pdf?id=rkxoh24FPH
ICLR,2020,end_to_end_trainable_active_contours_via_differentiable_rendering__409e8923.pdf,End to End Trainable Active Contours via Differentiable Rendering,"Shir Gur, Tal Shaharabany, Lior Wolf",Accept (Poster),https://openreview.net/pdf?id=rkxawlHKDr
ICLR,2020,online_and_stochastic_optimization_beyond_lipschitz_continuity_a_riemannian_approach__6050112d.pdf,Online and stochastic optimization beyond Lipschitz continuity: A Riemannian approach,"Kimon Antonakopoulos, E. Veronica Belmega, Panayotis Mertikopoulos",Accept (Spotlight),https://openreview.net/pdf?id=rkxZyaNtwB
ICLR,2020,quantifying_pointprediction_uncertainty_in_neural_networks_via_residual_estimation_with_an_io_kernel__c7505034.pdf,Quantifying Point-Prediction Uncertainty in Neural Networks via Residual Estimation with an I/O Kernel,"Xin Qiu, Elliot Meyerson, Risto Miikkulainen",Accept (Poster),https://openreview.net/pdf?id=rkxNh1Stvr
ICLR,2020,reinforced_genetic_algorithm_learning_for_optimizing_computation_graphs__1f606de7.pdf,Reinforced Genetic Algorithm Learning for Optimizing Computation Graphs,"Aditya Paliwal, Felix Gimeno, Vinod Nair, Yujia Li, Miles Lubin, Pushmeet Kohli, Oriol Vinyals",Accept (Poster),https://openreview.net/pdf?id=rkxDoJBYPB
ICLR,2020,rotationinvariant_clustering_of_neuronal_responses_in_primary_visual_cortex__25fba8a4.pdf,Rotation-invariant clustering of neuronal responses in primary visual cortex,"Ivan Ustyuzhaninov, Santiago A. Cadena, Emmanouil Froudarakis, Paul G. Fahey, Edgar Y. Walker, Erick Cobos, Jacob Reimer, Fabian H. Sinz, Andreas S. Tolias, Matthias Bethge, Alexander S. Ecker",Accept (Talk),https://openreview.net/pdf?id=rklr9kHFDB
ICLR,2020,automated_relational_metalearning__b5c9f226.pdf,Automated Relational Meta-learning,"Huaxiu Yao, Xian Wu, Zhiqiang Tao, Yaliang Li, Bolin Ding, Ruirui Li, Zhenhui Li",Accept (Poster),https://openreview.net/pdf?id=rklp93EtwH
ICLR,2020,compositional_language_continual_learning__7b5bb134.pdf,Compositional Language Continual Learning,"Yuanpeng Li, Liang Zhao, Kenneth Church, Mohamed Elhoseiny",Accept (Poster),https://openreview.net/pdf?id=rklnDgHtDS
ICLR,2020,beyond_linearization_on_quadratic_and_higherorder_approximation_of_wide_neural_networks__96f07660.pdf,Beyond Linearization: On Quadratic and Higher-Order Approximation of Wide Neural Networks,"Yu Bai, Jason D. Lee",Accept (Poster),https://openreview.net/pdf?id=rkllGyBFPH
ICLR,2020,provable_robustness_against_all_adversarial_l_pperturbations_for_pgeq_1__3878b479.pdf,Provable robustness against all adversarial $l_p$-perturbations for $p\geq 1$,"Francesco Croce, Matthias Hein",Accept (Poster),https://openreview.net/pdf?id=rklk_ySYPB
ICLR,2020,gradientbased_neural_dag_learning__ab3ecf9f.pdf,Gradient-Based Neural DAG Learning,"Sébastien Lachapelle, Philippe Brouillard, Tristan Deleu, Simon Lacoste-Julien",Accept (Poster),https://openreview.net/pdf?id=rklbKA4YDS
ICLR,2020,fast_neural_network_adaptation_via_parameter_remapping_and_architecture_search__fd24af07.pdf,Fast Neural Network Adaptation via Parameter Remapping and Architecture Search,"Jiemin Fang*, Yuzhu Sun*, Kangjian Peng*, Qian Zhang, Yuan Li, Wenyu Liu, Xinggang Wang",Accept (Poster),https://openreview.net/pdf?id=rklTmyBKPH
ICLR,2020,improving_adversarial_robustness_requires_revisiting_misclassified_examples__12445a95.pdf,Improving Adversarial Robustness Requires Revisiting Misclassified Examples,"Yisen Wang, Difan Zou, Jinfeng Yi, James Bailey, Xingjun Ma, Quanquan Gu",Accept (Poster),https://openreview.net/pdf?id=rklOg6EFwS
ICLR,2020,harnessing_structures_for_valuebased_planning_and_reinforcement_learning__ddf3db4f.pdf,Harnessing Structures for Value-Based Planning and Reinforcement Learning,"Yuzhe Yang, Guo Zhang, Zhi Xu, Dina Katabi",Accept (Talk),https://openreview.net/pdf?id=rklHqRVKvH
ICLR,2020,estimating_gradients_for_discrete_random_variables_by_sampling_without_replacement__e15e359d.pdf,Estimating Gradients for Discrete Random Variables by Sampling without Replacement,"Wouter Kool, Herke van Hoof, Max Welling",Accept (Spotlight),https://openreview.net/pdf?id=rklEj2EFvB
ICLR,2020,can_gradient_clipping_mitigate_label_noise__635bb714.pdf,Can gradient clipping mitigate label noise?,"Aditya Krishna Menon, Ankit Singh Rawat, Sashank J. Reddi, Sanjiv Kumar",Accept (Poster),https://openreview.net/pdf?id=rklB76EKPr
ICLR,2020,harnessing_the_power_of_infinitely_wide_deep_nets_on_smalldata_tasks__7835fc64.pdf,Harnessing the Power of Infinitely Wide Deep Nets on Small-data Tasks,"Sanjeev Arora, Simon S. Du, Zhiyuan Li, Ruslan Salakhutdinov, Ruosong Wang, Dingli Yu",Accept (Spotlight),https://openreview.net/pdf?id=rkl8sJBYvH
ICLR,2020,learning_to_group_a_bottomup_framework_for_3d_part_discovery_in_unseen_categories__f397c01d.pdf,Learning to Group: A Bottom-Up Framework for 3D Part Discovery in Unseen Categories,"Tiange Luo, Kaichun Mo, Zhiao Huang, Jiarui Xu, Siyu Hu, Liwei Wang, Hao Su",Accept (Poster),https://openreview.net/pdf?id=rkl8dlHYvB
ICLR,2020,exploratory_not_explanatory_counterfactual_analysis_of_saliency_maps_for_deep_reinforcement_learning__6d846527.pdf,Exploratory Not Explanatory: Counterfactual Analysis of Saliency Maps for Deep Reinforcement Learning,"Akanksha Atrey, Kaleigh Clary, David Jensen",Accept (Poster),https://openreview.net/pdf?id=rkl3m1BFDB
ICLR,2020,space_unsupervised_objectoriented_scene_representation_via_spatial_attention_and_decomposition__e4250a92.pdf,SPACE: Unsupervised Object-Oriented Scene Representation via Spatial Attention and Decomposition,"Zhixuan Lin, Yi-Fu Wu, Skand Vishwanath Peri, Weihao Sun, Gautam Singh, Fei Deng, Jindong Jiang, Sungjin Ahn",Accept (Poster),https://openreview.net/pdf?id=rkl03ySYDH
ICLR,2020,on_the_variance_of_the_adaptive_learning_rate_and_beyond__0b27c4ec.pdf,On the Variance of the Adaptive Learning Rate and Beyond,"Liyuan Liu, Haoming Jiang, Pengcheng He, Weizhu Chen, Xiaodong Liu, Jianfeng Gao, Jiawei Han",Accept (Poster),https://openreview.net/pdf?id=rkgz2aEKDr
ICLR,2020,dba_distributed_backdoor_attacks_against_federated_learning__7ae216a1.pdf,DBA: Distributed Backdoor Attacks against Federated Learning,"Chulin Xie, Keli Huang, Pin-Yu Chen, Bo Li",Accept (Poster),https://openreview.net/pdf?id=rkgyS0VFvr
ICLR,2020,seed_rl_scalable_and_efficient_deeprl_with_accelerated_central_inference__78331494.pdf,SEED RL: Scalable and Efficient Deep-RL with Accelerated Central Inference,"Lasse Espeholt, Raphaël Marinier, Piotr Stanczyk, Ke Wang, Marcin Michalski‎",Accept (Talk),https://openreview.net/pdf?id=rkgvXlrKwH
ICLR,2020,curriculum_loss_robust_learning_and_generalization_against_label_corruption__5a813d48.pdf,Curriculum Loss: Robust Learning and Generalization  against Label Corruption,"Yueming Lyu, Ivor W. Tsang",Accept (Poster),https://openreview.net/pdf?id=rkgt0REKwS
ICLR,2020,provable_benefit_of_orthogonal_initialization_in_optimizing_deep_linear_networks__a465aff5.pdf,Provable Benefit of Orthogonal Initialization in Optimizing Deep Linear Networks,"Wei Hu, Lechao Xiao, Jeffrey Pennington",Accept (Poster),https://openreview.net/pdf?id=rkgqN1SYvr
ICLR,2020,sharing_knowledge_in_multitask_deep_reinforcement_learning__9ab07889.pdf,Sharing Knowledge in Multi-Task Deep Reinforcement Learning,"Carlo D'Eramo, Davide Tateo, Andrea Bonarini, Marcello Restelli, Jan Peters",Accept (Poster),https://openreview.net/pdf?id=rkgpv2VFvr
ICLR,2020,understanding_generalization_in_recurrent_neural_networks__5ad3e256.pdf,Understanding Generalization in Recurrent Neural Networks,"Zhuozhuo Tu, Fengxiang He, Dacheng Tao",Accept (Poster),https://openreview.net/pdf?id=rkgg6xBYDH
ICLR,2020,effect_of_activation_functions_on_the_training_of_overparametrized_neural_nets__90903599.pdf,Effect of Activation Functions on the Training of Overparametrized Neural Nets,"Abhishek Panigrahi, Abhishek Shetty, Navin Goyal",Accept (Poster),https://openreview.net/pdf?id=rkgfdeBYvH
ICLR,2020,disagreementregularized_imitation_learning__4adefb30.pdf,Disagreement-Regularized Imitation Learning,"Kiante Brantley, Wen Sun, Mikael Henaff",Accept (Spotlight),https://openreview.net/pdf?id=rkgbYyHtwB
ICLR,2020,infinitehorizon_offpolicy_policy_evaluation_with_multiple_behavior_policies__64766f46.pdf,Infinite-horizon Off-Policy Policy Evaluation with Multiple Behavior Policies,"Xinyun Chen, Lu Wang, Yizhe Hang, Heng Ge, Hongyuan Zha",Accept (Poster),https://openreview.net/pdf?id=rkgU1gHtvr
ICLR,2020,pure_and_spurious_critical_points_a_geometric_study_of_linear_networks__79a0847a.pdf,Pure and Spurious Critical Points: a Geometric Study of Linear Networks,"Matthew Trager, Kathlén Kohn, Joan Bruna",Accept (Poster),https://openreview.net/pdf?id=rkgOlCVYvB
ICLR,2020,learned_step_size_quantization__e4528028.pdf,LEARNED STEP SIZE QUANTIZATION,"Steven K. Esser, Jeffrey L. McKinstry, Deepika Bablani, Rathinakumar Appuswamy, Dharmendra S. Modha",Accept (Poster),https://openreview.net/pdf?id=rkgO66VKDS
ICLR,2020,reformer_the_efficient_transformer__923c7a4f.pdf,Reformer: The Efficient Transformer,"Nikita Kitaev, Lukasz Kaiser, Anselm Levskaya",Accept (Talk),https://openreview.net/pdf?id=rkgNKkHtvB
ICLR,2020,rapid_learning_or_feature_reuse_towards_understanding_the_effectiveness_of_maml__515b5ddf.pdf,Rapid Learning or Feature Reuse? Towards Understanding the Effectiveness of MAML,"Aniruddh Raghu, Maithra Raghu, Samy Bengio, Oriol Vinyals",Accept (Poster),https://openreview.net/pdf?id=rkgMkCEtPB
ICLR,2020,discovering_motor_programs_by_recomposing_demonstrations__dd1ce2c0.pdf,Discovering Motor Programs by Recomposing Demonstrations,"Tanmay Shankar, Shubham Tulsiani, Lerrel Pinto, Abhinav Gupta",Accept (Poster),https://openreview.net/pdf?id=rkgHY0NYwr
ICLR,2020,metadataset_a_dataset_of_datasets_for_learning_to_learn_from_few_examples__ef3d3ec5.pdf,Meta-Dataset: A Dataset of Datasets for Learning to Learn from Few Examples,"Eleni Triantafillou, Tyler Zhu, Vincent Dumoulin, Pascal Lamblin, Utku Evci, Kelvin Xu, Ross Goroshin, Carles Gelada, Kevin Swersky, Pierre-Antoine Manzagol, Hugo Larochelle",Accept (Poster),https://openreview.net/pdf?id=rkgAGAVKPr
ICLR,2020,intrinsically_motivated_discovery_of_diverse_patterns_in_selforganizing_systems__35f0a57f.pdf,Intrinsically Motivated Discovery of Diverse Patterns in Self-Organizing Systems,"Chris Reinke, Mayalen Etcheverry, Pierre-Yves Oudeyer",Accept (Talk),https://openreview.net/pdf?id=rkg6sJHYDr
ICLR,2020,information_geometry_of_orthogonal_initializations_and_training__430702c7.pdf,Information Geometry of Orthogonal Initializations and Training,"Piotr Aleksander Sokół, Il Memming Park",Accept (Poster),https://openreview.net/pdf?id=rkg1ngrFPr
ICLR,2020,pretraining_tasks_for_embeddingbased_largescale_retrieval__e46c6c51.pdf,Pre-training Tasks for Embedding-based Large-scale Retrieval,"Wei-Cheng Chang, Felix X. Yu, Yin-Wen Chang, Yiming Yang, Sanjiv Kumar",Accept (Poster),https://openreview.net/pdf?id=rkg-mA4FDr
