Conference,Year,Filename,Title,Authors,Category,PDF_URL
ICLR,2020,weakly_supervised_disentanglement_with_guarantees__db7adb6d.pdf,Weakly Supervised Disentanglement with Guarantees,"Rui Shu, Yining Chen, Abhishek Kumar, Stefano Ermon, Ben Poole",Accept (Poster),https://openreview.net/pdf?id=HJgSwyBKvr
ICLR,2020,dynamicsaware_unsupervised_discovery_of_skills__95a9d44c.pdf,Dynamics-Aware Unsupervised Discovery of Skills,"Archit Sharma, Shixiang Gu, Sergey Levine, Vikash Kumar, Karol Hausman",Accept (Talk),https://openreview.net/pdf?id=HJgLZR4KvH
ICLR,2020,stateonly_imitation_with_transition_dynamics_mismatch__82fd4fee.pdf,State-only Imitation with Transition Dynamics Mismatch,"Tanmay Gangwani, Jian Peng",Accept (Poster),https://openreview.net/pdf?id=HJgLLyrYwB
ICLR,2020,theory_and_evaluation_metrics_for_learning_disentangled_representations__0d6f556a.pdf,Theory and Evaluation Metrics for Learning Disentangled Representations,"Kien Do, Truyen Tran",Accept (Poster),https://openreview.net/pdf?id=HJgK0h4Ywr
ICLR,2020,reclor_a_reading_comprehension_dataset_requiring_logical_reasoning__d9e0127f.pdf,ReClor: A Reading Comprehension Dataset Requiring Logical Reasoning,"Weihao Yu, Zihang Jiang, Yanfei Dong, Jiashi Feng",Accept (Poster),https://openreview.net/pdf?id=HJgJtT4tvB
ICLR,2020,dividemix_learning_with_noisy_labels_as_semisupervised_learning__da82eb68.pdf,DivideMix: Learning with Noisy Labels as Semi-supervised Learning,"Junnan Li, Richard Socher, Steven C.H. Hoi",Accept (Poster),https://openreview.net/pdf?id=HJgExaVtwr
ICLR,2020,adversarial_policies_attacking_deep_reinforcement_learning__c6f1fbeb.pdf,Adversarial Policies: Attacking Deep Reinforcement Learning,"Adam Gleave, Michael Dennis, Cody Wild, Neel Kant, Sergey Levine, Stuart Russell",Accept (Poster),https://openreview.net/pdf?id=HJgEMpVFwB
ICLR,2020,probabilistic_connection_importance_inference_and_lossless_compression_of_deep_neural_networks__49c102c0.pdf,Probabilistic Connection Importance Inference and Lossless Compression of Deep Neural Networks,"Xin Xing, Long Sha, Pengyu Hong, Zuofeng Shang, Jun S. Liu",Accept (Poster),https://openreview.net/pdf?id=HJgCF0VFwr
ICLR,2020,robust_reinforcement_learning_for_continuous_control_with_model_misspecification__efdad22d.pdf,Robust Reinforcement Learning for Continuous Control with Model Misspecification,"Daniel J. Mankowitz, Nir Levine, Rae Jeong, Abbas Abdolmaleki, Jost Tobias Springenberg, Yuanyuan Shi, Jackie Kay, Todd Hester, Timothy Mann, Martin Riedmiller",Accept (Poster),https://openreview.net/pdf?id=HJgC60EtwB
ICLR,2020,fspool_learning_set_representations_with_featurewise_sort_pooling__6d616d85.pdf,FSPool: Learning Set Representations with Featurewise Sort Pooling,"Yan Zhang, Jonathon Hare, Adam Prügel-Bennett",Accept (Poster),https://openreview.net/pdf?id=HJgBA2VYwH
ICLR,2020,selection_via_proxy_efficient_data_selection_for_deep_learning__3c2f750e.pdf,Selection via Proxy: Efficient Data Selection for Deep Learning,"Cody Coleman, Christopher Yeh, Stephen Mussmann, Baharan Mirzasoleiman, Peter Bailis, Percy Liang, Jure Leskovec, Matei Zaharia",Accept (Poster),https://openreview.net/pdf?id=HJg2b0VYDr
ICLR,2020,federated_adversarial_domain_adaptation__ff498a08.pdf,Federated Adversarial Domain Adaptation,"Xingchao Peng, Zijun Huang, Yizhe Zhu, Kate Saenko",Accept (Poster),https://openreview.net/pdf?id=HJezF3VYPB
ICLR,2020,denoising_and_regularization_via_exploiting_the_structural_bias_of_convolutional_generators__73a1eea6.pdf,Denoising and Regularization via Exploiting the Structural Bias of Convolutional Generators,Reinhard Heckel and Mahdi Soltanolkotabi,Accept (Poster),https://openreview.net/pdf?id=HJeqhA4YDS
ICLR,2020,stochastic_auc_maximization_with_deep_neural_networks__b4bf9bbc.pdf,Stochastic AUC Maximization with Deep Neural Networks,"Mingrui Liu, Zhuoning Yuan, Yiming Ying, Tianbao Yang",Accept (Poster),https://openreview.net/pdf?id=HJepXaVYDr
ICLR,2020,hamiltonian_generative_networks__fe372e5f.pdf,Hamiltonian Generative Networks,"Peter Toth, Danilo J. Rezende, Andrew Jaegle, Sébastien Racanière, Aleksandar Botev, Irina Higgins",Accept (Spotlight),https://openreview.net/pdf?id=HJenn6VFvB
ICLR,2020,empir_ensembles_of_mixed_precision_deep_networks_for_increased_robustness_against_adversarial_attacks__2f6c523e.pdf,EMPIR: Ensembles of Mixed Precision Deep Networks for Increased Robustness Against Adversarial Attacks,"Sanchari Sen, Balaraman Ravindran, Anand Raghunathan",Accept (Poster),https://openreview.net/pdf?id=HJem3yHKwH
ICLR,2020,an_inductive_bias_for_distances_neural_nets_that_respect_the_triangle_inequality__7809647d.pdf,An Inductive Bias for Distances: Neural Nets that Respect the Triangle Inequality,"Silviu Pitis, Harris Chan, Kiarash Jamali, Jimmy Ba",Accept (Poster),https://openreview.net/pdf?id=HJeiDpVFPr
ICLR,2020,editable_neural_networks__c26aab94.pdf,Editable Neural Networks,"Anton Sinitsin, Vsevolod Plokhotnyuk, Dmitry Pyrkin, Sergei Popov, Artem Babenko",Accept (Poster),https://openreview.net/pdf?id=HJedXaEtvS
ICLR,2020,improved_sample_complexities_for_deep_neural_networks_and_robust_classification_via_an_alllayer_margin__add43dc7.pdf,Improved Sample Complexities for Deep Neural Networks and Robust Classification via an All-Layer Margin,"Colin Wei, Tengyu Ma",Accept (Poster),https://openreview.net/pdf?id=HJe_yR4Fwr
ICLR,2020,adjustable_realtime_style_transfer__607a75aa.pdf,Adjustable Real-time Style Transfer,"Mohammad Babaeizadeh, Golnaz Ghiasi",Accept (Poster),https://openreview.net/pdf?id=HJe_Z04Yvr
ICLR,2020,a_closer_look_at_the_optimization_landscapes_of_generative_adversarial_networks__5884140d.pdf,A Closer Look at the Optimization Landscapes of Generative Adversarial Networks,"Hugo Berard, Gauthier Gidel, Amjad Almahairi, Pascal Vincent, Simon Lacoste-Julien",Accept (Poster),https://openreview.net/pdf?id=HJeVnCEKwH
ICLR,2020,a_signal_propagation_perspective_for_pruning_neural_networks_at_initialization__f836c472.pdf,A Signal Propagation Perspective for Pruning Neural Networks at Initialization,"Namhoon Lee, Thalaiyasingam Ajanthan, Stephen Gould, Philip H. S. Torr",Accept (Spotlight),https://openreview.net/pdf?id=HJeTo2VFwH
ICLR,2020,crosslingual_ability_of_multilingual_bert_an_empirical_study__1c4c2204.pdf,Cross-Lingual Ability of Multilingual BERT: An Empirical Study,"Karthikeyan K, Zihan Wang, Stephen Mayhew, Dan Roth",Accept (Poster),https://openreview.net/pdf?id=HJeT3yrtDr
ICLR,2020,smoothness_and_stability_in_gans__c765dbef.pdf,Smoothness and Stability in GANs,"Casey Chu, Kentaro Minami, Kenji Fukumizu",Accept (Poster),https://openreview.net/pdf?id=HJeOekHKwr
ICLR,2020,deepv2d_video_to_depth_with_differentiable_structure_from_motion__8d6e9abd.pdf,DeepV2D: Video to Depth with Differentiable Structure from Motion,"Zachary Teed, Jia Deng",Accept (Poster),https://openreview.net/pdf?id=HJeO7RNKPr
ICLR,2020,capsules_with_inverted_dotproduct_attention_routing__d2a693ed.pdf,Capsules with Inverted Dot-Product Attention Routing,"Yao-Hung Hubert Tsai, Nitish Srivastava, Hanlin Goh, Ruslan Salakhutdinov",Accept (Poster),https://openreview.net/pdf?id=HJe6uANtwH
ICLR,2020,defending_against_physically_realizable_attacks_on_image_classification__2d5e1dd4.pdf,Defending Against Physically Realizable Attacks on Image Classification,"Tong Wu, Liang Tong, Yevgeniy Vorobeychik",Accept (Spotlight),https://openreview.net/pdf?id=H1xscnEKDr
ICLR,2020,are_pretrained_language_models_aware_of_phrases_simple_but_strong_baselines_for_grammar_induction__e6e2fd62.pdf,Are Pre-trained Language Models Aware of Phrases? Simple but Strong Baselines for Grammar Induction,"Taeuk Kim, Jihun Choi, Daniel Edmiston, Sang-goo Lee",Accept (Poster),https://openreview.net/pdf?id=H1xPR3NtPB
ICLR,2020,explanation_by_progressive_exaggeration__de7b39fb.pdf,Explanation  by Progressive  Exaggeration,"Sumedha Singla, Brian Pollack, Junxiang Chen, Kayhan Batmanghelich",Accept (Spotlight),https://openreview.net/pdf?id=H1xFWgrFPS
ICLR,2020,variational_heteroencoder_randomized_gans_for_joint_imagetext_modeling__2199f33c.pdf,Variational Hetero-Encoder Randomized GANs for Joint Image-Text Modeling,"Hao Zhang, Bo Chen, Long Tian, Zhengjue Wang, Mingyuan Zhou",Accept (Poster),https://openreview.net/pdf?id=H1x5wRVtvS
ICLR,2020,generalized_convolutional_forest_networks_for_domain_generalization_and_visual_recognition__8702fcd0.pdf,Generalized Convolutional Forest Networks for Domain Generalization and Visual Recognition,"Jongbin Ryu, Gitaek Kwon, Ming-Hsuan Yang, Jongwoo Lim",Accept (Poster),https://openreview.net/pdf?id=H1lxVyStPH
ICLR,2020,evaluating_the_search_phase_of_neural_architecture_search__8be7aeff.pdf,Evaluating The Search Phase of Neural Architecture Search,"Kaicheng Yu, Christian Sciuto, Martin Jaggi, Claudiu Musat, Mathieu Salzmann",Accept (Poster),https://openreview.net/pdf?id=H1loF2NFwr
ICLR,2020,augmenting_genetic_algorithms_with_deep_neural_networks_for_exploring_the_chemical_space__cf0a8da1.pdf,Augmenting Genetic Algorithms with Deep Neural Networks for Exploring the Chemical Space,"AkshatKumar Nigam, Pascal Friederich, Mario Krenn, Alan Aspuru-Guzik",Accept (Poster),https://openreview.net/pdf?id=H1lmyRNFvr
ICLR,2020,dynamical_distance_learning_for_semisupervised_and_unsupervised_skill_discovery__3f461e79.pdf,Dynamical Distance Learning for Semi-Supervised and Unsupervised Skill Discovery,"Kristian Hartikainen, Xinyang Geng, Tuomas Haarnoja, Sergey Levine",Accept (Poster),https://openreview.net/pdf?id=H1lmhaVtvr
ICLR,2020,principled_weight_initialization_for_hypernetworks__e72eba9c.pdf,Principled Weight Initialization for Hypernetworks,"Oscar Chang, Lampros Flokas, Hod Lipson",Accept (Talk),https://openreview.net/pdf?id=H1lma24tPB
ICLR,2020,the_implicit_bias_of_depth_how_incremental_learning_drives_generalization__49c6a2f8.pdf,The Implicit Bias of Depth: How Incremental Learning Drives Generalization,"Daniel Gissin, Shai Shalev-Shwartz, Amit Daniely",Accept (Poster),https://openreview.net/pdf?id=H1lj0nNFwB
ICLR,2020,actorcritic_provably_finds_nash_equilibria_of_linearquadratic_meanfield_games__0f0313b2.pdf,Actor-Critic Provably Finds Nash Equilibria of Linear-Quadratic Mean-Field Games,"Zuyue Fu, Zhuoran Yang, Yongxin Chen, Zhaoran Wang",Accept (Poster),https://openreview.net/pdf?id=H1lhqpEYPr
ICLR,2020,learning_compositional_koopman_operators_for_modelbased_control__bcc2c39e.pdf,Learning Compositional Koopman Operators for Model-Based Control,"Yunzhu Li, Hao He, Jiajun Wu, Dina Katabi, Antonio Torralba",Accept (Spotlight),https://openreview.net/pdf?id=H1ldzA4tPr
ICLR,2020,controlling_generative_models_with_continuous_factors_of_variations__3d3636cb.pdf,Controlling generative models with continuous factors of variations,"Antoine Plumerault, Hervé Le Borgne, Céline Hudelot",Accept (Poster),https://openreview.net/pdf?id=H1laeJrKDB
ICLR,2020,spectral_embedding_of_regularized_block_models__ee4e7a95.pdf,Spectral  Embedding of Regularized Block Models,"Nathan De Lara, Thomas Bonald",Accept (Spotlight),https://openreview.net/pdf?id=H1l_0JBYwS
ICLR,2020,robust_local_features_for_improving_the_generalization_of_adversarial_training__942e5212.pdf,Robust Local Features for Improving the Generalization of Adversarial Training,"Chuanbiao Song, Kun He, Jiadong Lin, Liwei Wang, John E. Hopcroft",Accept (Poster),https://openreview.net/pdf?id=H1lZJpVFvr
ICLR,2020,a_function_space_view_of_bounded_norm_infinite_width_relu_nets_the_multivariate_case__8128c029.pdf,A Function Space View of Bounded Norm Infinite Width ReLU Nets: The Multivariate Case,"Greg Ongie, Rebecca Willett, Daniel Soudry, Nathan Srebro",Accept (Poster),https://openreview.net/pdf?id=H1lNPxHKDH
ICLR,2020,classificationbased_anomaly_detection_for_general_data__30bd1786.pdf,Classification-Based Anomaly Detection for General Data,"Liron Bergman, Yedid Hoshen",Accept (Poster),https://openreview.net/pdf?id=H1lK_lBtvS
ICLR,2020,linear_symmetric_quantization_of_neural_networks_for_lowprecision_integer_hardware__fd80265a.pdf,Linear Symmetric Quantization of Neural Networks for Low-precision Integer Hardware,"Xiandong Zhao, Ying Wang, Xuyi Cai, Cheng Liu, Lei Zhang",Accept (Poster),https://openreview.net/pdf?id=H1lBj2VFPS
ICLR,2020,hierarchical_foresight_selfsupervised_learning_of_longhorizon_tasks_via_visual_subgoal_generation__55a48eec.pdf,Hierarchical Foresight: Self-Supervised Learning of Long-Horizon Tasks via Visual Subgoal Generation,"Suraj Nair, Chelsea Finn",Accept (Poster),https://openreview.net/pdf?id=H1gzR2VKDH
ICLR,2020,from_inference_to_generation_endtoend_fully_selfsupervised_generation_of_human_face_from_speech__087a07a1.pdf,From Inference to Generation: End-to-end Fully Self-supervised Generation of Human Face from Speech,"Hyeong-Seok Choi, Changdae Park, Kyogu Lee",Accept (Poster),https://openreview.net/pdf?id=H1guaREYPr
ICLR,2020,dataindependent_neural_pruning_via_coresets__fb381ee4.pdf,Data-Independent Neural Pruning via Coresets,"Ben Mussay, Margarita Osadchy, Vladimir Braverman, Samson Zhou, Dan Feldman",Accept (Poster),https://openreview.net/pdf?id=H1gmHaEKwB
ICLR,2020,adversarially_robust_representations_with_smooth_encoders__4e6a9b6e.pdf,Adversarially Robust Representations with Smooth Encoders,"Taylan Cemgil, Sumedh Ghaisas, Krishnamurthy (Dj) Dvijotham, Pushmeet Kohli",Accept (Poster),https://openreview.net/pdf?id=H1gfFaEYDS
ICLR,2020,contrastive_learning_of_structured_world_models__541fa788.pdf,Contrastive Learning of Structured World Models,"Thomas Kipf, Elise van der Pol, Max Welling",Accept (Talk),https://openreview.net/pdf?id=H1gax6VtDB
ICLR,2020,ddppo_learning_nearperfect_pointgoal_navigators_from_25_billion_frames__24b1723b.pdf,DD-PPO: Learning Near-Perfect PointGoal Navigators from 2.5 Billion Frames,"Erik Wijmans, Abhishek Kadian, Ari Morcos, Stefan Lee, Irfan Essa, Devi Parikh, Manolis Savva, Dhruv Batra",Accept (Poster),https://openreview.net/pdf?id=H1gX8C4YPr
ICLR,2020,neural_arithmetic_units__74ddb46c.pdf,Neural Arithmetic Units,"Andreas Madsen, Alexander Rosenberg Johansen",Accept (Spotlight),https://openreview.net/pdf?id=H1gNOeHKPS
ICLR,2020,understanding_and_robustifying_differentiable_architecture_search__1cc3fcf3.pdf,Understanding and Robustifying Differentiable Architecture Search,"Arber Zela, Thomas Elsken, Tonmoy Saikia, Yassine Marrakchi, Thomas Brox, Frank Hutter",Accept (Talk),https://openreview.net/pdf?id=H1gDNyrKDS
ICLR,2020,generalization_of_twolayer_neural_networks_an_asymptotic_viewpoint__bdad6023.pdf,Generalization of Two-layer Neural Networks: An Asymptotic Viewpoint,"Jimmy Ba, Murat Erdogdu, Taiji Suzuki, Denny Wu, Tianzong Zhang",Accept (Spotlight),https://openreview.net/pdf?id=H1gBsgBYwH
ICLR,2020,bspline_cnns_on_lie_groups__b6ccdf9e.pdf,B-Spline CNNs on Lie groups,Erik J Bekkers,Accept (Poster),https://openreview.net/pdf?id=H1gBhkBFDH
ICLR,2020,recurrent_neural_circuits_for_contour_detection__3a57b1e4.pdf,Recurrent neural circuits for contour detection,"Drew Linsley*, Junkyung Kim*, Alekh Ashok, Thomas Serre",Accept (Poster),https://openreview.net/pdf?id=H1gB4RVKvB
ICLR,2020,composing_taskagnostic_policies_with_deep_reinforcement_learning__9c4b9a20.pdf,Composing Task-Agnostic Policies with Deep Reinforcement Learning,"Ahmed H. Qureshi, Jacob J. Johnson, Yuzhe Qin, Taylor Henderson, Byron Boots, Michael C. Yip",Accept (Poster),https://openreview.net/pdf?id=H1ezFREtwH
ICLR,2020,exploring_modelbased_planning_with_policy_networks__2c987da2.pdf,Exploring Model-based Planning with Policy Networks,"Tingwu Wang, Jimmy Ba",Accept (Poster),https://openreview.net/pdf?id=H1exf64KwH
ICLR,2020,advectivenet_an_eulerianlagrangian_fluidic_reservoir_for_point_cloud_processing___415126b7.pdf,AdvectiveNet: An Eulerian-Lagrangian Fluidic Reservoir for Point Cloud Processing     ,"Xingzhe He, Helen Lu Cao, Bo Zhu",Accept (Poster),https://openreview.net/pdf?id=H1eqQeHFDS
ICLR,2020,stable_rank_normalization_for_improved_generalization_in_neural_networks_and_gans__46e40667.pdf,Stable Rank Normalization for Improved Generalization in Neural Networks and GANs,"Amartya Sanyal, Philip H. Torr, Puneet K. Dokania",Accept (Spotlight),https://openreview.net/pdf?id=H1enKkrFDB
ICLR,2020,fewshot_text_classification_with_distributional_signatures__982e7e75.pdf,Few-shot Text Classification with Distributional Signatures,"Yujia Bao, Menghua Wu, Shiyu Chang, Regina Barzilay",Accept (Poster),https://openreview.net/pdf?id=H1emfT4twB
ICLR,2020,plug_and_play_language_models_a_simple_approach_to_controlled_text_generation__3f1095f6.pdf,Plug and Play Language Models: A Simple Approach to Controlled Text Generation,"Sumanth Dathathri, Andrea Madotto, Janice Lan, Jane Hung, Eric Frank, Piero Molino, Jason Yosinski, Rosanne Liu",Accept (Poster),https://openreview.net/pdf?id=H1edEyBKDS
ICLR,2020,white_noise_analysis_of_neural_networks__30fa3de9.pdf,White Noise Analysis of Neural Networks,"Ali Borji, Sikun Lin",Accept (Spotlight),https://openreview.net/pdf?id=H1ebhnEYDH
ICLR,2020,nonautoregressive_dialog_state_tracking__fb3aa827.pdf,Non-Autoregressive Dialog State Tracking,"Hung Le, Richard Socher, Steven C.H. Hoi",Accept (Poster),https://openreview.net/pdf?id=H1e_cC4twS
ICLR,2020,on_the_weaknesses_of_reinforcement_learning_for_neural_machine_translation__2ce96e1a.pdf,On the Weaknesses of Reinforcement Learning for Neural Machine Translation,"Leshem Choshen, Lior Fox, Zohar Aizenbud, Omri Abend",Accept (Poster),https://openreview.net/pdf?id=H1eCw3EKvH
ICLR,2020,albert_a_lite_bert_for_selfsupervised_learning_of_language_representations__613f43c9.pdf,ALBERT: A Lite BERT for Self-supervised Learning of Language Representations,"Zhenzhong Lan, Mingda Chen, Sebastian Goodman, Kevin Gimpel, Piyush Sharma, Radu Soricut",Accept (Spotlight),https://openreview.net/pdf?id=H1eA7AEtvS
ICLR,2020,automated_curriculum_generation_through_settersolver_interactions__4b111612.pdf,Automated curriculum generation through setter-solver interactions,"Sebastien Racaniere, Andrew Lampinen, Adam Santoro, David Reichert, Vlad Firoiu, Timothy Lillicrap",Accept (Poster),https://openreview.net/pdf?id=H1e0Wp4KvH
ICLR,2020,inductive_matrix_completion_based_on_graph_neural_networks__27b0d239.pdf,Inductive Matrix Completion Based on Graph Neural Networks,"Muhan Zhang, Yixin Chen",Accept (Spotlight),https://openreview.net/pdf?id=ByxxgCEYDS
ICLR,2020,mixup_inference_better_exploiting_mixup_to_defend_adversarial_attacks__c117a51a.pdf,Mixup Inference: Better Exploiting Mixup to Defend Adversarial Attacks,"Tianyu Pang*, Kun Xu*, Jun Zhu",Accept (Poster),https://openreview.net/pdf?id=ByxtC2VtPB
ICLR,2020,adversarial_autoaugment__b5e512fa.pdf,Adversarial AutoAugment,"Xinyu Zhang, Qiang Wang, Jian Zhang, Zhao Zhong",Accept (Poster),https://openreview.net/pdf?id=ByxdUySKvS
ICLR,2020,mutual_information_gradient_estimation_for_representation_learning__992e6909.pdf,Mutual Information Gradient Estimation for  Representation Learning,"Liangjian Wen, Yiji Zhou, Lirong He, Mingyuan Zhou, Zenglin Xu",Accept (Poster),https://openreview.net/pdf?id=ByxaUgrFvH
ICLR,2020,jelly_bean_world_a_testbed_for_neverending_learning__4c75ba1c.pdf,Jelly Bean World: A Testbed for Never-Ending Learning,"Emmanouil Antonios Platanios, Abulhair Saparov, Tom Mitchell",Accept (Poster),https://openreview.net/pdf?id=Byx_YAVYPH
ICLR,2020,improving_neural_language_generation_with_spectrum_control__0f0666b9.pdf,Improving Neural Language Generation with Spectrum Control,"Lingxiao Wang, Jing Huang, Kevin Huang, Ziniu Hu, Guangtao Wang, Quanquan Gu",Accept (Poster),https://openreview.net/pdf?id=ByxY8CNtvr
ICLR,2020,semanticallyguided_representation_learning_for_selfsupervised_monocular_depth__ee19cc79.pdf,Semantically-Guided Representation Learning for Self-Supervised Monocular Depth,"Vitor Guizilini, Rui Hou, Jie Li, Rares Ambrus, Adrien Gaidon",Accept (Poster),https://openreview.net/pdf?id=ByxT7TNFvH
ICLR,2020,are_transformers_universal_approximators_of_sequencetosequence_functions__953c05a1.pdf,Are Transformers universal approximators of sequence-to-sequence functions?,"Chulhee Yun, Srinadh Bhojanapalli, Ankit Singh Rawat, Sashank Reddi, Sanjiv Kumar",Accept (Poster),https://openreview.net/pdf?id=ByxRM0Ntvr
ICLR,2020,abstract_diagrammatic_reasoning_with_multiplex_graph_networks__bfcb25dd.pdf,Abstract Diagrammatic Reasoning with Multiplex Graph Networks,"Duo Wang, Mateja Jamnik, Pietro Lio",Accept (Poster),https://openreview.net/pdf?id=ByxQB1BKwH
ICLR,2020,towards_neural_networks_that_provably_know_when_they_dont_know__87847a0f.pdf,Towards neural networks that provably know when they don't know,"Alexander Meinke, Matthias Hein",Accept (Poster),https://openreview.net/pdf?id=ByxGkySKwH
ICLR,2020,implementing_inductive_bias_for_different_navigation_tasks_through_diverse_rnn_attrractors__b392f940.pdf,Implementing Inductive bias for different navigation tasks through diverse RNN attrractors,"Tie XU, Omri Barak",Accept (Poster),https://openreview.net/pdf?id=Byx4NkrtDS
ICLR,2020,functional_vs_parametric_equivalence_of_relu_networks__6c16e16a.pdf,Functional vs. parametric equivalence of ReLU networks,"Mary Phuong, Christoph H. Lampert",Accept (Poster),https://openreview.net/pdf?id=Bylx-TNKvH
ICLR,2020,why_not_to_use_zero_imputation_correcting_sparsity_bias_in_training_neural_networks__0b05a4e9.pdf,Why Not to Use Zero Imputation? Correcting Sparsity Bias in Training Neural Networks,"Joonyoung Yi, Juhyuk Lee, Kwang Joon Kim, Sung Ju Hwang, Eunho Yang",Accept (Poster),https://openreview.net/pdf?id=BylsKkHYvH
ICLR,2020,a_targetagnostic_attack_on_deep_models_exploiting_security_vulnerabilities_of_transfer_learning__259aab81.pdf,A Target-Agnostic Attack on Deep Models: Exploiting Security Vulnerabilities of Transfer Learning,"Shahbaz Rezaei, Xin Liu",Accept (Poster),https://openreview.net/pdf?id=BylVcTNtDS
ICLR,2020,atomnas_finegrained_endtoend_neural_architecture_search__513d4710.pdf,AtomNAS: Fine-Grained End-to-End Neural Architecture Search,"Jieru Mei, Yingwei Li, Xiaochen Lian, Xiaojie Jin, Linjie Yang, Alan Yuille, Jianchao Yang",Accept (Poster),https://openreview.net/pdf?id=BylQSxHFwr
ICLR,2020,curvature_graph_network__f07b011b.pdf,Curvature Graph Network,"Ze Ye, Kin Sum Liu, Tengfei Ma, Jie Gao, Chao Chen",Accept (Poster),https://openreview.net/pdf?id=BylEqnVFDB
ICLR,2020,compositionbased_multirelational_graph_convolutional_networks__0adfc97c.pdf,Composition-based Multi-Relational Graph Convolutional Networks,"Shikhar Vashishth, Soumya Sanyal, Vikram Nitin, Partha Talukdar",Accept (Poster),https://openreview.net/pdf?id=BylA_C4tPr
ICLR,2020,neural_machine_translation_with_universal_visual_representation__e9ac3492.pdf,Neural Machine Translation with Universal Visual Representation,"Zhuosheng Zhang, Kehai Chen, Rui Wang, Masao Utiyama, Eiichiro Sumita, Zuchao Li, Hai Zhao",Accept (Spotlight),https://openreview.net/pdf?id=Byl8hhNYPS
ICLR,2020,thieves_on_sesame_street_model_extraction_of_bertbased_apis__a9469872.pdf,Thieves on Sesame Street! Model Extraction of BERT-based APIs,"Kalpesh Krishna, Gaurav Singh Tomar, Ankur P. Parikh, Nicolas Papernot, Mohit Iyyer",Accept (Poster),https://openreview.net/pdf?id=Byl5NREFDr
ICLR,2020,freelb_enhanced_adversarial_training_for_natural_language_understanding__e9083e46.pdf,FreeLB: Enhanced Adversarial Training for Natural Language Understanding,"Chen Zhu, Yu Cheng, Zhe Gan, Siqi Sun, Tom Goldstein, Jingjing Liu",Accept (Spotlight),https://openreview.net/pdf?id=BygzbyHFvB
ICLR,2020,expected_information_maximization_using_the_iprojection_for_mixture_density_estimation__840c2538.pdf,Expected Information Maximization: Using the I-Projection for Mixture Density Estimation,"Philipp Becker, Oleg Arenz, Gerhard Neumann",Accept (Poster),https://openreview.net/pdf?id=ByglLlHFDS
ICLR,2020,metalearning_curiosity_algorithms__3b1d6b97.pdf,Meta-learning curiosity algorithms,"Ferran Alet*, Martin F. Schneider*, Tomas Lozano-Perez, Leslie Pack Kaelbling",Accept (Poster),https://openreview.net/pdf?id=BygdyxHFDS
ICLR,2020,targetembedding_autoencoders_for_supervised_representation_learning__7cafc0e6.pdf,Target-Embedding Autoencoders for Supervised Representation Learning,"Daniel Jarrett, Mihaela van der Schaar",Accept (Talk),https://openreview.net/pdf?id=BygXFkSYDH
ICLR,2020,ensemble_distribution_distillation__b818673f.pdf,Ensemble Distribution Distillation,"Andrey Malinin, Bruno Mlodozeniec, Mark Gales",Accept (Poster),https://openreview.net/pdf?id=BygSP6Vtvr
ICLR,2020,sparse_coding_with_gated_learned_ista__96c84acb.pdf,Sparse Coding with Gated Learned ISTA,"Kailun Wu, Yiwen Guo, Ziang Li, Changshui Zhang",Accept (Spotlight),https://openreview.net/pdf?id=BygPO2VKPH
ICLR,2020,understanding_knowledge_distillation_in_nonautoregressive_machine_translation__4d1797ea.pdf,Understanding Knowledge Distillation in Non-autoregressive Machine Translation,"Chunting Zhou, Jiatao Gu, Graham Neubig",Accept (Poster),https://openreview.net/pdf?id=BygFVAEKDH
ICLR,2020,rethinking_softmax_crossentropy_loss_for_adversarial_robustness__fe47db7d.pdf,Rethinking Softmax Cross-Entropy Loss for Adversarial Robustness,"Tianyu Pang, Kun Xu, Yinpeng Dong, Chao Du, Ning Chen, Jun Zhu",Accept (Poster),https://openreview.net/pdf?id=Byg9A24tvB
ICLR,2020,short_and_sparse_deconvolution__a_geometric_approach__ed195cdf.pdf,Short and Sparse Deconvolution --- A Geometric Approach,"Yenson Lau, Qing Qu, Han-Wen Kuo, Pengcheng Zhou, Yuqian Zhang, John Wright",Accept (Poster),https://openreview.net/pdf?id=Byg5ZANtvH
ICLR,2020,abductive_commonsense_reasoning__a2908f31.pdf,Abductive Commonsense Reasoning,"Chandra Bhagavatula, Ronan Le Bras, Chaitanya Malaviya, Keisuke Sakaguchi, Ari Holtzman, Hannah Rashkin, Doug Downey, Wen-tau Yih, Yejin Choi",Accept (Poster),https://openreview.net/pdf?id=Byg1v1HKDB
