Conference,Year,Filename,Title,Authors,Category,PDF_URL
IJCAI,2022,longshort_term_crosstransformer_in_compressed_domain_for_fewshot_video_classification__657dc277.pdf,Long-Short Term Cross-Transformer in Compressed Domain for Few-Shot Video Classification,"Wenyang Luo, Yufan Liu, Bing Li, Weiming Hu, Yanan Miao, Yangxi Li",Computer Vision,https://www.ijcai.org/proceedings/2022/0174.pdf
IJCAI,2022,improved_deep_unsupervised_hashing_with_finegrained_semantic_similarity_mining_for_multilabel_image_retrieval__d40417ce.pdf,Improved Deep Unsupervised Hashing with Fine-grained Semantic Similarity Mining for Multi-Label Image Retrieval,"Zeyu Ma, Xiao Luo, Yingjie Chen, Mixiao Hou, Jinxing Li, Minghua Deng, Guangming Lu",Computer Vision,https://www.ijcai.org/proceedings/2022/0175.pdf
IJCAI,2022,learning_degradation_uncertainty_for_unsupervised_realworld_image_superresolution__7b4e1b16.pdf,Learning Degradation Uncertainty for Unsupervised Real-world Image Super-resolution,"Qian Ning, Jingzhu Tang, Fangfang Wu, Weisheng Dong, Xin Li, Guangming Shi",Computer Vision,https://www.ijcai.org/proceedings/2022/0176.pdf
IJCAI,2022,continual_semantic_segmentation_leveraging_imagelevel_labels_and_rehearsal__8969b083.pdf,Continual Semantic Segmentation Leveraging Image-level Labels and Rehearsal,"Mathieu Pagé Fortin, Brahim Chaib-draa",Computer Vision,https://www.ijcai.org/proceedings/2022/0177.pdf
IJCAI,2022,multilevel_hierarchical_network_with_multiscale_sampling_for_video_question_answering__cfcf4d77.pdf,Multilevel Hierarchical Network with Multiscale Sampling for Video Question Answering,"Min Peng, Chongyang Wang, Yuan Gao, Yu Shi, Xiang-Dong Zhou",Computer Vision,https://www.ijcai.org/proceedings/2022/0178.pdf
IJCAI,2022,sourceadaptive_discriminative_kernels_based_network_for_remote_sensing_pansharpening__d8b8e195.pdf,Source-Adaptive Discriminative Kernels based Network for Remote Sensing Pansharpening,"Siran Peng, Liang-Jian Deng, Jin-Fan Hu, Yuwei Zhuo",Computer Vision,https://www.ijcai.org/proceedings/2022/0179.pdf
IJCAI,2022,simmc_simple_masked_contrastive_learning_of_skeleton_representations_for_unsupervised_person_reidentification__da817fde.pdf,SimMC: Simple Masked Contrastive Learning of Skeleton Representations for Unsupervised Person Re-Identification,"Haocong Rao, Chunyan Miao",Computer Vision,https://www.ijcai.org/proceedings/2022/0180.pdf
IJCAI,2022,chimeramix_image_classification_on_small_datasets_via_masked_feature_mixing__dc9da437.pdf,ChimeraMix: Image Classification on Small Datasets via Masked Feature Mixing,"Christoph Reinders, Frederik Schubert, Bodo Rosenhahn",Computer Vision,https://www.ijcai.org/proceedings/2022/0181.pdf
IJCAI,2022,idpt_interconnected_dual_pyramid_transformer_for_face_superresolution__9de8b9ee.pdf,IDPT: Interconnected Dual Pyramid Transformer for Face Super-Resolution,"Jingang Shi, Yusi Wang, Songlin Dong, Xiaopeng Hong, Zitong Yu, Fei Wang, Changxin Wang, Yihong Gong",Computer Vision,https://www.ijcai.org/proceedings/2022/0182.pdf
IJCAI,2022,a_unified_framework_for_adversarial_attack_and_defense_in_constrained_feature_space__ec6eec7a.pdf,A Unified Framework for Adversarial Attack and Defense in Constrained Feature Space,"Thibault Simonetto, Salijona Dyrmishi, Salah Ghamizi, Maxime Cordy, Yves Le Traon",Computer Vision,https://www.ijcai.org/proceedings/2022/0183.pdf
IJCAI,2022,emotioncontrollable_generalized_talking_face_generation__8bb62530.pdf,Emotion-Controllable Generalized Talking Face Generation,"Sanjana Sinha, Sandika Biswas, Ravindra Yadav, Brojeshwar Bhowmick",Computer Vision,https://www.ijcai.org/proceedings/2022/0184.pdf
IJCAI,2022,harnessing_fourier_isovists_and_geodesic_interaction_for_longterm_crowd_flow_prediction__e0a03c14.pdf,Harnessing Fourier Isovists and Geodesic Interaction for Long-Term Crowd Flow Prediction,"Samuel S. Sohn, Seonghyeon Moon, Honglu Zhou, Mihee Lee, Sejong Yoon, Vladimir Pavlovic, Mubbasir Kapadia",Computer Vision,https://www.ijcai.org/proceedings/2022/0185.pdf
IJCAI,2022,boundaryguided_camouflaged_object_detection__5cb54a11.pdf,Boundary-Guided Camouflaged Object Detection,"Yujia Sun, Shuo Wang, Chenglizhao Chen, Tian-Zhu Xiang",Computer Vision,https://www.ijcai.org/proceedings/2022/0186.pdf
IJCAI,2022,dynamic_domain_generalization__a08ba84b.pdf,Dynamic Domain Generalization,"Zhishu Sun, Zhifeng Shen, Luojun Lin, Yuanlong Yu, Zhifeng Yang, Shicai Yang, Weijie Chen",Computer Vision,https://www.ijcai.org/proceedings/2022/0187.pdf
IJCAI,2022,video_frame_interpolation_based_on_deformable_kernel_region__2ea56722.pdf,Video Frame Interpolation Based on Deformable Kernel Region,"Haoyue Tian, Pan Gao, Xiaojiang Peng",Computer Vision,https://www.ijcai.org/proceedings/2022/0188.pdf
IJCAI,2022,hypertron_explicit_socialtemporal_hypergraph_framework_for_multiagent_forecasting__cca47e47.pdf,Hypertron: Explicit Social-Temporal Hypergraph Framework for Multi-Agent Forecasting,"Yu Tian, Xingliang Huang, Ruigang Niu, Hongfeng Yu, Peijin Wang, Xian Sun",Computer Vision,https://www.ijcai.org/proceedings/2022/0189.pdf
IJCAI,2022,automatic_recognition_of_emotional_subgroups_in_images__064329b9.pdf,Automatic Recognition of Emotional Subgroups in Images,"Emmeke Veltmeijer, Charlotte Gerritsen, Koen Hindriks",Computer Vision,https://www.ijcai.org/proceedings/2022/0190.pdf
IJCAI,2022,augmenting_anchors_by_the_detector_itself__99503375.pdf,Augmenting Anchors by the Detector Itself,"Xiaopei Wan, Guoqiu Li, Yujiu Yang, Zhenhua Guo",Computer Vision,https://www.ijcai.org/proceedings/2022/0191.pdf
IJCAI,2022,absolute_wrong_makes_better_boosting_weakly_supervised_object_detection_via_negative_deterministic_information__65e7acfc.pdf,Absolute Wrong Makes Better: Boosting Weakly Supervised Object Detection via Negative Deterministic Information,"Guanchun Wang, Xiangrong Zhang, Zelin Peng, Xu Tang, Huiyu Zhou, Licheng Jiao",Computer Vision,https://www.ijcai.org/proceedings/2022/0192.pdf
IJCAI,2022,iterative_fewshot_semantic_segmentation_from_image_label_text__2c0c315e.pdf,Iterative Few-shot Semantic Segmentation from Image Label Text,"Haohan Wang, Liang Liu, Wuhao Zhang, Jiangning Zhang, Zhenye Gan, Yabiao Wang, Chengjie Wang, Haoqian Wang",Computer Vision,https://www.ijcai.org/proceedings/2022/0193.pdf
IJCAI,2022,spatialityguided_transformer_for_3d_dense_captioning_on_point_clouds__16f9ff90.pdf,Spatiality-guided Transformer for 3D Dense Captioning on Point Clouds,"Heng Wang, Chaoyi Zhang, Jianhui Yu, Weidong Cai",Computer Vision,https://www.ijcai.org/proceedings/2022/0194.pdf
IJCAI,2022,adaptive_convolutional_dictionary_network_for_ct_metal_artifact_reduction__d929f817.pdf,Adaptive Convolutional Dictionary Network for CT Metal Artifact Reduction,"Hong Wang, Yuexiang Li, Deyu Meng, Yefeng Zheng",Computer Vision,https://www.ijcai.org/proceedings/2022/0195.pdf
IJCAI,2022,kunet_imaging_knowledgeinspired_single_hdr_image_reconstruction__e3e4c174.pdf,KUNet: Imaging Knowledge-Inspired Single HDR Image Reconstruction,"Hu Wang, Mao Ye, Xiatian Zhu, Shuai Li, Ce Zhu, Xue Li",Computer Vision,https://www.ijcai.org/proceedings/2022/0196.pdf
IJCAI,2022,i2cnet_an_intra_and_interclass_context_information_fusion_network_for_blastocyst_segmentation__25956dc3.pdf,I2CNet: An Intra- and Inter-Class Context Information Fusion Network for Blastocyst Segmentation,"Hua Wang, Linwei Qiu, Jingfei Hu, Jicong Zhang",Computer Vision,https://www.ijcai.org/proceedings/2022/0197.pdf
IJCAI,2022,pace_predictive_and_contrastive_embedding_for_unsupervised_action_segmentation__8519e7d2.pdf,PACE: Predictive and Contrastive Embedding for Unsupervised Action Segmentation,"Jiahao Wang, Jie Qin, Yunhong Wang, Annan Li",Computer Vision,https://www.ijcai.org/proceedings/2022/0198.pdf
IJCAI,2022,doublecheck_soft_teacher_for_semisupervised_object_detection__0e89251c.pdf,Double-Check Soft Teacher for Semi-Supervised Object Detection,"Kuo Wang, Yuxiang Nie, Chaowei Fang, Chengzhi Han, Xuewen Wu, Xiaohui Wang Wang, Liang Lin, Fan Zhou, Guanbin Li",Computer Vision,https://www.ijcai.org/proceedings/2022/0199.pdf
IJCAI,2022,repre_improving_selfsupervised_vision_transformer_with_reconstructive_pretraining__dbed0bfb.pdf,RePre: Improving Self-Supervised Vision Transformer with Reconstructive Pre-training,"Luya Wang, Feng Liang, Yangguang Li, Honggang Zhang, Wanli Ouyang, Jing Shao",Computer Vision,https://www.ijcai.org/proceedings/2022/0200.pdf
IJCAI,2022,uncertaintyguided_pixel_contrastive_learning_for_semisupervised_medical_image_segmentation__d0d9f383.pdf,Uncertainty-Guided Pixel Contrastive Learning for Semi-Supervised Medical Image Segmentation,"Tao Wang, Jianglin Lu, Zhihui Lai, Jiajun Wen, Heng Kong",Computer Vision,https://www.ijcai.org/proceedings/2022/0201.pdf
IJCAI,2022,card_semisupervised_semantic_segmentation_via_classagnostic_relation_based_denoising__f4365ebe.pdf,CARD: Semi-supervised Semantic Segmentation via Class-agnostic Relation based Denoising,"Xiaoyang Wang, Jimin Xiao, Bingfeng Zhang, Limin Yu",Computer Vision,https://www.ijcai.org/proceedings/2022/0202.pdf
IJCAI,2022,corner_affinity_a_robust_grouping_algorithm_to_make_cornerguided_detector_great_again__c6d230fc.pdf,Corner Affinity: A Robust Grouping Algorithm  to Make Corner-guided Detector Great Again,"Haoran Wei, Chenglong Liu, Ping Guo, Yangguang Zhu, Jiamei Fu, Bing Wang, Peng Wang",Computer Vision,https://www.ijcai.org/proceedings/2022/0203.pdf
IJCAI,2022,multiscale_spatial_representation_learning_via_recursive_hermite_polynomial_networks__9ec3f95b.pdf,Multi-scale Spatial Representation Learning via Recursive Hermite Polynomial Networks,"Lin (Yuanbo) Wu, Deyin Liu, Xiaojie Guo, Richang Hong, Liangchen Liu, Rui Zhang",Computer Vision,https://www.ijcai.org/proceedings/2022/0204.pdf
IJCAI,2022,a_decoderfree_transformerlike_architecture_for_highefficiency_single_image_deraining__d2eba14c.pdf,A Decoder-free Transformer-like Architecture for High-efficiency Single Image Deraining,"Xiao Wu, Ting-Zhu Huang, Liang-Jian Deng, Tian-Jing Zhang",Computer Vision,https://www.ijcai.org/proceedings/2022/0205.pdf
IJCAI,2022,eliminating_backdoor_triggers_for_deep_neural_networks_using_attention_relation_graph_distillation__f2dd7e4a.pdf,Eliminating Backdoor Triggers for Deep Neural Networks Using  Attention Relation Graph Distillation,"Jun Xia, Ting Wang, Jiepin Ding, Xian Wei, Mingsong Chen",Computer Vision,https://www.ijcai.org/proceedings/2022/0206.pdf
IJCAI,2022,scmt_selfcorrection_mean_teacher_for_semisupervised_object_detection__87b33361.pdf,SCMT: Self-Correction Mean Teacher for Semi-supervised Object Detection,"Feng Xiong, Jiayi Tian, Zhihui Hao, Yulin He, Xiaofeng Ren",Computer Vision,https://www.ijcai.org/proceedings/2022/0207.pdf
IJCAI,2022,boosting_multilabel_image_classification_with_complementary_parallel_selfdistillation__58be52ae.pdf,Boosting Multi-Label Image Classification with Complementary Parallel Self-Distillation,"Jiazhi Xu, Sheng Huang, Fengtao Zhou, Luwen Huangfu, Daniel Zeng, Bo Liu",Computer Vision,https://www.ijcai.org/proceedings/2022/0208.pdf
IJCAI,2022,weblysupervised_finegrained_recognition_with_partial_label_learning__e9ab61d2.pdf,Webly-Supervised Fine-Grained Recognition with Partial Label Learning,"Yu-Yan Xu, Yang Shen, Xiu-Shen Wei, Jian Yang",Computer Vision,https://www.ijcai.org/proceedings/2022/0209.pdf
IJCAI,2022,biconet_regress_globally_match_locally_for_robust_6d_pose_estimation__fc907738.pdf,"BiCo-Net: Regress Globally, Match Locally for Robust 6D Pose Estimation","Zelin Xu, Yichen Zhang, Ke Chen, Kui Jia",Computer Vision,https://www.ijcai.org/proceedings/2022/0210.pdf
IJCAI,2022,towards_adversarially_robust_deep_image_denoising__072189c0.pdf,Towards Adversarially Robust Deep Image Denoising,"Hanshu Yan, Jingfeng Zhang, Jiashi Feng, Masashi Sugiyama, Vincent Y. F. Tan",Computer Vision,https://www.ijcai.org/proceedings/2022/0211.pdf
IJCAI,2022,weakening_the_influence_of_clothing_universal_clothing_attribute_disentanglement_for_person_reidentification__5ca35a43.pdf,Weakening the Influence of Clothing: Universal Clothing Attribute Disentanglement for Person Re-Identification,"Yuming Yan, Huimin Yu, Shuzhao Li, Zhaohui Lu, Jianfeng He, Haozhuo Zhang, Runfa Wang",Computer Vision,https://www.ijcai.org/proceedings/2022/0212.pdf
IJCAI,2022,multilevel_consistency_learning_for_semisupervised_domain_adaptation__1aa886f2.pdf,Multi-level Consistency Learning for Semi-supervised Domain Adaptation,"Zizheng Yan, Yushuang Wu, Guanbin Li, Yipeng Qin, Xiaoguang Han, Shuguang Cui",Computer Vision,https://www.ijcai.org/proceedings/2022/0213.pdf
IJCAI,2022,perceptual_learned_video_compression_with_recurrent_conditional_gan__083328aa.pdf,Perceptual Learned Video Compression with Recurrent Conditional GAN,"Ren Yang, Radu Timofte, Luc Van Gool",Computer Vision,https://www.ijcai.org/proceedings/2022/0214.pdf
IJCAI,2022,crowdformer_an_overlap_patching_vision_transformer_for_topdown_crowd_counting__835ca7b9.pdf,CrowdFormer: An Overlap Patching Vision Transformer for Top-Down Crowd Counting,"Shaopeng Yang, Weiyu Guo, Yuheng Ren",Computer Vision,https://www.ijcai.org/proceedings/2022/0215.pdf
IJCAI,2022,entityaware_and_motionaware_transformers_for_languagedriven_action_localization__6e472819.pdf,Entity-aware and Motion-aware Transformers for Language-driven Action Localization,"Shuo Yang, Xinxiao Wu",Computer Vision,https://www.ijcai.org/proceedings/2022/0216.pdf
IJCAI,2022,learning_prototype_via_placeholder_for_zeroshot_recognition__2f4f5594.pdf,Learning Prototype via Placeholder for Zero-shot Recognition,"Zaiquan Yang, Yang Liu, Wenjia Xu, Chong Huang, Lei Zhou, Chao Tong",Computer Vision,https://www.ijcai.org/proceedings/2022/0217.pdf
IJCAI,2022,learning_implicit_body_representations_from_double_diffusion_based_neural_radiance_fields__23724982.pdf,Learning Implicit Body Representations from Double Diffusion Based Neural Radiance Fields,"Guangming Yao, Hongzhi Wu, Yi Yuan, Lincheng Li, Kun Zhou, Xin Yu",Computer Vision,https://www.ijcai.org/proceedings/2022/0218.pdf
IJCAI,2022,rapq_rescuing_accuracy_for_poweroftwo_lowbit_posttraining_quantization__ea981e28.pdf,RAPQ: Rescuing Accuracy for Power-of-Two Low-bit  Post-training Quantization,"Hongyi Yao, Pu Li, Jian Cao, Xiangcheng Liu, Chenying Xie, Bingzhang Wang",Computer Vision,https://www.ijcai.org/proceedings/2022/0219.pdf
IJCAI,2022,learning_sparse_interpretable_features_for_nas_scoring_from_liver_biopsy_images__35cb4a92.pdf,Learning Sparse Interpretable Features For NAS Scoring From Liver Biopsy Images,"Chong Yin, Siqi Liu, Vincent Wai-Sun Wong, Pong C Yuen",Computer Vision,https://www.ijcai.org/proceedings/2022/0220.pdf
IJCAI,2022,learning_to_hash_naturally_sorts__29d47d69.pdf,Learning to Hash Naturally Sorts,"Jiaguo Yu, Yuming Shen, Menghan Wang, Haofeng Zhang, Philip H.S. Torr",Computer Vision,https://www.ijcai.org/proceedings/2022/0221.pdf
IJCAI,2022,multiproxy_learning_from_an_entropy_optimization_perspective__ae1aa01c.pdf,Multi-Proxy Learning from an Entropy Optimization Perspective,"Yunlong Yu, Dingyi Zhang, Yingming Li, Zhongfei Zhang",Computer Vision,https://www.ijcai.org/proceedings/2022/0222.pdf
IJCAI,2022,to_fold_or_not_to_fold_a_necessary_and_sufficient_condition_on_batchnormalization_layers_folding__b129c779.pdf,To Fold or Not to Fold: a Necessary and Sufficient Condition on Batch-Normalization Layers Folding,"Edouard Yvinec, Arnaud Dapogny, Kevin Bailly",Computer Vision,https://www.ijcai.org/proceedings/2022/0223.pdf
IJCAI,2022,s2_transformer_for_image_captioning__29436878.pdf,S2 Transformer for Image Captioning,"Pengpeng Zeng, Haonan Zhang, Jingkuan Song, Lianli Gao",Computer Vision,https://www.ijcai.org/proceedings/2022/0224.pdf
IJCAI,2022,towards_universal_backwardcompatible_representation_learning__6c17d74c.pdf,Towards Universal Backward-Compatible Representation Learning,"Binjie Zhang, Yixiao Ge, Yantao Shen, Shupeng Su, Fanzi Wu, Chun Yuan, Xuyuan Xu, Yexin Wang, Ying Shan",Computer Vision,https://www.ijcai.org/proceedings/2022/0225.pdf
IJCAI,2022,regionlevel_contrastive_and_consistency_learning_for_semisupervised_semantic_segmentation__0b98966a.pdf,Region-level Contrastive and Consistency Learning for Semi-Supervised Semantic Segmentation,"Jianrong Zhang, Tianyi Wu, Chuanghao Ding, Hongwei Zhao, Guodong Guo",Computer Vision,https://www.ijcai.org/proceedings/2022/0226.pdf
IJCAI,2022,improving_transferability_of_adversarial_examples_with_virtual_step_and_auxiliary_gradients__fe0af865.pdf,Improving Transferability of Adversarial Examples with Virtual Step and Auxiliary Gradients,"Ming Zhang, Xiaohui Kuang, Hu Li, Zhendong Wu, Yuanping Nie, Gang Zhao",Computer Vision,https://www.ijcai.org/proceedings/2022/0227.pdf
IJCAI,2022,plane_geometry_diagram_parsing__0923e5f2.pdf,Plane Geometry Diagram Parsing,"Ming-Liang Zhang, Fei Yin, Yi-Han Hao, Cheng-Lin Liu",Computer Vision,https://www.ijcai.org/proceedings/2022/0228.pdf
IJCAI,2022,sartooptical_image_translation_via_neural_partial_differential_equations__c6e4f2af.pdf,SAR-to-Optical Image Translation via Neural Partial Differential Equations,"Mingjin Zhang, Chengyu He, Jing Zhang, Yuxiang Yang, Xiaoqi Peng, Jie Guo",Computer Vision,https://www.ijcai.org/proceedings/2022/0229.pdf
IJCAI,2022,a_probabilistic_code_balance_constraint_with_compactness_and_informativeness_enhancement_for_deep_supervised_hashing__469d13aa.pdf,A Probabilistic Code Balance Constraint with Compactness and Informativeness Enhancement for Deep Supervised Hashing,"Qi Zhang, Liang Hu, Longbing Cao, Chongyang Shi, Shoujin Wang, Dora D. Liu",Computer Vision,https://www.ijcai.org/proceedings/2022/0230.pdf
IJCAI,2022,catrans_context_and_affinity_transformer_for_fewshot_segmentation__33f1e617.pdf,CATrans: Context and Affinity Transformer for Few-Shot Segmentation,"Shan Zhang, Tianyi Wu, Sitong Wu, Guodong Guo",Computer Vision,https://www.ijcai.org/proceedings/2022/0231.pdf
IJCAI,2022,fewshot_adaptation_of_pretrained_networks_for_domain_shift__9892c674.pdf,Few-Shot Adaptation of Pre-Trained Networks for Domain Shift,"Wenyu Zhang, Li Shen, Wanyue Zhang, Chuan-Sheng Foo",Computer Vision,https://www.ijcai.org/proceedings/2022/0232.pdf
IJCAI,2022,enhancing_the_transferability_of_adversarial_examples_with_random_patch__0e3458f9.pdf,Enhancing the Transferability of Adversarial Examples with Random Patch,"Yaoyuan Zhang, Yu-an Tan, Tian Chen, Xinrui Liu, Quanxin Zhang, Yuanzhang Li",Computer Vision,https://www.ijcai.org/proceedings/2022/0233.pdf
IJCAI,2022,visual_emotion_representation_learning_via_emotionaware_pretraining__1784b56b.pdf,Visual Emotion Representation Learning via Emotion-Aware Pre-training,"Yue Zhang, Wanying Ding, Ran Xu, Xiaohua Hu",Computer Vision,https://www.ijcai.org/proceedings/2022/0234.pdf
IJCAI,2022,distilling_interclass_distance_for_semantic_segmentation__b22981fe.pdf,Distilling Inter-Class Distance for Semantic Segmentation,"Zhengbo Zhang, Chunluan Zhou, Zhigang Tu",Computer Vision,https://www.ijcai.org/proceedings/2022/0235.pdf
IJCAI,2022,domain_adversarial_learning_for_color_constancy__d23de120.pdf,Domain Adversarial Learning for Color Constancy,"Zhifeng Zhang, Xuejing Kang, Anlong Ming",Computer Vision,https://www.ijcai.org/proceedings/2022/0236.pdf
IJCAI,2022,domain_adaptation_via_maximizing_surrogate_mutual_information__788e0977.pdf,Domain Adaptation via Maximizing Surrogate Mutual Information,"Haiteng Zhao, Chang Ma, Qinyu Chen, Zhi-Hong Deng",Computer Vision,https://www.ijcai.org/proceedings/2022/0237.pdf
IJCAI,2022,c3stisr_scene_text_image_superresolution_with_triple_clues__caa9c3b5.pdf,C3-STISR: Scene Text Image Super-resolution with Triple Clues,"Minyi Zhao, Miao Wang, Fan Bai, Bingjia Li, Jie Wang, Shuigeng Zhou",Computer Vision,https://www.ijcai.org/proceedings/2022/0238.pdf
IJCAI,2022,learning_to_generate_image_sourceagnostic_universal_adversarial_perturbations__7e9b6386.pdf,Learning to Generate Image Source-Agnostic Universal Adversarial Perturbations,"Pu Zhao, Parikshit Ram, Songtao Lu, Yuguang Yao, Djallel Bouneffouf, Xue Lin, Sijia Liu",Computer Vision,https://www.ijcai.org/proceedings/2022/0239.pdf
IJCAI,2022,testtime_fourier_style_calibration_for_domain_generalization__85f9df8b.pdf,Test-time Fourier Style Calibration for Domain Generalization,"Xingchen Zhao, Chang Liu, Anthony Sicilia, Seong Jae Hwang, Yun Fu",Computer Vision,https://www.ijcai.org/proceedings/2022/0240.pdf
IJCAI,2022,visual_similarity_attention__56a86d81.pdf,Visual Similarity Attention,"Meng Zheng, Srikrishna Karanam, Terrence Chen, Richard J. Radke, Ziyan Wu",Computer Vision,https://www.ijcai.org/proceedings/2022/0241.pdf
IJCAI,2022,imperceptible_backdoor_attack_from_input_space_to_feature_representation__43c731ed.pdf,Imperceptible Backdoor Attack: From Input Space to Feature Representation,"Nan Zhong, Zhenxing Qian, Xinpeng Zhang",Computer Vision,https://www.ijcai.org/proceedings/2022/0242.pdf
IJCAI,2022,rainy_wcity_a_real_rainfall_dataset_with_diverse_conditions_for_semantic_driving_scene_understanding__beaf3fd6.pdf,Rainy WCity: A Real Rainfall Dataset with Diverse Conditions for Semantic Driving Scene Understanding,"Xian Zhong, Shidong Tu, Xianzheng Ma, Kui Jiang, Wenxin Huang, Zheng Wang",Computer Vision,https://www.ijcai.org/proceedings/2022/0243.pdf
IJCAI,2022,hifihead_oneshot_high_fidelity_neural_head_synthesis_with_3d_control__146ee5ad.pdf,HifiHead: One-Shot High Fidelity Neural Head Synthesis with 3D Control,"Feida Zhu, Junwei Zhu, Wenqing Chu, Ying Tai, Zhifeng Xie, Xiaoming Huang, Chengjie Wang",Computer Vision,https://www.ijcai.org/proceedings/2022/0244.pdf
IJCAI,2022,hierarchical_bilevel_learning_with_architecture_and_loss_search_for_hadamardbased_image_restoration__7721b321.pdf,Hierarchical Bilevel Learning with Architecture and Loss Search for Hadamard-based Image Restoration,"Guijing Zhu, Long Ma, Xin Fan, Risheng Liu",Computer Vision,https://www.ijcai.org/proceedings/2022/0245.pdf
IJCAI,2022,a_solver__gradient_descent_training_algorithm_for_deep_neural_networks__91499aa8.pdf,A Solver + Gradient Descent Training Algorithm for Deep Neural Networks,"Dhananjay Ashok, Vineel Nagisetty, Christopher Srinivasa, Vijay Ganesh",Constraint Satisfaction and Optimization,https://www.ijcai.org/proceedings/2022/0246.pdf
IJCAI,2022,finegrained_complexity_of_partial_minimum_satisfiability__814376ab.pdf,Fine-grained Complexity of Partial Minimum Satisfiability,"Ivan Bliznets, Danil Sagunov, Kirill Simonov",Constraint Satisfaction and Optimization,https://www.ijcai.org/proceedings/2022/0247.pdf
IJCAI,2022,qcdcl_with_cube_learning_or_pure_literal_elimination__what_is_best__53b0537e.pdf,QCDCL with Cube Learning or Pure Literal Elimination - What is Best?,"Benjamin Böhm, Tomáš Peitl, Olaf Beyersdorff",Constraint Satisfaction and Optimization,https://www.ijcai.org/proceedings/2022/0248.pdf
IJCAI,2022,combining_constraint_solving_and_bayesian_techniques_for_system_optimization__3a1a56c5.pdf,Combining Constraint Solving and Bayesian Techniques for System Optimization,"Franz Brauße, Zurab Khasidashvili, Konstantin Korovin",Constraint Satisfaction and Optimization,https://www.ijcai.org/proceedings/2022/0249.pdf
IJCAI,2022,dpsampler_exact_weighted_sampling_using_dynamic_programming__d29f77c7.pdf,DPSampler: Exact Weighted Sampling Using Dynamic Programming,"Jeffrey M. Dudek, Aditya A. Shrotri, Moshe Y. Vardi",Constraint Satisfaction and Optimization,https://www.ijcai.org/proceedings/2022/0250.pdf
IJCAI,2022,a_multivariate_complexity_analysis_of_qualitative_reasoning_problems__3a34d039.pdf,A Multivariate Complexity Analysis of Qualitative Reasoning Problems,"Leif Eriksson, Victor Lagerkvist",Constraint Satisfaction and Optimization,https://www.ijcai.org/proceedings/2022/0251.pdf
IJCAI,2022,accelerated_multiplicative_weights_update_avoids_saddle_points_almost_always__5e431b8f.pdf,Accelerated Multiplicative Weights Update Avoids Saddle Points Almost Always,"Yi Feng, Ioannis Panageas, Xiao Wang",Constraint Satisfaction and Optimization,https://www.ijcai.org/proceedings/2022/0252.pdf
IJCAI,2022,large_neighbourhood_search_for_anytime_maxsat_solving__65a17d1f.pdf,Large Neighbourhood Search for Anytime MaxSAT Solving,"Randy Hickey, Fahiem Bacchus",Constraint Satisfaction and Optimization,https://www.ijcai.org/proceedings/2022/0253.pdf
IJCAI,2022,online_matching_with_controllable_rewards_and_arrival_probabilities__d76063e5.pdf,Online Matching with Controllable Rewards and Arrival Probabilities,"Yuya Hikima, Yasunori Akagi, Naoki Marumo, Hideaki Kim",Constraint Satisfaction and Optimization,https://www.ijcai.org/proceedings/2022/0254.pdf
IJCAI,2022,encoding_probabilistic_graphical_models_into_stochastic_boolean_satisfiability__71bf1e36.pdf,Encoding Probabilistic Graphical Models into Stochastic Boolean Satisfiability,"Cheng-Han Hsieh, Jie-Hong R. Jiang",Constraint Satisfaction and Optimization,https://www.ijcai.org/proceedings/2022/0255.pdf
IJCAI,2022,degradation_accordant_plugandplay_for_lowrank_tensor_completion__6a3abce9.pdf,Degradation Accordant Plug-and-Play for Low-Rank Tensor Completion,"Yexun Hu, Tai-Xiang Jiang, Xi-Le Zhao",Constraint Satisfaction and Optimization,https://www.ijcai.org/proceedings/2022/0256.pdf
IJCAI,2022,using_constraint_programming_and_graph_representation_learning_for_generating_interpretable_cloud_security_policies__15bf7fdb.pdf,Using Constraint Programming and Graph Representation Learning for Generating Interpretable Cloud Security Policies,"Mikhail Kazdagli, Mohit Tiwari, Akshat Kumar",Constraint Satisfaction and Optimization,https://www.ijcai.org/proceedings/2022/0257.pdf
IJCAI,2022,best_heuristic_identification_for_constraint_satisfaction__737a1847.pdf,Best Heuristic Identification for Constraint Satisfaction,"Frederic Koriche, Christophe Lecoutre, Anastasia Paparrizou, Hugues Wattez",Constraint Satisfaction and Optimization,https://www.ijcai.org/proceedings/2022/0258.pdf
