Conference,Year,Filename,Title,Authors,Category,PDF_URL
IJCAI,2023,dualview_correlation_hybrid_attention_network_for_robust_holistic_mammogram_classification__e8ff7f84.pdf,Dual-view Correlation Hybrid Attention Network for Robust Holistic Mammogram Classification,"Zhiwei Wang, Junlin Xian, Kangyi Liu, Xin Li, Qiang Li, Xin Yang",Computer Vision,https://www.ijcai.org/proceedings/2023/0168.pdf
IJCAI,2023,accurate_mri_reconstruction_via_multidomain_recurrent_networks__04e15d3c.pdf,Accurate MRI Reconstruction via Multi-Domain Recurrent Networks,"Jinbao Wei, Zhijie Wang, Kongqiao Wang, Li Guo, Xueyang Fu, Ji Liu, Xun Chen",Computer Vision,https://www.ijcai.org/proceedings/2023/0169.pdf
IJCAI,2023,from_generation_to_suppression_towards_effective_irregular_glow_removal_for_nighttime_visibility_enhancement__1fd1a393.pdf,From Generation to Suppression: Towards Effective Irregular Glow Removal for Nighttime Visibility Enhancement,"Wanyu Wu, Wei Wang, Zheng Wang, Kui Jiang, Xin Xu",Computer Vision,https://www.ijcai.org/proceedings/2023/0170.pdf
IJCAI,2023,hierarchical_semantic_contrast_for_weakly_supervised_semantic_segmentation__41503f44.pdf,Hierarchical Semantic Contrast for Weakly Supervised Semantic Segmentation,"Yuanchen Wu, Xiaoqiang Li, Songmin Dai, Jide Li, Tong Liu, Shaorong Xie",Computer Vision,https://www.ijcai.org/proceedings/2023/0171.pdf
IJCAI,2023,learning_monocular_depth_in_dynamic_environment_via_contextaware_temporal_attention__e5b56910.pdf,Learning Monocular Depth in Dynamic Environment via Context-aware Temporal Attention,"Zizhang Wu, Zhuozheng Li, Zhi-Gang Fan, Yunzhe Wu, Yuanzhu Gan, Jian Pu",Computer Vision,https://www.ijcai.org/proceedings/2023/0172.pdf
IJCAI,2023,hyperspectral_image_denoising_using_uncertaintyaware_adjustor__18a4adc7.pdf,Hyperspectral Image Denoising Using Uncertainty-Aware Adjustor,"Jiahua Xiao, Xing Wei",Computer Vision,https://www.ijcai.org/proceedings/2023/0173.pdf
IJCAI,2023,vitcx_causal_explanation_of_vision_transformers__24b161ab.pdf,ViT-CX: Causal Explanation of Vision Transformers,"Weiyan Xie, Xiao-Hui Li, Caleb Chen Cao, Nevin L. Zhang",Computer Vision,https://www.ijcai.org/proceedings/2023/0174.pdf
IJCAI,2023,3d_surface_superresolution_from_enhanced_2d_normal_images_a_multimodaldriven_variational_autoencoder_approach__fbe03442.pdf,3D Surface Super-resolution from Enhanced 2D Normal Images: A Multimodal-driven Variational AutoEncoder Approach,"Wuyuan Xie, Tengcong Huang, Miaohui Wang",Computer Vision,https://www.ijcai.org/proceedings/2023/0175.pdf
IJCAI,2023,diagnose_like_a_pathologist_transformerenabled_hierarchical_attentionguided_multiple_instance_learning_for_whole_slide_image_classification__d9d86933.pdf,Diagnose Like a Pathologist: Transformer-Enabled Hierarchical Attention-Guided Multiple Instance Learning for Whole Slide Image Classification,"Conghao Xiong, Hao Chen, Joseph J.Y. Sung, Irwin King",Computer Vision,https://www.ijcai.org/proceedings/2023/0176.pdf
IJCAI,2023,universal_adaptive_data_augmentation__857cb33e.pdf,Universal Adaptive Data Augmentation,"Xiaogang Xu, Hengshuang Zhao",Computer Vision,https://www.ijcai.org/proceedings/2023/0177.pdf
IJCAI,2023,video_object_segmentation_in_panoptic_wild_scenes__9db36c7c.pdf,Video Object Segmentation in Panoptic Wild Scenes,"Yuanyou Xu, Zongxin Yang, Yi Yang",Computer Vision,https://www.ijcai.org/proceedings/2023/0178.pdf
IJCAI,2023,rulematch_matching_abstract_rules_for_semisupervised_learning_of_human_standard_intelligence_tests__7857098a.pdf,RuleMatch: Matching Abstract Rules for Semi-supervised Learning of Human Standard Intelligence Tests,"Yunlong Xu, Lingxiao Yang, Hongzhi You, Zonglei Zhen, Da-Hui Wang, Xiaohong Wan, Xiaohua Xie, Ru-Yuan Zhang",Computer Vision,https://www.ijcai.org/proceedings/2023/0179.pdf
IJCAI,2023,prompt_learns_prompt_exploring_knowledgeaware_generative_prompt_collaboration_for_video_captioning__96be0f4a.pdf,Prompt Learns Prompt: Exploring Knowledge-Aware Generative Prompt Collaboration For Video Captioning,"Liqi Yan, Cheng Han, Zenglin Xu, Dongfang Liu, Qifan Wang",Computer Vision,https://www.ijcai.org/proceedings/2023/0180.pdf
IJCAI,2023,fewshot_classification_via_ensemble_learning_with_multiorder_statistics__6004c666.pdf,Few-shot Classification via Ensemble Learning with Multi-Order Statistics,"Sai Yang, Fan Liu, Delong Chen, Jun Zhou",Computer Vision,https://www.ijcai.org/proceedings/2023/0181.pdf
IJCAI,2023,video_diffusion_models_with_localglobal_context_guidance__a6450fd3.pdf,Video Diffusion Models with Local-Global Context Guidance,"Siyuan Yang, Lu Zhang, Yu Liu, Zhizhuo Jiang, You He",Computer Vision,https://www.ijcai.org/proceedings/2023/0182.pdf
IJCAI,2023,exploring_safety_supervision_for_continual_testtime_domain_adaptation__90b9adb4.pdf,Exploring Safety Supervision for Continual Test-time Domain Adaptation,"Xu Yang, Yanan Gu, Kun Wei, Cheng Deng",Computer Vision,https://www.ijcai.org/proceedings/2023/0183.pdf
IJCAI,2023,action_recognition_with_multistream_motion_modeling_and_mutual_information_maximization__bd698b94.pdf,Action Recognition with Multi-stream Motion Modeling and Mutual Information Maximization,"Yuheng Yang, Haipeng Chen, Zhenguang Liu, Yingda Lyu, Beibei Zhang, Shuang Wu, Zhibo Wang, Kui Ren",Computer Vision,https://www.ijcai.org/proceedings/2023/0184.pdf
IJCAI,2023,orientationindependent_chinese_text_recognition_in_scene_images__2b3e033b.pdf,Orientation-Independent Chinese Text Recognition in Scene Images,"Haiyang Yu, Xiaocong Wang, Bin Li, Xiangyang Xue",Computer Vision,https://www.ijcai.org/proceedings/2023/0185.pdf
IJCAI,2023,actormultiscale_context_bidirectional_higher_order_interactive_relation_network_for_spatialtemporal_action_localization__1f1d8ede.pdf,Actor-Multi-Scale Context Bidirectional Higher Order Interactive Relation Network for Spatial-Temporal Action Localization,"Jun Yu, Yingshuai Zheng, Shulan Ruan, Qi Liu, Zhiyuan Cheng, Jinze Wu",Computer Vision,https://www.ijcai.org/proceedings/2023/0186.pdf
IJCAI,2023,blackbox_prompt_tuning_for_visionlanguage_model_as_a_service__a7ca6736.pdf,Black-box Prompt Tuning for Vision-Language Model as a Service,"Lang Yu, Qin Chen, Jiaju Lin, Liang He",Computer Vision,https://www.ijcai.org/proceedings/2023/0187.pdf
IJCAI,2023,densedino_boosting_dense_selfsupervised_learning_with_tokenbased_pointlevel_consistency__7ecbd8f0.pdf,DenseDINO: Boosting Dense Self-Supervised Learning with Token-Based Point-Level Consistency,"Yike Yuan, Xinghe Fu, Yunlong Yu, Xi Li",Computer Vision,https://www.ijcai.org/proceedings/2023/0188.pdf
IJCAI,2023,linguistic_more_taking_a_further_step_toward_efficient_and_accurate_scene_text_recognition__051a80be.pdf,Linguistic More: Taking a Further Step toward Efficient and Accurate Scene Text Recognition,"Boqiang Zhang, Hongtao Xie, Yuxin Wang, Jianjun Xu, Yongdong Zhang",Computer Vision,https://www.ijcai.org/proceedings/2023/0189.pdf
IJCAI,2023,spatially_covariant_lesion_segmentation__40fa46a1.pdf,Spatially Covariant Lesion Segmentation,"Hang Zhang, Rongguang Wang, Jinwei Zhang, Dongdong Liu, Chao Li, Jiahao Li",Computer Vision,https://www.ijcai.org/proceedings/2023/0190.pdf
IJCAI,2023,hoiaware_adaptive_network_for_weaklysupervised_action_segmentation__6cff2d19.pdf,HOI-aware Adaptive Network for Weakly-supervised Action Segmentation,"Runzhong Zhang, Suchen Wang, Yueqi Duan, Yansong Tang, Yue Zhang, Yap-Peng Tan",Computer Vision,https://www.ijcai.org/proceedings/2023/0191.pdf
IJCAI,2023,learning_object_consistency_and_interaction_in_image_generation_from_scene_graphs__b99cb279.pdf,Learning Object Consistency and Interaction in Image Generation from Scene Graphs,"Yangkang Zhang, Chenye Meng, Zejian Li, Pei Chen, Guang Yang, Changyuan Yang, Lingyun Sun",Computer Vision,https://www.ijcai.org/proceedings/2023/0192.pdf
IJCAI,2023,manifoldaware_selftraining_for_unsupervised_domain_adaptation_on_regressing_6d_object_pose__08090f58.pdf,Manifold-Aware Self-Training for Unsupervised Domain Adaptation on Regressing 6D Object Pose,"Yichen Zhang, Jiehong Lin, Ke Chen, Zelin Xu, Yaowei Wang, Kui Jia",Computer Vision,https://www.ijcai.org/proceedings/2023/0193.pdf
IJCAI,2023,fgnet_towards_filling_the_intraclass_and_interclass_gaps_for_fewshot_segmentation__0429e09b.pdf,FGNet: Towards Filling the Intra-class and Inter-class Gaps for Few-shot Segmentation,"Yuxuan Zhang, Wei Yang, Shaowei Wang",Computer Vision,https://www.ijcai.org/proceedings/2023/0194.pdf
IJCAI,2023,mmpcqa_multimodal_learning_for_noreference_point_cloud_quality_assessment__4ac83152.pdf,MM-PCQA: Multi-Modal Learning for No-reference Point Cloud Quality Assessment,"Zicheng Zhang, Wei Sun, Xiongkuo Min, Qiyuan Wang, Jun He, Quan Zhou, Guangtao Zhai",Computer Vision,https://www.ijcai.org/proceedings/2023/0195.pdf
IJCAI,2023,stsgan_can_we_synthesize_solid_texture_with_high_fidelity_from_arbitrary_2d_exemplar__bbfbca73.pdf,STS-GAN: Can We Synthesize Solid Texture with High Fidelity from Arbitrary 2D Exemplar?,"Xin Zhao, Jifeng Guo, Lin Wang, Fanqi Li, Jiahao Li, Junteng Zheng, Bo Yang",Computer Vision,https://www.ijcai.org/proceedings/2023/0196.pdf
IJCAI,2023,tps_attentionenhanced_thinplate_spline_for_scene_text_recognition__2e07ae04.pdf,TPS++: Attention-Enhanced Thin-Plate Spline for Scene Text Recognition,"Tianlun Zheng, Zhineng Chen, Jinfeng Bai, Hongtao Xie, Yu-Gang Jiang",Computer Vision,https://www.ijcai.org/proceedings/2023/0197.pdf
IJCAI,2023,video_frame_interpolation_with_densely_queried_bilateral_correlation__77b13d96.pdf,Video Frame Interpolation with Densely Queried Bilateral Correlation,"Chang Zhou, Jie Liu, Jie Tang, Gangshan Wu",Computer Vision,https://www.ijcai.org/proceedings/2023/0198.pdf
IJCAI,2023,pyramid_diffusion_models_for_lowlight_image_enhancement__12ca7705.pdf,Pyramid Diffusion Models for Low-light Image Enhancement,"Dewei Zhou, Zongxin Yang, Yi Yang",Computer Vision,https://www.ijcai.org/proceedings/2023/0199.pdf
IJCAI,2023,cadparser_a_learning_approach_of_sequence_modeling_for_brep_cad__d410b4d1.pdf,CADParser: A Learning Approach of Sequence Modeling for B-Rep CAD,"Shengdi Zhou, Tianyi Tang, Bin Zhou",Computer Vision,https://www.ijcai.org/proceedings/2023/0200.pdf
IJCAI,2023,repaintnerf_nerf_editting_via_semantic_masks_and_diffusion_models__81130102.pdf,RePaint-NeRF: NeRF Editting via Semantic Masks and Diffusion Models,"Xingchen Zhou, Ying He, F. Richard Yu, Jianqiang Li, You Li",Computer Vision,https://www.ijcai.org/proceedings/2023/0201.pdf
IJCAI,2023,dichotomous_image_segmentation_with_frequency_priors__19a04b72.pdf,Dichotomous Image Segmentation with Frequency Priors,"Yan Zhou, Bo Dong, Yuanfeng Wu, Wentao Zhu, Geng Chen, Yanning Zhang",Computer Vision,https://www.ijcai.org/proceedings/2023/0202.pdf
IJCAI,2023,a_solution_to_cooccurence_bias_attributes_disentanglement_via_mutual_information_minimization_for_pedestrian_attribute_recognition__af9fb22b.pdf,A Solution to Co-occurence Bias: Attributes Disentanglement via Mutual Information Minimization for Pedestrian Attribute Recognition,"Yibo Zhou, Hai-Miao Hu, Jinzuo Yu, Zhenbo Xu, Weiqing Lu, Yuran Cao",Computer Vision,https://www.ijcai.org/proceedings/2023/0203.pdf
IJCAI,2023,vision_language_navigation_with_knowledgedriven_environmental_dreamer__514406aa.pdf,Vision Language Navigation with Knowledge-driven Environmental Dreamer,"Fengda Zhu, Vincent CS Lee, Xiaojun Chang, Xiaodan Liang",Computer Vision,https://www.ijcai.org/proceedings/2023/0204.pdf
IJCAI,2023,efficient_multiview_inverse_rendering_using_a_hybrid_differentiable_rendering_method__7cdd63ee.pdf,Efficient Multi-View Inverse Rendering Using a Hybrid Differentiable Rendering Method,"Xiangyang Zhu, Yiling Pan, Bailin Deng, Bin Wang",Computer Vision,https://www.ijcai.org/proceedings/2023/0205.pdf
IJCAI,2023,towards_accurate_video_text_spotting_with_textwise_semantic_reasoning__e40f0e03.pdf,Towards Accurate Video Text Spotting with Text-wise Semantic Reasoning,"Xinyan Zu, Haiyang Yu, Bin Li, Xiangyang Xue",Computer Vision,https://www.ijcai.org/proceedings/2023/0206.pdf
IJCAI,2023,a_regular_matching_constraint_for_string_variables__5bc25b06.pdf,A Regular Matching Constraint for String Variables,"Roberto Amadini, Peter J. Stuckey",Constraint Satisfaction and Optimization,https://www.ijcai.org/proceedings/2023/0207.pdf
IJCAI,2023,learning_constraint_networks_over_unknown_constraint_languages__5b0ff5bb.pdf,Learning Constraint Networks over Unknown Constraint Languages,"Christian Bessiere, Clément Carbonnel, Areski Himeur",Constraint Satisfaction and Optimization,https://www.ijcai.org/proceedings/2023/0208.pdf
IJCAI,2023,faster_exact_mpe_and_constrained_optimization_with_deterministic_finite_state_automata__68e1c81a.pdf,Faster Exact MPE and Constrained Optimization with Deterministic Finite State Automata,Filippo Bistaffa,Constraint Satisfaction and Optimization,https://www.ijcai.org/proceedings/2023/0209.pdf
IJCAI,2023,constraints_first_a_new_mddbased_model_to_generate_sentences_under_constraints__10f23a24.pdf,Constraints First: A New MDD-based Model to Generate Sentences Under Constraints,"Alexandre Bonlarron, Aurélie Calabrèse, Pierre Kornprobst, Jean-Charles Régin",Constraint Satisfaction and Optimization,https://www.ijcai.org/proceedings/2023/0210.pdf
IJCAI,2023,learning_when_to_use_automatic_tabulation_in_constraint_model_reformulation__1fde3e83.pdf,Learning When to Use Automatic Tabulation in Constraint Model Reformulation,"Carlo Cena, Özgür Akgün, Zeynep Kiziltan, Ian Miguel, Peter Nightingale, Felix Ulrich-Oltean",Constraint Satisfaction and Optimization,https://www.ijcai.org/proceedings/2023/0211.pdf
IJCAI,2023,a_fast_algorithm_for_consistency_checking_partially_ordered_time__9e3da29d.pdf,A Fast Algorithm for Consistency Checking Partially Ordered Time,"Leif Eriksson, Victor Lagerkvist",Constraint Satisfaction and Optimization,https://www.ijcai.org/proceedings/2023/0212.pdf
IJCAI,2023,improved_algorithms_for_allens_interval_algebra_by_dynamic_programming_with_sublinear_partitioning__414cd9ae.pdf,Improved Algorithms for Allen's Interval Algebra by Dynamic Programming with Sublinear Partitioning,"Leif Eriksson, Victor Lagerkvist",Constraint Satisfaction and Optimization,https://www.ijcai.org/proceedings/2023/0213.pdf
IJCAI,2023,new_bounds_and_constraint_programming_models_for_the_weighted_vertex_coloring_problem__de92c281.pdf,New Bounds and Constraint Programming Models for the Weighted Vertex Coloring Problem,"Olivier Goudet, Cyril Grelier, David Lesaint",Constraint Satisfaction and Optimization,https://www.ijcai.org/proceedings/2023/0214.pdf
IJCAI,2023,unifying_coreguided_and_implicit_hitting_set_based_optimization__c23176a8.pdf,Unifying Core-Guided and Implicit Hitting Set Based Optimization,"Hannes Ihalainen, Jeremias Berg, Matti Järvisalo",Constraint Satisfaction and Optimization,https://www.ijcai.org/proceedings/2023/0215.pdf
IJCAI,2023,cocertificate_learning_with_sat_modulo_symmetries__9443428e.pdf,Co-Certificate Learning with SAT Modulo Symmetries,"Markus Kirchweger, Tomáš Peitl, Stefan Szeider",Constraint Satisfaction and Optimization,https://www.ijcai.org/proceedings/2023/0216.pdf
IJCAI,2023,differentiable_model_selection_for_ensemble_learning__5766d389.pdf,Differentiable Model Selection for Ensemble Learning,"James Kotary, Vincenzo Di Vito, Ferdinando Fioretto",Constraint Satisfaction and Optimization,https://www.ijcai.org/proceedings/2023/0217.pdf
IJCAI,2023,backpropagation_of_unrolled_solvers_with_folded_optimization__f7739665.pdf,Backpropagation of Unrolled Solvers with Folded Optimization,"James Kotary, My H Dinh, Ferdinando Fioretto",Constraint Satisfaction and Optimization,https://www.ijcai.org/proceedings/2023/0218.pdf
IJCAI,2023,solving_the_identifying_code_set_problem_with_grouped_independent_support__559b44bf.pdf,Solving the Identifying Code Set Problem with Grouped Independent Support,"Anna L.D. Latour, Arunabha Sen, Kuldeep S. Meel",Constraint Satisfaction and Optimization,https://www.ijcai.org/proceedings/2023/0219.pdf
IJCAI,2023,a_new_variable_ordering_for_inprocessing_bounded_variable_elimination_in_sat_solvers__610f80b3.pdf,A New Variable Ordering for In-processing Bounded Variable Elimination in SAT Solvers,"Shuolin Li, Chu-Min Li, Mao Luo, Jordi Coll, Djamal Habet, Felip Manyà",Constraint Satisfaction and Optimization,https://www.ijcai.org/proceedings/2023/0220.pdf
IJCAI,2023,a_bitwise_gac_algorithm_for_alldifferent_constraints__dc62b1ea.pdf,A Bitwise GAC Algorithm for Alldifferent Constraints,"Zhe Li, Yaohua Wang, Zhanshan Li",Constraint Satisfaction and Optimization,https://www.ijcai.org/proceedings/2023/0221.pdf
IJCAI,2023,flaws_of_termination_and_optimality_in_adoptbased_algorithms__ae985a2c.pdf,Flaws of Termination and Optimality in ADOPT-based Algorithms,"Koji Noshiro, Koji Hasebe",Constraint Satisfaction and Optimization,https://www.ijcai.org/proceedings/2023/0222.pdf
IJCAI,2023,fast_algorithms_for_sat_with_bounded_occurrences_of_variables__bbf14ff0.pdf,Fast Algorithms for SAT with Bounded Occurrences of Variables,"Junqiang Peng, Mingyu Xiao",Constraint Satisfaction and Optimization,https://www.ijcai.org/proceedings/2023/0223.pdf
IJCAI,2023,computing_twinwidth_with_sat_and_branch__bound__3d69c7e6.pdf,Computing Twin-width with SAT and Branch & Bound,"André Schidler, Stefan Szeider",Constraint Satisfaction and Optimization,https://www.ijcai.org/proceedings/2023/0224.pdf
IJCAI,2023,optimal_decision_trees_for_interpretable_clustering_with_constraints__b1ca54fa.pdf,Optimal Decision Trees For Interpretable Clustering with Constraints,"Pouya Shati, Eldan Cohen, Sheila McIlraith",Constraint Satisfaction and Optimization,https://www.ijcai.org/proceedings/2023/0225.pdf
IJCAI,2023,engineering_an_efficient_approximate_dnfcounter__8b822cbf.pdf,Engineering an Efficient Approximate DNF-Counter,"Mate Soos, Divesh Aggarwal, Sourav Chakraborty, Kuldeep S. Meel, Maciej Obremski",Constraint Satisfaction and Optimization,https://www.ijcai.org/proceedings/2023/0226.pdf
IJCAI,2023,solving_quantuminspired_perfect_matching_problems_via_tuttetheorembased_hybrid_boolean_constraints__28a4138f.pdf,Solving Quantum-Inspired  Perfect Matching Problems via Tutte-Theorem-Based Hybrid Boolean  Constraints,"Moshe Y. Vardi, Zhiwei Zhang",Constraint Satisfaction and Optimization,https://www.ijcai.org/proceedings/2023/0227.pdf
IJCAI,2023,eliminating_the_computation_of_strongly_connected_components_in_generalized_arc_consistency_algorithm_for_alldifferent_constraint__f4f44fe5.pdf,Eliminating the Computation of Strongly Connected Components in Generalized Arc Consistency Algorithm for AllDifferent Constraint,"Luhan Zhen, Zhanshan Li, Yanzhi Li, Hongbo Li",Constraint Satisfaction and Optimization,https://www.ijcai.org/proceedings/2023/0228.pdf
IJCAI,2023,csgcl_communitystrengthenhanced_graph_contrastive_learning__c825ae10.pdf,CSGCL: Community-Strength-Enhanced Graph Contrastive Learning,"Han Chen, Ziwen Zhao, Yuhua Li, Yixiong Zou, Ruixuan Li, Rui Zhang",Data Mining,https://www.ijcai.org/proceedings/2023/0229.pdf
IJCAI,2023,probabilistic_masked_attention_networks_for_explainable_sequential_recommendation__b9d03a3c.pdf,Probabilistic Masked Attention Networks  for Explainable Sequential Recommendation,"Huiyuan Chen, Kaixiong Zhou, Zhimeng Jiang, Chin-Chia Michael Yeh, Xiaoting Li, Menghai Pan, Yan Zheng, Xia Hu, Hao Yang",Data Mining,https://www.ijcai.org/proceedings/2023/0230.pdf
IJCAI,2023,learning_gaussian_mixture_representations_for_tensor_time_series_forecasting__865abc42.pdf,Learning Gaussian Mixture Representations for Tensor Time Series Forecasting,"Jiewen Deng, Jinliang Deng, Renhe Jiang, Xuan Song",Data Mining,https://www.ijcai.org/proceedings/2023/0231.pdf
IJCAI,2023,adaptive_pathmemory_network_for_temporal_knowledge_graph_reasoning__78709c28.pdf,Adaptive Path-Memory Network for Temporal Knowledge Graph Reasoning,"Hao Dong, Zhiyuan Ning, Pengyang Wang, Ziyue Qiao, Pengfei Wang, Yuanchun Zhou, Yanjie Fu",Data Mining,https://www.ijcai.org/proceedings/2023/0232.pdf
IJCAI,2023,open_anomalous_trajectory_recognition_via_probabilistic_metric_learning__e398b0c7.pdf,Open Anomalous Trajectory Recognition via Probabilistic Metric Learning,"Qiang Gao, Xiaohan Wang, Chaoran Liu, Goce Trajcevski, Li Huang, Fan Zhou",Data Mining,https://www.ijcai.org/proceedings/2023/0233.pdf
IJCAI,2023,beyond_homophily_robust_graph_anomaly_detection_via_neural_sparsification__8bc894b3.pdf,Beyond Homophily: Robust Graph Anomaly Detection via Neural Sparsification,"Zheng Gong, Guifeng Wang, Ying Sun, Qi Liu, Yuting Ning, Hui Xiong, Jingyu Peng",Data Mining,https://www.ijcai.org/proceedings/2023/0234.pdf
IJCAI,2023,targeting_minimal_rare_itemsets_from_transaction_databases__e322aef5.pdf,Targeting Minimal Rare Itemsets from Transaction Databases,"Amel Hidouri, Badran Raddaoui, Said Jabbour",Data Mining,https://www.ijcai.org/proceedings/2023/0235.pdf
IJCAI,2023,enhancing_network_by_reinforcement_learning_and_neural_confined_local_search__ef859a36.pdf,Enhancing Network by Reinforcement Learning and Neural Confined Local Search,"Qifu Hu, Ruyang Li, Qi Deng, Yaqian Zhao, Rengang Li",Data Mining,https://www.ijcai.org/proceedings/2023/0236.pdf
IJCAI,2023,a_symbolic_approach_to_computing_disjunctive_association_rules_from_data__a8e9611d.pdf,A Symbolic Approach to Computing Disjunctive Association Rules from Data,"Said Jabbour, Badran Raddaoui, Lakhdar Sais",Data Mining,https://www.ijcai.org/proceedings/2023/0237.pdf
IJCAI,2023,osdp_optimal_sharded_data_parallel_for_distributed_deep_learning__396c3009.pdf,OSDP: Optimal Sharded Data Parallel for Distributed Deep Learning,"Youhe Jiang, Fangcheng Fu, Xupeng Miao, Xiaonan Nie, Bin Cui",Data Mining,https://www.ijcai.org/proceedings/2023/0238.pdf
IJCAI,2023,hawkes_process_based_on_controlled_differential_equations__769d7ff7.pdf,Hawkes Process Based on Controlled Differential Equations,"Minju Jo, Seungji Kook, Noseong Park",Data Mining,https://www.ijcai.org/proceedings/2023/0239.pdf
IJCAI,2023,computing_1epsilonapproximate_degeneracy_in_sublinear_time__6da80fdd.pdf,Computing (1+epsilon)-Approximate Degeneracy in Sublinear Time,"Valerie King, Alex Thomo, Quinton Yong",Data Mining,https://www.ijcai.org/proceedings/2023/0240.pdf
IJCAI,2023,smartformer_semiautoregressive_transformer_with_efficient_integrated_window_attention_for_long_time_series_forecasting__72c676f3.pdf,SMARTformer: Semi-Autoregressive Transformer with Efficient Integrated Window Attention for Long Time Series Forecasting,"Yiduo Li, Shiyi Qi, Zhe Li, Zhongwen Rao, Lujia Pan, Zenglin Xu",Data Mining,https://www.ijcai.org/proceedings/2023/0241.pdf
IJCAI,2023,do_we_need_an_encoderdecoder_to_model_dynamical_systems_on_networks__e44faa41.pdf,Do We Need an Encoder-Decoder to Model Dynamical Systems on Networks?,"Bing Liu, Wei Luo, Gang Li, Jing Huang, Bo Yang",Data Mining,https://www.ijcai.org/proceedings/2023/0242.pdf
IJCAI,2023,model_conversion_via_differentially_private_datafree_distillation__7d755121.pdf,Model Conversion via Differentially Private Data-Free Distillation,"Bochao Liu, Pengju Wang, Shikun Li, Dan Zeng, Shiming Ge",Data Mining,https://www.ijcai.org/proceedings/2023/0243.pdf
IJCAI,2023,gapformer_graph_transformer_with_graph_pooling_for_node_classification__d8e83e66.pdf,Gapformer: Graph Transformer with Graph Pooling for Node Classification,"Chuang Liu, Yibing Zhan, Xueqi Ma, Liang Ding, Dapeng Tao, Jia Wu, Wenbin Hu",Data Mining,https://www.ijcai.org/proceedings/2023/0244.pdf
IJCAI,2023,federated_probabilistic_preference_distribution_modelling_with_compactness_coclustering_for_privacypreserving_multidomain_recommendation__dd1ab3cd.pdf,Federated Probabilistic Preference Distribution Modelling with Compactness Co-Clustering for Privacy-Preserving Multi-Domain Recommendation,"Weiming Liu, Chaochao Chen, Xinting Liao, Mengling Hu, Jianwei Yin, Yanchao Tan, Longfei Zheng",Data Mining,https://www.ijcai.org/proceedings/2023/0245.pdf
IJCAI,2023,multiscale_subgraph_contrastive_learning__9d918859.pdf,Multi-Scale Subgraph Contrastive Learning,"Yanbei Liu, Yu Zhao, Xiao Wang, Lei Geng, Zhitao Xiao",Data Mining,https://www.ijcai.org/proceedings/2023/0246.pdf
IJCAI,2023,continuoustime_graph_learning_for_cascade_popularity_prediction__c067af03.pdf,Continuous-Time Graph Learning for Cascade Popularity Prediction,"Xiaodong Lu, Shuo Ji, Le Yu, Leilei Sun, Bowen Du, Tongyu Zhu",Data Mining,https://www.ijcai.org/proceedings/2023/0247.pdf
IJCAI,2023,dynamic_group_link_prediction_in_continuoustime_interaction_network__2e76d3cb.pdf,Dynamic Group Link Prediction in Continuous-Time Interaction Network,"Shijie Luo, He Li, Jianbin Huang",Data Mining,https://www.ijcai.org/proceedings/2023/0248.pdf
IJCAI,2023,capturing_the_longdistance_dependency_in_the_control_flow_graph_via_structuralguided_attention_for_bug_localization__bd5653dd.pdf,Capturing the Long-Distance Dependency in the Control Flow Graph via Structural-Guided Attention for Bug Localization,"Yi-Fan Ma, Yali Du, Ming Li",Data Mining,https://www.ijcai.org/proceedings/2023/0249.pdf
IJCAI,2023,uncovering_the_largest_community_in_social_networks_at_scale__96c093ef.pdf,Uncovering the Largest Community in Social Networks at Scale,"Shohei Matsugu, Yasuhiro Fujiwara, Hiroaki Shiokawa",Data Mining,https://www.ijcai.org/proceedings/2023/0250.pdf
IJCAI,2023,reinforcement_learning_approaches_for_traffic_signal_control_under_missing_data__15a197c8.pdf,Reinforcement Learning Approaches for Traffic Signal Control under Missing Data,"Hao Mei, Junxian Li, Bin Shi, Hua Wei",Data Mining,https://www.ijcai.org/proceedings/2023/0251.pdf
IJCAI,2023,discriminativeinvariant_representation_learning_for_unbiased_recommendation__29e6f070.pdf,Discriminative-Invariant Representation Learning for Unbiased Recommendation,"Hang Pan, Jiawei Chen, Fuli Feng, Wentao Shi, Junkang Wu, Xiangnan He",Data Mining,https://www.ijcai.org/proceedings/2023/0252.pdf
