Conference,Year,Filename,Title,Authors,Category,PDF_URL
IJCAI,2023,learning_dissemination_strategies_for_external_sources_in_opinion_dynamic_models_with_cognitive_biases__9fd6f127.pdf,Learning Dissemination Strategies for External Sources in Opinion Dynamic Models with Cognitive Biases,"Abdullah Al Maruf, Luyao Niu, Bhaskar Ramasubramanian, Andrew Clark, Radha Poovendran",Agent-based and Multi-agent Systems,https://www.ijcai.org/proceedings/2023/0001.pdf
IJCAI,2023,artificial_agents_inspired_by_human_motivation_psychology_for_teamwork_in_hazardous_environments__6a574a60.pdf,Artificial Agents Inspired by Human Motivation Psychology for Teamwork in Hazardous Environments,"Anupama Arukgoda, Erandi Lakshika, Michael Barlow, Kasun Gunawardana",Agent-based and Multi-agent Systems,https://www.ijcai.org/proceedings/2023/0002.pdf
IJCAI,2023,proportionally_fair_online_allocation_of_public_goods_with_predictions__2c3c30ad.pdf,Proportionally Fair Online Allocation of Public Goods with Predictions,"Siddhartha Banerjee, Vasilis Gkatzelis, Safwan Hossain, Billy Jin, Evi Micha, Nisarg Shah",Agent-based and Multi-agent Systems,https://www.ijcai.org/proceedings/2023/0003.pdf
IJCAI,2023,on_the_role_of_memory_in_robust_opinion_dynamics__69847d54.pdf,On the Role of Memory in Robust Opinion Dynamics,"Luca Becchetti, Andrea Clementi, Amos Korman, Francesco Pasquale, Luca Trevisan, Robin Vacus",Agent-based and Multi-agent Systems,https://www.ijcai.org/proceedings/2023/0004.pdf
IJCAI,2023,on_a_voter_model_with_contextdependent_opinion_adoption__41cd94ac.pdf,On a Voter Model with Context-Dependent Opinion Adoption,"Luca Becchetti, Vincenzo Bonifaci, Emilio Cruciani, Francesco Pasquale",Agent-based and Multi-agent Systems,https://www.ijcai.org/proceedings/2023/0005.pdf
IJCAI,2023,scalable_verification_of_strategy_logic_through_threevalued_abstraction__da1a7e8c.pdf,Scalable Verification of Strategy Logic through Three-Valued Abstraction,"Francesco Belardinelli, Angelo Ferrando, Wojciech Jamroga, Vadim Malvone, Aniello Murano",Agent-based and Multi-agent Systems,https://www.ijcai.org/proceedings/2023/0006.pdf
IJCAI,2023,explainable_multiagent_reinforcement_learning_for_temporal_queries__9848eb35.pdf,Explainable Multi-Agent Reinforcement Learning for Temporal Queries,"Kayla Boggess, Sarit Kraus, Lu Feng",Agent-based and Multi-agent Systems,https://www.ijcai.org/proceedings/2023/0007.pdf
IJCAI,2023,efficient_and_equitable_deployment_of_mobile_vaccine_distribution_centers__cd18ef09.pdf,Efficient and Equitable Deployment of Mobile Vaccine Distribution Centers,"Da Qi Chen, Ann Li, George Z. Li, Madhav Marathe, Aravind Srinivasan, Leonidas Tsepenekas, Anil Vullikanti",Agent-based and Multi-agent Systems,https://www.ijcai.org/proceedings/2023/0008.pdf
IJCAI,2023,anticipatory_fictitious_play__059501bb.pdf,Anticipatory Fictitious Play,"Alex Cloud, Albert Wang, Wesley Kerr",Agent-based and Multi-agent Systems,https://www.ijcai.org/proceedings/2023/0009.pdf
IJCAI,2023,safe_multiagent_learning_via_trapping_regions__0bb8a91f.pdf,Safe Multi-agent Learning via Trapping Regions,"Aleksander Czechowski, Frans A. Oliehoek",Agent-based and Multi-agent Systems,https://www.ijcai.org/proceedings/2023/0010.pdf
IJCAI,2023,multiagent_intention_recognition_and_progression__13ae3ac3.pdf,Multi-Agent Intention Recognition and Progression,"Michael Dann, Yuan Yao, Natasha Alechina, Brian Logan, Felipe Meneguzzi, John Thangarajah",Agent-based and Multi-agent Systems,https://www.ijcai.org/proceedings/2023/0011.pdf
IJCAI,2023,controlling_neural_style_transfer_with_deep_reinforcement_learning__93d4ee37.pdf,Controlling Neural Style Transfer with Deep Reinforcement Learning,"Chengming Feng, Jing Hu, Xin Wang, Shu Hu, Bin Zhu, Xi Wu, Hongtu Zhu, Siwei Lyu",Agent-based and Multi-agent Systems,https://www.ijcai.org/proceedings/2023/0012.pdf
IJCAI,2023,crosscommunity_adapter_learning_cal_to_understand_the_evolving_meanings_of_norm_violation__59bb5dc5.pdf,Cross-community Adapter Learning (CAL) to Understand the Evolving Meanings of Norm Violation,"Thiago Freitas dos Santos, Stephen Cranefield, Bastin Tony Roy Savarimuthu, Nardine Osman, Marco Schorlemmer",Agent-based and Multi-agent Systems,https://www.ijcai.org/proceedings/2023/0013.pdf
IJCAI,2023,learning_in_multimemory_games_triggers_complex_dynamics_diverging_from_nash_equilibrium__78742209.pdf,Learning in Multi-Memory Games Triggers Complex Dynamics Diverging from Nash Equilibrium,"Yuma Fujimoto, Kaito Ariu, Kenshi Abe",Agent-based and Multi-agent Systems,https://www.ijcai.org/proceedings/2023/0014.pdf
IJCAI,2023,scalable_communication_for_multiagent_reinforcement_learning_via_transformerbased_email_mechanism__47f50914.pdf,Scalable Communication for Multi-Agent Reinforcement Learning via Transformer-Based Email Mechanism,"Xudong Guo, Daming Shi, Wenhui Fan",Agent-based and Multi-agent Systems,https://www.ijcai.org/proceedings/2023/0015.pdf
IJCAI,2023,beyond_strict_competition_approximate_convergence_of_multiagent_qlearning_dynamics__a1ac1043.pdf,Beyond Strict Competition: Approximate Convergence of Multi-agent Q-Learning Dynamics,"Aamal Hussain, Francesco Belardinelli, Georgios Piliouras",Agent-based and Multi-agent Systems,https://www.ijcai.org/proceedings/2023/0016.pdf
IJCAI,2023,principalagent_boolean_games__4c54ab57.pdf,Principal-Agent Boolean Games,"David Hyland, Julian Gutierrez, Michael Wooldridge",Agent-based and Multi-agent Systems,https://www.ijcai.org/proceedings/2023/0017.pdf
IJCAI,2023,learning_to_send_reinforcements_coordinating_multiagent_dynamic_police_patrol_dispatching_and_rescheduling_via_reinforcement_learning__eeecb829.pdf,Learning to Send Reinforcements: Coordinating Multi-Agent Dynamic Police Patrol Dispatching and Rescheduling via Reinforcement Learning,"Waldy Joe, Hoong Chuin Lau",Agent-based and Multi-agent Systems,https://www.ijcai.org/proceedings/2023/0018.pdf
IJCAI,2023,decentralized_anomaly_detection_in_cooperative_multiagent_reinforcement_learning__340675eb.pdf,Decentralized Anomaly Detection in Cooperative Multi-Agent Reinforcement Learning,"Kiarash Kazari, Ezzeldin Shereen, Gyorgy Dan",Agent-based and Multi-agent Systems,https://www.ijcai.org/proceedings/2023/0019.pdf
IJCAI,2023,synthesizing_resilient_strategies_for_infinitehorizon_objectives_in_multiagent_systems__0ed7765f.pdf,Synthesizing Resilient Strategies for Infinite-Horizon Objectives in Multi-Agent Systems,"David Klaška, Antonín Kučera, Martin Kurečka, Vít Musil, Petr Novotný, Vojtěch Řehák",Agent-based and Multi-agent Systems,https://www.ijcai.org/proceedings/2023/0020.pdf
IJCAI,2023,in_which_graph_structures_can_we_efficiently_find_temporally_disjoint_paths_and_walks__b404713e.pdf,In Which Graph Structures Can We Efficiently Find Temporally Disjoint Paths and Walks?,"Pascal Kunz, Hendrik Molter, Meirav Zehavi",Agent-based and Multi-agent Systems,https://www.ijcai.org/proceedings/2023/0021.pdf
IJCAI,2023,probabilistic_planning_with_prioritized_preferences_over_temporal_logic_objectives__651c125e.pdf,Probabilistic Planning with Prioritized Preferences over Temporal Logic Objectives,"Lening Li, Hazhar Rahmani, Jie Fu",Agent-based and Multi-agent Systems,https://www.ijcai.org/proceedings/2023/0022.pdf
IJCAI,2023,gplight_grouped_multiagent_reinforcement_learning_for_largescale_traffic_signal_control__2f6e9a97.pdf,GPLight: Grouped Multi-agent Reinforcement Learning for Large-scale Traffic Signal Control,"Yilin Liu, Guiyang Luo, Quan Yuan, Jinglin Li, Lei Jin, Bo Chen, Rui Pan",Agent-based and Multi-agent Systems,https://www.ijcai.org/proceedings/2023/0023.pdf
IJCAI,2023,deep_hierarchical_communication_graph_in_multiagent_reinforcement_learning__75ada9b4.pdf,Deep Hierarchical Communication Graph in Multi-Agent Reinforcement Learning,"Zeyang Liu, Lipeng Wan, Xue Sui, Zhuoran Chen, Kewu Sun, Xuguang Lan",Agent-based and Multi-agent Systems,https://www.ijcai.org/proceedings/2023/0024.pdf
IJCAI,2023,the_dnnverification_problem_counting_unsafe_inputs_for_deep_neural_networks__2fb4218b.pdf,The #DNN-Verification Problem: Counting Unsafe Inputs for Deep Neural Networks,"Luca Marzari, Davide Corsi, Ferdinando Cicalese, Alessandro Farinelli",Agent-based and Multi-agent Systems,https://www.ijcai.org/proceedings/2023/0025.pdf
IJCAI,2023,discounting_in_strategy_logic__55c4fc77.pdf,Discounting in Strategy Logic,"Munyque Mittelmann, Aniello Murano, Laurent Perrussel",Agent-based and Multi-agent Systems,https://www.ijcai.org/proceedings/2023/0026.pdf
IJCAI,2023,why_rumors_spread_fast_in_social_networks_and_how_to_stop_it__071b50f9.pdf,"Why Rumors Spread Fast in Social Networks, and How to Stop It","Ahad N. Zehmakan, Charlotte Out, Sajjad Hesamipour Khelejan",Agent-based and Multi-agent Systems,https://www.ijcai.org/proceedings/2023/0027.pdf
IJCAI,2023,improving_lacam_for_scalable_eventually_optimal_multiagent_pathfinding__2b3cfbc0.pdf,Improving LaCAM for Scalable Eventually Optimal Multi-Agent Pathfinding,Keisuke Okumura,Agent-based and Multi-agent Systems,https://www.ijcai.org/proceedings/2023/0028.pdf
IJCAI,2023,quick_multirobot_motion_planning_by_combining_sampling_and_search__0e89e340.pdf,Quick Multi-Robot Motion Planning by Combining Sampling and Search,"Keisuke Okumura, Xavier Défago",Agent-based and Multi-agent Systems,https://www.ijcai.org/proceedings/2023/0029.pdf
IJCAI,2023,asynchronous_communication_aware_multiagent_task_allocation__6334716b.pdf,Asynchronous Communication Aware Multi-Agent Task Allocation,"Ben Rachmut, Sofia Amador Nelke, Roie Zivan",Agent-based and Multi-agent Systems,https://www.ijcai.org/proceedings/2023/0030.pdf
IJCAI,2023,towards_a_better_understanding_of_learning_with_multiagent_teams__22f73c3d.pdf,Towards a Better Understanding of Learning with Multiagent Teams,"David Radke, Kate Larson, Tim Brecht, Kyle Tilbury",Agent-based and Multi-agent Systems,https://www.ijcai.org/proceedings/2023/0031.pdf
IJCAI,2023,multiagent_systems_with_quantitative_satisficing_goals__4a65e155.pdf,Multi-Agent Systems with Quantitative Satisficing Goals,"Senthil Rajasekaran, Suguman Bansal, Moshe Y. Vardi",Agent-based and Multi-agent Systems,https://www.ijcai.org/proceedings/2023/0032.pdf
IJCAI,2023,norm_deviation_in_multiagent_systems_a_foundation_for_responsible_autonomy__a07ad6ac.pdf,Norm Deviation in Multiagent Systems: A Foundation for Responsible Autonomy,"Amika M. Singh, Munindar P. Singh",Agent-based and Multi-agent Systems,https://www.ijcai.org/proceedings/2023/0033.pdf
IJCAI,2023,cvtp3d_crossview_trajectory_prediction_using_shared_3d_queries_for_autonomous_driving__3b3ab25c.pdf,CVTP3D: Cross-view Trajectory Prediction Using Shared 3D Queries for Autonomous Driving,"Zijian Song, Huikun Bi, Ruisi Zhang, Tianlu Mao, Zhaoqi Wang",Agent-based and Multi-agent Systems,https://www.ijcai.org/proceedings/2023/0034.pdf
IJCAI,2023,optimal_anytime_coalition_structure_generation_utilizing_compact_solution_space_representation__7950ad2d.pdf,Optimal Anytime Coalition Structure Generation Utilizing Compact Solution Space Representation,"Redha Taguelmimt, Samir Aknine, Djamila Boukredera, Narayan Changder, Tuomas Sandholm",Agent-based and Multi-agent Systems,https://www.ijcai.org/proceedings/2023/0035.pdf
IJCAI,2023,modeling_moral_choices_in_social_dilemmas_with_multiagent_reinforcement_learning__073ce5ef.pdf,Modeling Moral Choices in Social Dilemmas with Multi-Agent Reinforcement Learning,"Elizaveta Tennant, Stephen Hailes, Mirco Musolesi",Agent-based and Multi-agent Systems,https://www.ijcai.org/proceedings/2023/0036.pdf
IJCAI,2023,exploration_via_joint_policy_diversity_for_sparsereward_multiagent_tasks__e9750d19.pdf,Exploration via Joint Policy Diversity for Sparse-Reward Multi-Agent Tasks,"Pei Xu, Junge Zhang, Kaiqi Huang",Agent-based and Multi-agent Systems,https://www.ijcai.org/proceedings/2023/0037.pdf
IJCAI,2023,measuring_acoustics_with_collaborative_multiple_agents__19fc7576.pdf,Measuring Acoustics with Collaborative Multiple Agents,"Yinfeng Yu, Changan Chen, Lele Cao, Fangkai Yang, Fuchun Sun",Agent-based and Multi-agent Systems,https://www.ijcai.org/proceedings/2023/0038.pdf
IJCAI,2023,dynamic_belief_for_decentralized_multiagent_cooperative_learning__fb78c8c6.pdf,Dynamic Belief for Decentralized Multi-Agent Cooperative Learning,"Yunpeng Zhai, Peixi Peng, Chen Su, Yonghong Tian",Agent-based and Multi-agent Systems,https://www.ijcai.org/proceedings/2023/0039.pdf
IJCAI,2023,inducing_stackelberg_equilibrium_through_spatiotemporal_sequential_decisionmaking_in_multiagent_reinforcement_learning__013e98ef.pdf,Inducing Stackelberg Equilibrium through Spatio-Temporal Sequential Decision-Making in Multi-Agent Reinforcement Learning,"Bin Zhang, Lijuan Li, Zhiwei Xu, Dapeng Li, Guoliang Fan",Agent-based and Multi-agent Systems,https://www.ijcai.org/proceedings/2023/0040.pdf
IJCAI,2023,quantifying_harm__d654bf02.pdf,Quantifying Harm,"Sander Beckers, Hana Chockler, Joseph Y. Halpern","AI Ethics, Trust, Fairness",https://www.ijcai.org/proceedings/2023/0041.pdf
IJCAI,2023,analyzing_intentional_behavior_in_autonomous_agents_under_uncertainty__c3585675.pdf,Analyzing Intentional Behavior in Autonomous Agents under Uncertainty,"Filip Cano Córdoba, Samuel Judson, Timos Antonopoulos, Katrine Bjørner, Nicholas Shoemaker, Scott J. Shapiro, Ruzica Piskac, Bettina Könighofer","AI Ethics, Trust, Fairness",https://www.ijcai.org/proceedings/2023/0042.pdf
IJCAI,2023,choose_your_data_wisely_a_framework_for_semantic_counterfactuals__39accd68.pdf,Choose your Data Wisely: A Framework for Semantic Counterfactuals,"Edmund Dervakos, Konstantinos Thomas, Giorgos Filandrianos, Giorgos Stamou","AI Ethics, Trust, Fairness",https://www.ijcai.org/proceedings/2023/0043.pdf
IJCAI,2023,group_fairness_in_set_packing_problems__281a3506.pdf,Group Fairness in Set Packing Problems,"Sharmila Duppala, Juan Luque, John Dickerson, Aravind Srinivasan","AI Ethics, Trust, Fairness",https://www.ijcai.org/proceedings/2023/0044.pdf
IJCAI,2023,incentivizing_recourse_through_auditing_in_strategic_classification__2e8b91c5.pdf,Incentivizing Recourse through Auditing in Strategic Classification,"Andrew Estornell, Yatong Chen, Sanmay Das, Yang Liu, Yevgeniy Vorobeychik","AI Ethics, Trust, Fairness",https://www.ijcai.org/proceedings/2023/0045.pdf
IJCAI,2023,sampling_expost_groupfair_rankings__69f46035.pdf,Sampling Ex-Post Group-Fair Rankings,"Sruthi Gorantla, Amit Deshpande, Anand Louis","AI Ethics, Trust, Fairness",https://www.ijcai.org/proceedings/2023/0046.pdf
IJCAI,2023,moral_planning_agents_with_ltl_values__bfbdbeb5.pdf,Moral Planning Agents with LTL Values,"Umberto Grandi, Emiliano Lorini, Timothy Parker","AI Ethics, Trust, Fairness",https://www.ijcai.org/proceedings/2023/0047.pdf
IJCAI,2023,advancing_posthoc_casebased_explanation_with_feature_highlighting__46fb99c4.pdf,Advancing Post-Hoc Case-Based Explanation with Feature Highlighting,"Eoin M. Kenny, Eoin Delaney, Mark T. Keane","AI Ethics, Trust, Fairness",https://www.ijcai.org/proceedings/2023/0048.pdf
IJCAI,2023,fairness_via_group_contribution_matching__cd74f988.pdf,Fairness via Group Contribution Matching,"Tianlin Li, Zhiming Li, Anran Li, Mengnan Du, Aishan Liu, Qing Guo, Guozhu Meng, Yang Liu","AI Ethics, Trust, Fairness",https://www.ijcai.org/proceedings/2023/0049.pdf
IJCAI,2023,negative_flux_aggregation_to_estimate_feature_attributions__00e2315b.pdf,Negative Flux Aggregation to Estimate Feature Attributions,"Xin Li, Deng Pan, Chengyin Li, Yao Qiang, Dongxiao Zhu","AI Ethics, Trust, Fairness",https://www.ijcai.org/proceedings/2023/0050.pdf
IJCAI,2023,robust_reinforcement_learning_via_progressive_task_sequence__53ec4259.pdf,Robust Reinforcement Learning via Progressive Task Sequence,"Yike Li, Yunzhe Tian, Endong Tong, Wenjia Niu, Jiqiang Liu","AI Ethics, Trust, Fairness",https://www.ijcai.org/proceedings/2023/0051.pdf
IJCAI,2023,towards_robust_gangenerated_image_detection_a_multiview_completion_representation__83089a86.pdf,Towards Robust Gan-Generated Image Detection: A Multi-View Completion Representation,"Chi Liu, Tianqing Zhu, Sheng Shen, Wanlei Zhou","AI Ethics, Trust, Fairness",https://www.ijcai.org/proceedings/2023/0052.pdf
IJCAI,2023,explanationguided_reward_alignment__32fa4bd9.pdf,Explanation-Guided Reward Alignment,"Saaduddin Mahmud, Sandhya Saisubramanian, Shlomo Zilberstein","AI Ethics, Trust, Fairness",https://www.ijcai.org/proceedings/2023/0053.pdf
IJCAI,2023,adversarial_behavior_exclusion_for_safe_reinforcement_learning__1d094c3d.pdf,Adversarial Behavior Exclusion for Safe Reinforcement Learning,"Md Asifur Rahman, Tongtong Liu, Sarra Alqahtani","AI Ethics, Trust, Fairness",https://www.ijcai.org/proceedings/2023/0054.pdf
IJCAI,2023,feamoe_fair_explainable_and_adaptive_mixture_of_experts__bcccbca1.pdf,"FEAMOE: Fair, Explainable and Adaptive Mixture of Experts","Shubham Sharma, Jette Henderson, Joydeep Ghosh","AI Ethics, Trust, Fairness",https://www.ijcai.org/proceedings/2023/0055.pdf
IJCAI,2023,sfpate_scalable_fair_and_private_aggregation_of_teacher_ensembles__8f8cf051.pdf,"SF-PATE: Scalable, Fair, and Private Aggregation of Teacher Ensembles","Cuong Tran, Keyu Zhu, Ferdinando Fioretto, Pascal Van Hentenryck","AI Ethics, Trust, Fairness",https://www.ijcai.org/proceedings/2023/0056.pdf
IJCAI,2023,on_the_fairness_impacts_of_private_ensembles_models__6a817a6c.pdf,On the Fairness Impacts of Private Ensembles Models,"Cuong Tran, Ferdinando Fioretto","AI Ethics, Trust, Fairness",https://www.ijcai.org/proceedings/2023/0057.pdf
IJCAI,2023,statistically_significant_conceptbased_explanation_of_image_classifiers_via_model_knockoffs__373fe771.pdf,Statistically Significant Concept-based Explanation of Image Classifiers via Model Knockoffs,"Kaiwen Xu, Kazuto Fukuchi, Youhei Akimoto, Jun Sakuma","AI Ethics, Trust, Fairness",https://www.ijcai.org/proceedings/2023/0058.pdf
IJCAI,2023,on_adversarial_robustness_of_demographic_fairness_in_face_attribute_recognition__b0922830.pdf,On Adversarial Robustness of Demographic Fairness in Face Attribute Recognition,"Huimin Zeng, Zhenrui Yue, Lanyu Shang, Yang Zhang, Dong Wang","AI Ethics, Trust, Fairness",https://www.ijcai.org/proceedings/2023/0059.pdf
IJCAI,2023,towards_semantics_and_domainaware_adversarial_attacks__d9369729.pdf,Towards Semantics- and Domain-Aware Adversarial Attacks,"Jianping Zhang, Yung-Chieh Huang, Weibin Wu, Michael R. Lyu","AI Ethics, Trust, Fairness",https://www.ijcai.org/proceedings/2023/0060.pdf
IJCAI,2023,tracking_different_ant_species_an_unsupervised_domain_adaptation_framework_and_a_dataset_for_multiobject_tracking__73a36ccb.pdf,Tracking Different Ant Species: An Unsupervised Domain Adaptation Framework and a Dataset for Multi-object Tracking,"Chamath Abeysinghe, Chris Reid, Hamid Rezatofighi, Bernd Meyer",Computer Vision,https://www.ijcai.org/proceedings/2023/0061.pdf
IJCAI,2023,rasa_relation_and_sensitivity_aware_representation_learning_for_textbased_person_search__f87d52e6.pdf,RaSa: Relation and Sensitivity Aware Representation Learning for Text-based Person Search,"Yang Bai, Min Cao, Daming Gao, Ziqiang Cao, Chen Chen, Zhenfeng Fan, Liqiang Nie, Min Zhang",Computer Vision,https://www.ijcai.org/proceedings/2023/0062.pdf
IJCAI,2023,a_novel_learnable_interpolation_approach_for_scalearbitrary_image_superresolution__dbf92fb6.pdf,A Novel Learnable Interpolation Approach for Scale-Arbitrary Image Super-Resolution,"Jiahao Chao, Zhou Zhou, Hongfan Gao, Jiali Gong, Zhenbing Zeng, Zhengfeng Yang",Computer Vision,https://www.ijcai.org/proceedings/2023/0063.pdf
IJCAI,2023,mmpn_multisupervised_mask_protection_network_for_pansharpening__c38fc764.pdf,MMPN: Multi-supervised Mask Protection Network for Pansharpening,"Changjie Chen, Yong Yang, Shuying Huang, Wei Tu, Weiguo Wan, Shengna Wei",Computer Vision,https://www.ijcai.org/proceedings/2023/0064.pdf
IJCAI,2023,hdformer_highorder_directed_transformer_for_3d_human_pose_estimation__e2e5d47c.pdf,HDFormer: High-order Directed Transformer for 3D Human Pose Estimation,"Hanyuan Chen, Jun-Yan He, Wangmeng Xiang, Zhi-Qi Cheng, Wei Liu, Hanbing Liu, Bin Luo, Yifeng Geng, Xuansong Xie",Computer Vision,https://www.ijcai.org/proceedings/2023/0065.pdf
IJCAI,2023,fluid_dynamicsinspired_network_for_infrared_small_target_detection__41ef75a7.pdf,Fluid Dynamics-Inspired Network for Infrared Small Target Detection,"Tianxiang Chen, Qi Chu, Bin Liu, Nenghai Yu",Computer Vision,https://www.ijcai.org/proceedings/2023/0066.pdf
IJCAI,2023,costformercost_transformer_for_cost_aggregation_in_multiview_stereo__217a8a83.pdf,CostFormer:Cost Transformer for Cost Aggregation in Multi-view Stereo,"Weitao Chen, Hongbin Xu, Zhipeng Zhou, Yang Liu, Baigui Sun, Wenxiong Kang, Xuansong Xie",Computer Vision,https://www.ijcai.org/proceedings/2023/0067.pdf
IJCAI,2023,selfsupervised_neuron_segmentation_with_multiagent_reinforcement_learning__6e0c7edf.pdf,Self-Supervised Neuron Segmentation with Multi-Agent Reinforcement Learning,"Yinda Chen, Wei Huang, Shenglong Zhou, Qi Chen, Zhiwei Xiong",Computer Vision,https://www.ijcai.org/proceedings/2023/0068.pdf
IJCAI,2023,nullspace_diffusion_sampling_for_zeroshot_point_cloud_completion__bc9b67db.pdf,Null-Space Diffusion Sampling for Zero-Shot Point Cloud Completion,"Xinhua Cheng, Nan Zhang, Jiwen Yu, Yinhuai Wang, Ge Li, Jian Zhang",Computer Vision,https://www.ijcai.org/proceedings/2023/0069.pdf
IJCAI,2023,robust_image_ordinal_regression_with_controllable_image_generation__5b95ae4a.pdf,Robust Image Ordinal Regression with Controllable Image Generation,"Yi Cheng, Haochao Ying, Renjun Hu, Jinhong Wang, Wenhao Zheng, Xiao Zhang, Danny Chen, Jian Wu",Computer Vision,https://www.ijcai.org/proceedings/2023/0070.pdf
IJCAI,2023,wico_winwin_cooperation_of_bottomup_and_topdown_referring_image_segmentation__a3496e8e.pdf,WiCo: Win-win Cooperation of Bottom-up and Top-down Referring Image Segmentation,"Zesen Cheng, Peng Jin, Hao Li, Kehan Li, Siheng Li, Xiangyang Ji, Chang Liu, Jie Chen",Computer Vision,https://www.ijcai.org/proceedings/2023/0071.pdf
IJCAI,2023,strip_attention_for_image_restoration__e5e07a61.pdf,Strip Attention for Image Restoration,"Yuning Cui, Yi Tao, Luoxi Jing, Alois Knoll",Computer Vision,https://www.ijcai.org/proceedings/2023/0072.pdf
IJCAI,2023,rzcr_zeroshot_character_recognition_via_radicalbased_reasoning__20d93024.pdf,RZCR: Zero-shot Character Recognition via Radical-based Reasoning,"Xiaolei Diao, Daqian Shi, Hao Tang, Qiang Shen, Yanzeng Li, Lei Wu, Hao Xu",Computer Vision,https://www.ijcai.org/proceedings/2023/0073.pdf
IJCAI,2023,decoupling_with_entropybased_equalization_for_semisupervised_semantic_segmentation__8e9ce7f4.pdf,Decoupling with Entropy-based Equalization for Semi-Supervised Semantic Segmentation,"Chuanghao Ding, Jianrong Zhang, Henghui Ding, Hongwei Zhao, Zhihui Wang, Tengfei Xing, Runbo Hu",Computer Vision,https://www.ijcai.org/proceedings/2023/0074.pdf
IJCAI,2023,icda_illuminationcoupled_domain_adaptation_framework_for_unsupervised_nighttime_semantic_segmentation__fd011421.pdf,ICDA: Illumination-Coupled Domain Adaptation Framework for Unsupervised Nighttime Semantic Segmentation,"Chenghao Dong, Xuejing Kang, Anlong Ming",Computer Vision,https://www.ijcai.org/proceedings/2023/0075.pdf
IJCAI,2023,dfvsr_directional_frequency_video_superresolution_via_asymmetric_and_enhancement_alignment_network__0f789780.pdf,DFVSR: Directional Frequency Video Super-Resolution via Asymmetric and Enhancement Alignment Network,"Shuting Dong, Feng Lu, Zhe Wu, Chun Yuan",Computer Vision,https://www.ijcai.org/proceedings/2023/0076.pdf
IJCAI,2023,timestampsupervised_action_segmentation_from_the_perspective_of_clustering__2331db3d.pdf,Timestamp-Supervised Action Segmentation from the Perspective of Clustering,"Dazhao Du, Enhan Li, Lingyu Si, Fanjiang Xu, Fuchun Sun",Computer Vision,https://www.ijcai.org/proceedings/2023/0077.pdf
IJCAI,2023,lion_label_disambiguation_for_semisupervised_facial_expression_recognition_with_progressive_negative_learning__55a4a41b.pdf,LION: Label Disambiguation for Semi-supervised Facial Expression Recognition with Progressive Negative Learning,"Zhongjing Du, Xu Jiang, Peng Wang, Qizheng Zhou, Xi Wu, Jiliu Zhou, Yan Wang",Computer Vision,https://www.ijcai.org/proceedings/2023/0078.pdf
IJCAI,2023,improve_video_representation_with_temporal_adversarial_augmentation__3e401602.pdf,Improve Video Representation with Temporal Adversarial Augmentation,"Jinhao Duan, Quanfu Fan, Hao Cheng, Xiaoshuang Shi, Kaidi Xu",Computer Vision,https://www.ijcai.org/proceedings/2023/0079.pdf
IJCAI,2023,rfenet_towards_reciprocal_feature_evolution_for_glass_segmentation__7d4953a7.pdf,RFENet: Towards Reciprocal Feature Evolution for Glass Segmentation,"Ke Fan, Changan Wang, Yabiao Wang, Chengjie Wang, Ran Yi, Lizhuang Ma",Computer Vision,https://www.ijcai.org/proceedings/2023/0080.pdf
IJCAI,2023,reconstructionaware_prior_distillation_for_semisupervised_point_cloud_completion__84c51427.pdf,Reconstruction-Aware Prior Distillation for Semi-supervised Point Cloud Completion,"Zhaoxin Fan, Yulin He, Zhicheng Wang, Kejian Wu, Hongyan Liu, Jun He",Computer Vision,https://www.ijcai.org/proceedings/2023/0081.pdf
IJCAI,2023,subband_based_attention_for_robust_polyp_segmentation__1c4acc22.pdf,Sub-Band Based Attention for Robust Polyp Segmentation,"Xianyong Fang, Yuqing Shi, Qingqing Guo, Linbo Wang, Zhengyi Liu",Computer Vision,https://www.ijcai.org/proceedings/2023/0082.pdf
IJCAI,2023,incorporating_unlikely_negative_cues_for_distinctive_image_captioning__037f6f63.pdf,Incorporating Unlikely Negative Cues for Distinctive Image Captioning,"Zhengcong Fei, Junshi Huang",Computer Vision,https://www.ijcai.org/proceedings/2023/0083.pdf
IJCAI,2023,bpnet_bézier_primitive_segmentation_on_3d_point_clouds__05b9c075.pdf,BPNet: Bézier Primitive Segmentation on 3D Point Clouds,"Rao Fu, Cheng Wen, Qian Li, Xiao Xiao, Pierre Alliez",Computer Vision,https://www.ijcai.org/proceedings/2023/0084.pdf
