Conference,Year,Filename,Title,Authors,Category,PDF_URL
IJCAI,2022,anytime_capacity_expansion_in_medical_residency_match_by_monte_carlo_tree_search__c5e3a29e.pdf,Anytime Capacity Expansion in Medical Residency Match by Monte Carlo Tree Search,"Kenshi Abe, Junpei Komiyama, Atsushi Iwasaki",Agent-based and Multi-agent Systems,https://www.ijcai.org/proceedings/2022/0001.pdf
IJCAI,2022,socially_intelligent_genetic_agents_for_the_emergence_of_explicit_norms__4489517f.pdf,Socially Intelligent Genetic Agents for the Emergence of Explicit Norms,"Rishabh Agrawal, Nirav Ajmeri, Munindar Singh",Agent-based and Multi-agent Systems,https://www.ijcai.org/proceedings/2022/0002.pdf
IJCAI,2022,an_ef2x_allocation_protocol_for_restricted_additive_valuations__485fc243.pdf,An EF2X Allocation Protocol for Restricted Additive Valuations,"Hannaneh Akrami, Rojin Rezvan, Masoud Seddighin",Agent-based and Multi-agent Systems,https://www.ijcai.org/proceedings/2022/0003.pdf
IJCAI,2022,better_collective_decisions_via_uncertainty_reduction__408ea3d8.pdf,Better Collective Decisions via Uncertainty Reduction,"Shiri Alouf-Heffetz, Laurent Bulteau, Edith Elkind, Nimrod Talmon, Nicholas Teh",Agent-based and Multi-agent Systems,https://www.ijcai.org/proceedings/2022/0004.pdf
IJCAI,2022,how_should_we_vote_a_comparison_of_voting_systems_within_social_networks__8155cb33.pdf,How Should We Vote? A Comparison of Voting Systems within Social Networks,"Shiri Alouf-Heffetz, Ben Armstrong, Kate Larson, Nimrod Talmon",Agent-based and Multi-agent Systems,https://www.ijcai.org/proceedings/2022/0005.pdf
IJCAI,2022,public_signaling_in_bayesian_ad_auctions__63522058.pdf,Public Signaling in Bayesian Ad Auctions,"Francesco Bacchiocchi, Matteo Castiglioni, Alberto Marchesi, Giulia Romano, Nicola Gatti",Agent-based and Multi-agent Systems,https://www.ijcai.org/proceedings/2022/0006.pdf
IJCAI,2022,mixed_strategies_for_security_games_with_general_defending_requirements__f345cb9e.pdf,Mixed Strategies for Security Games with General Defending Requirements,"Rufan Bai, Haoxing Lin, Xinyu Yang, Xiaowei Wu, Minming Li, Weijia Jia",Agent-based and Multi-agent Systems,https://www.ijcai.org/proceedings/2022/0007.pdf
IJCAI,2022,envyfree_and_paretooptimal_allocations_for_agents_with_asymmetric_random_valuations__871efeec.pdf,Envy-Free and Pareto-Optimal Allocations for Agents with Asymmetric Random Valuations,"Yushi Bai, Paul Gölz",Agent-based and Multi-agent Systems,https://www.ijcai.org/proceedings/2022/0008.pdf
IJCAI,2022,achieving_envyfreeness_with_limited_subsidies_under_dichotomous_valuations__e17a95c5.pdf,Achieving Envy-Freeness with Limited Subsidies under Dichotomous Valuations,"Siddharth Barman, Anand Krishna, Yadati Narahari, Soumyarup Sadhukhan",Agent-based and Multi-agent Systems,https://www.ijcai.org/proceedings/2022/0009.pdf
IJCAI,2022,transparency_detection_and_imitation_in_strategic_classification__f1ecc9bd.pdf,"Transparency, Detection and Imitation in Strategic Classification","Flavia Barsotti, Ruya Gokhan Kocer, Fernando P. Santos",Agent-based and Multi-agent Systems,https://www.ijcai.org/proceedings/2022/0010.pdf
IJCAI,2022,timeconstrained_participatory_budgeting_under_uncertain_project_costs__9b44ba39.pdf,Time-Constrained Participatory Budgeting Under Uncertain Project Costs,"Dorothea Baumeister, Linus Boes, Christian Laußmann",Agent-based and Multi-agent Systems,https://www.ijcai.org/proceedings/2022/0011.pdf
IJCAI,2022,tolerance_is_necessary_for_stability_singlepeaked_swap_schelling_games__45a3cf67.pdf,Tolerance is Necessary for Stability: Single-Peaked Swap Schelling Games,"Davide Bilò, Vittorio Bilò, Pascal Lenzner, Louise Molitor",Agent-based and Multi-agent Systems,https://www.ijcai.org/proceedings/2022/0012.pdf
IJCAI,2022,general_opinion_formation_games_with_social_group_membership__0d4ae105.pdf,General Opinion Formation Games with Social Group Membership,"Vittorio Bilò, Diodato Ferraioli, Cosimo Vinci",Agent-based and Multi-agent Systems,https://www.ijcai.org/proceedings/2022/0013.pdf
IJCAI,2022,fair_equilibria_in_sponsored_search_auctions_the_advertisers_perspective__818fb523.pdf,Fair Equilibria in Sponsored Search Auctions: The Advertisers’ Perspective,"Georgios Birmpas, Andrea Celli, Riccardo Colini-Baldeschi, Stefano Leonardi",Agent-based and Multi-agent Systems,https://www.ijcai.org/proceedings/2022/0014.pdf
IJCAI,2022,understanding_distance_measures_among_elections__942faa5b.pdf,Understanding Distance Measures Among Elections,"Niclas Boehmer, Piotr Faliszewski, Rolf Niedermeier, Stanisław Szufa, Tomasz Wąs",Agent-based and Multi-agent Systems,https://www.ijcai.org/proceedings/2022/0015.pdf
IJCAI,2022,toward_policy_explanations_for_multiagent_reinforcement_learning__4d69101b.pdf,Toward Policy Explanations for Multi-Agent Reinforcement Learning,"Kayla Boggess, Sarit Kraus, Lu Feng",Agent-based and Multi-agent Systems,https://www.ijcai.org/proceedings/2022/0016.pdf
IJCAI,2022,distortion_in_voting_with_topt_preferences__f9ebae80.pdf,Distortion in Voting with Top-t Preferences,"Allan Borodin, Daniel Halpern, Mohamad Latifian, Nisarg Shah",Agent-based and Multi-agent Systems,https://www.ijcai.org/proceedings/2022/0017.pdf
IJCAI,2022,lets_agree_to_agree_targeting_consensus_for_incomplete_preferences_through_majority_dynamics__1e7a8580.pdf,Let’s Agree to Agree: Targeting Consensus for Incomplete Preferences through Majority Dynamics,"Sirin Botan, Simon Rey, Zoi Terzopoulou",Agent-based and Multi-agent Systems,https://www.ijcai.org/proceedings/2022/0018.pdf
IJCAI,2022,incentives_in_social_decision_schemes_with_pairwise_comparison_preferences__40582167.pdf,Incentives in Social Decision Schemes with Pairwise Comparison Preferences,"Felix Brandt, Patrick Lederer, Warut Suksompong",Agent-based and Multi-agent Systems,https://www.ijcai.org/proceedings/2022/0019.pdf
IJCAI,2022,singlepeaked_opinion_updates__1e374ee8.pdf,Single-Peaked Opinion Updates,"Robert Bredereck, Anne-Marie George, Jonas Israel, Leon Kellerhals",Agent-based and Multi-agent Systems,https://www.ijcai.org/proceedings/2022/0020.pdf
IJCAI,2022,when_votes_change_and_committees_should_not__27cd6fa9.pdf,When Votes Change and Committees Should (Not),"Robert Bredereck, Till Fluschnik, Andrzej Kaczmarczyk",Agent-based and Multi-agent Systems,https://www.ijcai.org/proceedings/2022/0021.pdf
IJCAI,2022,network_creation_with_homophilic_agents__52dde231.pdf,Network Creation with Homophilic Agents,"Martin Bullinger, Pascal Lenzner, Anna Melnichenko",Agent-based and Multi-agent Systems,https://www.ijcai.org/proceedings/2022/0022.pdf
IJCAI,2022,vidyutvanika21_an_autonomous_intelligent_broker_for_smartgrids__511cd122.pdf,VidyutVanika21: An Autonomous Intelligent Broker for Smart-grids,"Sanjay Chandlekar, Bala Suraj Pedasingu, Easwar Subramanian, Sanjay Bhat, Praveen Paruchuri, Sujit Gujar",Agent-based and Multi-agent Systems,https://www.ijcai.org/proceedings/2022/0023.pdf
IJCAI,2022,optimal_anonymous_independent_reward_scheme_design__acb79f1e.pdf,Optimal Anonymous Independent Reward Scheme Design,"Mengjing Chen, Pingzhong Tang, Zihe Wang, Shenke Xiao, Xiwang Yang",Agent-based and Multi-agent Systems,https://www.ijcai.org/proceedings/2022/0024.pdf
IJCAI,2022,goal_consistency_an_effective_multiagent_cooperative_method_for_multistage_tasks__817180da.pdf,Goal Consistency: An Effective Multi-Agent Cooperative Method for Multistage Tasks,"Xinning Chen, Xuan Liu, Shigeng Zhang, Bo Ding, Kenli Li",Agent-based and Multi-agent Systems,https://www.ijcai.org/proceedings/2022/0025.pdf
IJCAI,2022,on_the_convergence_of_fictitious_play_a_decomposition_approach__5323fce6.pdf,On the Convergence of Fictitious Play: A Decomposition Approach,"Yurong Chen, Xiaotie Deng, Chenchen Li, David Mguni, Jun Wang, Xiang Yan, Yaodong Yang",Agent-based and Multi-agent Systems,https://www.ijcai.org/proceedings/2022/0026.pdf
IJCAI,2022,twosided_matching_over_social_networks__81612af6.pdf,Two-Sided Matching over Social Networks,"Sung-Ho Cho, Taiki Todo, Makoto Yokoo",Agent-based and Multi-agent Systems,https://www.ijcai.org/proceedings/2022/0027.pdf
IJCAI,2022,a_formal_model_for_multiagent_qlearning_dynamics_on_regular_graphs__ca7cccfa.pdf,A Formal Model for Multiagent Q-Learning Dynamics on Regular Graphs,"Chen Chu, Yong Li, Jinzhuo Liu, Shuyue Hu, Xuelong Li, Zhen Wang",Agent-based and Multi-agent Systems,https://www.ijcai.org/proceedings/2022/0028.pdf
IJCAI,2022,preserving_consistency_in_multiissue_liquid_democracy__16af61b3.pdf,Preserving Consistency in Multi-Issue Liquid Democracy,"Rachael Colley, Umberto Grandi",Agent-based and Multi-agent Systems,https://www.ijcai.org/proceedings/2022/0029.pdf
IJCAI,2022,voting_in_twocrossing_elections__278bdc90.pdf,Voting in Two-Crossing Elections,"Andrei Constantinescu, Roger Wattenhofer",Agent-based and Multi-agent Systems,https://www.ijcai.org/proceedings/2022/0030.pdf
IJCAI,2022,multiagent_intention_progression_with_reward_machines__48293d97.pdf,Multi-Agent Intention Progression with Reward Machines,"Michael Dann, Yuan Yao, Natasha Alechina, Brian Logan, John Thangarajah",Agent-based and Multi-agent Systems,https://www.ijcai.org/proceedings/2022/0031.pdf
IJCAI,2022,an_analysis_of_the_linear_bilateral_anac_domains_using_the_micro_benchmark_strategy__f39eb26f.pdf,An Analysis of the Linear Bilateral ANAC Domains Using the MiCRO Benchmark Strategy,Dave De Jonge,Agent-based and Multi-agent Systems,https://www.ijcai.org/proceedings/2022/0032.pdf
IJCAI,2022,approval_with_runoff__542ed434.pdf,Approval with Runoff,"Théo Delemazure, Jérôme Lang, Jean-François Laslier, M. Remzi Sanver",Agent-based and Multi-agent Systems,https://www.ijcai.org/proceedings/2022/0033.pdf
IJCAI,2022,the_complexity_of_envyfree_graph_cutting__c3b8eb39.pdf,The Complexity of Envy-Free Graph Cutting,"Argyrios Deligkas, Eduard Eiben, Robert Ganian, Thekla Hamm, Sebastian Ordyniak",Agent-based and Multi-agent Systems,https://www.ijcai.org/proceedings/2022/0034.pdf
IJCAI,2022,parameterized_complexity_of_hotellingdowns_with_party_nominees__e6f38344.pdf,Parameterized Complexity of Hotelling-Downs with Party Nominees,"Argyrios Deligkas, Eduard Eiben, Tiger-Lily Goldsmith",Agent-based and Multi-agent Systems,https://www.ijcai.org/proceedings/2022/0035.pdf
IJCAI,2022,online_approval_committee_elections__c0abb77e.pdf,Online Approval Committee Elections,"Virginie Do, Matthieu Hervouin, Jérôme Lang, Piotr Skowron",Agent-based and Multi-agent Systems,https://www.ijcai.org/proceedings/2022/0036.pdf
IJCAI,2022,on_the_ordinal_invariance_of_power_indices_on_coalitional_games__223face1.pdf,On the Ordinal Invariance of Power Indices on Coalitional Games,"Jean-Paul Doignon, Stefano Moretti, Meltem Ozturk",Agent-based and Multi-agent Systems,https://www.ijcai.org/proceedings/2022/0037.pdf
IJCAI,2022,invasion_dynamics_in_the_biased_voter_process__bd97dfd3.pdf,Invasion Dynamics in the Biased Voter Process,"Loke Durocher, Panagiotis Karras, Andreas Pavlogiannis, Josef Tkadlec",Agent-based and Multi-agent Systems,https://www.ijcai.org/proceedings/2022/0038.pdf
IJCAI,2022,efficient_resource_allocation_with_secretive_agents__be6dc056.pdf,Efficient Resource Allocation with Secretive Agents,"Soroush Ebadian, Rupert Freeman, Nisarg Shah",Agent-based and Multi-agent Systems,https://www.ijcai.org/proceedings/2022/0039.pdf
IJCAI,2022,contests_to_incentivize_a_target_group__bb51c85c.pdf,Contests to Incentivize a Target Group,"Edith Elkind, Abheek Ghosh, Paul W. Goldberg",Agent-based and Multi-agent Systems,https://www.ijcai.org/proceedings/2022/0040.pdf
IJCAI,2022,representation_matters_characterisation_and_impossibility_results_for_interval_aggregation__4ae00283.pdf,Representation Matters: Characterisation and Impossibility Results for Interval Aggregation,"Ulle Endriss, Arianna Novaro, Zoi Terzopoulou",Agent-based and Multi-agent Systems,https://www.ijcai.org/proceedings/2022/0041.pdf
IJCAI,2022,insight_into_voting_problem_complexity_using_randomized_classes__095974aa.pdf,Insight into Voting Problem Complexity Using Randomized Classes,"Zack Fitzsimmons, Edith Hemaspaandra",Agent-based and Multi-agent Systems,https://www.ijcai.org/proceedings/2022/0042.pdf
IJCAI,2022,approximate_strategyproof_mechanisms_for_the_additively_separable_group_activity_selection_problem__fd2136bd.pdf,Approximate Strategyproof Mechanisms for the Additively Separable Group Activity Selection Problem,"Michele Flammini, Giovanna Varricchio",Agent-based and Multi-agent Systems,https://www.ijcai.org/proceedings/2022/0043.pdf
IJCAI,2022,picking_the_right_winner_why_tiebreaking_in_crowdsourcing_contests_matters__d2b85c4a.pdf,Picking the Right Winner: Why Tie-Breaking  in Crowdsourcing Contests Matters,"Coral Haggiag, Sigal Oren, Ella Segev",Agent-based and Multi-agent Systems,https://www.ijcai.org/proceedings/2022/0044.pdf
IJCAI,2022,can_buyers_reveal_for_a_better_deal__b5f335ca.pdf,Can Buyers Reveal for a Better Deal?,"Daniel Halpern, Gregory Kehne, Jamie Tucker-Foltz",Agent-based and Multi-agent Systems,https://www.ijcai.org/proceedings/2022/0045.pdf
IJCAI,2022,two_for_one__one_for_all_twosided_manipulation_in_matching_markets__6e8e371f.pdf,Two for One & One for All: Two-Sided Manipulation in Matching Markets,"Hadi Hosseini, Fatima Umar, Rohit Vaish",Agent-based and Multi-agent Systems,https://www.ijcai.org/proceedings/2022/0046.pdf
IJCAI,2022,phragmén_rules_for_degressive_and_regressive_proportionality__8bae26ee.pdf,Phragmén Rules for Degressive and Regressive Proportionality,"Michał Jaworski, Piotr Skowron",Agent-based and Multi-agent Systems,https://www.ijcai.org/proceedings/2022/0047.pdf
IJCAI,2022,forgiving_debt_in_financial_network_games__100643d2.pdf,Forgiving Debt in Financial Network Games,"Panagiotis Kanellopoulos, Maria Kyropoulou, Hao Zhou",Agent-based and Multi-agent Systems,https://www.ijcai.org/proceedings/2022/0048.pdf
IJCAI,2022,on_discrete_truthful_heterogeneous_twofacility_location__9f1285d1.pdf,On Discrete Truthful Heterogeneous Two-Facility Location,"Panagiotis Kanellopoulos, Alexandros A. Voudouris, Rongsen Zhang",Agent-based and Multi-agent Systems,https://www.ijcai.org/proceedings/2022/0049.pdf
IJCAI,2022,plurality_veto_a_simple_voting_rule_achieving_optimal_metric_distortion__61602728.pdf,Plurality Veto: A Simple Voting Rule Achieving Optimal Metric Distortion,"Fatih Erdem Kizilkaya, David Kempe",Agent-based and Multi-agent Systems,https://www.ijcai.org/proceedings/2022/0050.pdf
IJCAI,2022,the_dichotomous_affiliate_stable_matching_problem_approvalbased_matching_with_applicantemployer_relations__4b44985b.pdf,The Dichotomous Affiliate Stable Matching Problem: Approval-Based Matching with Applicant-Employer Relations,"Marina Knittel, Samuel Dooley, John Dickerson",Agent-based and Multi-agent Systems,https://www.ijcai.org/proceedings/2022/0051.pdf
IJCAI,2022,light_agents_searching_for_hot_information__db4b9fc2.pdf,Light Agents Searching for Hot Information,"Dariusz R. Kowalski, Dominik Pajak",Agent-based and Multi-agent Systems,https://www.ijcai.org/proceedings/2022/0052.pdf
IJCAI,2022,explaining_preferences_by_multiple_patterns_in_voters_behavior__6d24457f.pdf,Explaining Preferences by Multiple Patterns in Voters’ Behavior,"Sonja Kraiczy, Edith Elkind",Agent-based and Multi-agent Systems,https://www.ijcai.org/proceedings/2022/0053.pdf
IJCAI,2022,biased_majority_opinion_dynamics_exploiting_graph_kdomination__6c8bff33.pdf,Biased Majority Opinion Dynamics: Exploiting Graph k-domination,"Hicham Lesfari, Frédéric Giroire, Stéphane Pérennes",Agent-based and Multi-agent Systems,https://www.ijcai.org/proceedings/2022/0054.pdf
IJCAI,2022,modelling_the_dynamics_of_multiagent_qlearning_the_stochastic_effects_of_local_interaction_and_incomplete_information__2979903f.pdf,Modelling the Dynamics of Multi-Agent Q-learning: The Stochastic Effects of Local Interaction and Incomplete Information,"Chin-wing Leung, Shuyue Hu, Ho-fung Leung",Agent-based and Multi-agent Systems,https://www.ijcai.org/proceedings/2022/0055.pdf
IJCAI,2022,propositional_gossip_protocols_under_fair_schedulers__83bca3f9.pdf,Propositional Gossip Protocols under Fair Schedulers,"Joseph Livesey, Dominik Wojtczak",Agent-based and Multi-agent Systems,https://www.ijcai.org/proceedings/2022/0056.pdf
IJCAI,2022,proportional_budget_allocations_towards_a_systematization__9df3fedc.pdf,Proportional Budget Allocations: Towards a Systematization,"Maaike Los, Zoé Christoff, Davide Grossi",Agent-based and Multi-agent Systems,https://www.ijcai.org/proceedings/2022/0057.pdf
IJCAI,2022,parameterized_algorithms_for_kidney_exchange__87b034a9.pdf,Parameterized Algorithms for Kidney Exchange,"Arnab Maiti, Palash Dey",Agent-based and Multi-agent Systems,https://www.ijcai.org/proceedings/2022/0058.pdf
IJCAI,2022,fixing_knockout_tournaments_with_seeds__941a9a6d.pdf,Fixing Knockout Tournaments With Seeds,"Pasin Manurangsi, Warut Suksompong",Agent-based and Multi-agent Systems,https://www.ijcai.org/proceedings/2022/0059.pdf
IJCAI,2022,group_wisdom_at_a_price_jury_theorems_with_costly_information__6f090746.pdf,Group Wisdom at a Price: Jury Theorems with Costly Information,"Matteo Michelini, Adrian Haret, Davide Grossi",Agent-based and Multi-agent Systems,https://www.ijcai.org/proceedings/2022/0060.pdf
IJCAI,2022,automated_synthesis_of_mechanisms__209060f6.pdf,Automated Synthesis of Mechanisms,"Munyque Mittelmann, Bastien Maubert, Aniello Murano, Laurent Perrussel",Agent-based and Multi-agent Systems,https://www.ijcai.org/proceedings/2022/0061.pdf
IJCAI,2022,robust_solutions_for_multidefender_stackelberg_security_games__fc3c110f.pdf,Robust Solutions for Multi-Defender Stackelberg Security Games,"Dolev Mutzari, Yonatan Aumann, Sarit Kraus",Agent-based and Multi-agent Systems,https://www.ijcai.org/proceedings/2022/0062.pdf
IJCAI,2022,i_will_have_order_optimizing_orders_for_fair_reviewer_assignment__ee706d9a.pdf,I Will Have Order! Optimizing Orders for Fair Reviewer Assignment,"Justin Payan, Yair Zick",Agent-based and Multi-agent Systems,https://www.ijcai.org/proceedings/2022/0063.pdf
IJCAI,2022,fair_individually_rational_and_cheap_adjustment__eb6481a8.pdf,"Fair, Individually Rational and Cheap Adjustment","Gleb Polevoy, Marcin Dziubiński",Agent-based and Multi-agent Systems,https://www.ijcai.org/proceedings/2022/0064.pdf
IJCAI,2022,exploring_the_benefits_of_teams_in_multiagent_learning__df6ccdd6.pdf,Exploring the Benefits of Teams in Multiagent Learning,"David Radke, Kate Larson, Tim Brecht",Agent-based and Multi-agent Systems,https://www.ijcai.org/proceedings/2022/0065.pdf
IJCAI,2022,the_power_of_media_agencies_in_ad_auctions_improving_utility_through_coordinated_bidding__15664939.pdf,The Power of Media Agencies in Ad Auctions: Improving Utility through Coordinated Bidding,"Giulia Romano, Matteo Castiglioni, Alberto Marchesi, Nicola Gatti",Agent-based and Multi-agent Systems,https://www.ijcai.org/proceedings/2022/0066.pdf
IJCAI,2022,transfer_learning_based_adaptive_automated_negotiating_agent_framework__ca432840.pdf,Transfer Learning Based Adaptive Automated Negotiating Agent Framework,"Ayan Sengupta, Shinji Nakadai, Yasser Mohammad",Agent-based and Multi-agent Systems,https://www.ijcai.org/proceedings/2022/0067.pdf
IJCAI,2022,multiwinner_elections_under_minimax_chamberlincourant_rule_in_euclidean_space__3e6f87c0.pdf,Multiwinner Elections under Minimax Chamberlin-Courant Rule in Euclidean Space,"Chinmay Sonar, Subhash Suri, Jie Xue",Agent-based and Multi-agent Systems,https://www.ijcai.org/proceedings/2022/0068.pdf
IJCAI,2022,neartight_algorithms_for_the_chamberlincourant_and_thiele_voting_rules__3563a4c5.pdf,Near-Tight Algorithms for the Chamberlin-Courant and Thiele Voting Rules,"Krzysztof Sornat, Virginia Vassilevska Williams, Yinzhan Xu",Agent-based and Multi-agent Systems,https://www.ijcai.org/proceedings/2022/0069.pdf
IJCAI,2022,maxmin_participatory_budgeting__0d19a14d.pdf,Maxmin Participatory Budgeting,"Gogulapati Sreedurga, Mayank Ratan Bhardwaj, Yadati Narahari",Agent-based and Multi-agent Systems,https://www.ijcai.org/proceedings/2022/0070.pdf
IJCAI,2022,how_to_sample_approval_elections__857eb8a3.pdf,How to Sample Approval Elections?,"Stanisław Szufa, Piotr Faliszewski, Łukasz Janeczko, Martin Lackner, Arkadii Slinko, Krzysztof Sornat, Nimrod Talmon",Agent-based and Multi-agent Systems,https://www.ijcai.org/proceedings/2022/0071.pdf
IJCAI,2022,searchbased_testing_of_reinforcement_learning__5bdb5e13.pdf,Search-Based Testing of Reinforcement Learning,"Martin Tappler, Filip Cano Córdoba, Bernhard K. Aichernig, Bettina Könighofer",Agent-based and Multi-agent Systems,https://www.ijcai.org/proceedings/2022/0072.pdf
IJCAI,2022,realtime_bdi_agents_a_model_and_its_implementation__8c611089.pdf,Real-Time BDI Agents: A Model and Its Implementation,"Andrea Traldi, Francesco Bruschetti, Marco Robol, Marco Roveri, Paolo Giorgini",Agent-based and Multi-agent Systems,https://www.ijcai.org/proceedings/2022/0073.pdf
IJCAI,2022,maxsum_with_quadtrees_for_decentralized_coordination_in_continuous_domains__bcf8bc80.pdf,Max-Sum with Quadtrees for Decentralized Coordination in Continuous Domains,"Dimitrios Troullinos, Georgios Chalkiadakis, Vasilis Samoladas, Markos Papageorgiou",Agent-based and Multi-agent Systems,https://www.ijcai.org/proceedings/2022/0074.pdf
IJCAI,2022,strategy_proof_mechanisms_for_facility_location_with_capacity_limits__64be13f6.pdf,Strategy Proof Mechanisms for Facility Location with Capacity Limits,Toby Walsh,Agent-based and Multi-agent Systems,https://www.ijcai.org/proceedings/2022/0075.pdf
IJCAI,2022,modelling_the_dynamics_of_regret_minimization_in_large_agent_populations_a_master_equation_approach__cf2f3da0.pdf,Modelling the Dynamics of Regret Minimization in Large Agent Populations: a Master Equation Approach,"Zhen Wang, Chunjiang Mu, Shuyue Hu, Chen Chu, Xuelong Li",Agent-based and Multi-agent Systems,https://www.ijcai.org/proceedings/2022/0076.pdf
IJCAI,2022,monotonevalue_neural_networks_exploiting_preference_monotonicity_in_combinatorial_assignment__d95184e1.pdf,Monotone-Value Neural Networks: Exploiting Preference Monotonicity in Combinatorial Assignment,"Jakob Weissteiner, Jakob Heiss, Julien Siems, Sven Seuken",Agent-based and Multi-agent Systems,https://www.ijcai.org/proceedings/2022/0077.pdf
IJCAI,2022,fourier_analysisbased_iterative_combinatorial_auctions__bf12a694.pdf,Fourier Analysis-based Iterative Combinatorial Auctions,"Jakob Weissteiner, Chris Wendler, Sven Seuken, Ben Lubin, Markus Püschel",Agent-based and Multi-agent Systems,https://www.ijcai.org/proceedings/2022/0078.pdf
IJCAI,2022,manipulating_elections_by_changing_voter_perceptions__368fd9b1.pdf,Manipulating Elections by Changing Voter Perceptions,"Junlin Wu, Andrew Estornell, Lecheng Kong, Yevgeniy Vorobeychik",Agent-based and Multi-agent Systems,https://www.ijcai.org/proceedings/2022/0079.pdf
IJCAI,2022,fast_and_finegrained_autoscaler_for_streaming_jobs_with_reinforcement_learning__1cac71e6.pdf,Fast and Fine-grained Autoscaler for Streaming Jobs with Reinforcement Learning,"Mingzhe Xing, Hangyu Mao, Zhen Xiao",Agent-based and Multi-agent Systems,https://www.ijcai.org/proceedings/2022/0080.pdf
IJCAI,2022,mechanism_design_with_predictions__27bf4a82.pdf,Mechanism Design with Predictions,"Chenyang Xu, Pinyan Lu",Agent-based and Multi-agent Systems,https://www.ijcai.org/proceedings/2022/0081.pdf
IJCAI,2022,efficient_multiagent_communication_via_shapley_message_value__ca1649b3.pdf,Efficient Multi-Agent Communication via Shapley Message Value,"Di Xue, Lei Yuan, Zongzhang Zhang, Yang Yu",Agent-based and Multi-agent Systems,https://www.ijcai.org/proceedings/2022/0082.pdf
IJCAI,2022,on_the_complexity_of_calculating_approvalbased_winners_in_candidatesembedded_metrics__02d736a1.pdf,On the Complexity of Calculating Approval-Based Winners in Candidates-Embedded Metrics,Yongjie Yang,Agent-based and Multi-agent Systems,https://www.ijcai.org/proceedings/2022/0083.pdf
IJCAI,2022,environment_design_for_biased_decision_makers__a5aca7ad.pdf,Environment Design for Biased Decision Makers,"Guanghui Yu, Chien-Ju Ho",Agent-based and Multi-agent Systems,https://www.ijcai.org/proceedings/2022/0084.pdf
IJCAI,2022,multiagent_concentrative_coordination_with_decentralized_task_representation__1d384b3e.pdf,Multi-Agent Concentrative Coordination with Decentralized Task Representation,"Lei Yuan, Chenghe Wang, Jianhao Wang, Fuxiang Zhang, Feng Chen, Cong Guan, Zongzhang Zhang, Chongjie Zhang, Yang Yu",Agent-based and Multi-agent Systems,https://www.ijcai.org/proceedings/2022/0085.pdf
IJCAI,2022,correlationbased_algorithm_for_teammaxmin_equilibrium_in_multiplayer_extensiveform_games__20d1355b.pdf,Correlation-Based Algorithm for Team-Maxmin Equilibrium in Multiplayer Extensive-Form Games,"Youzhi Zhang, Bo An, V. S. Subrahmanian",Agent-based and Multi-agent Systems,https://www.ijcai.org/proceedings/2022/0086.pdf
IJCAI,2022,strategyproof_mechanisms_for_groupfair_facility_location_problems__203a1a52.pdf,Strategyproof Mechanisms for Group-Fair Facility Location Problems,"Houyu Zhou, Minming Li, Hau Chan",Agent-based and Multi-agent Systems,https://www.ijcai.org/proceedings/2022/0087.pdf
IJCAI,2022,evolutionary_approach_to_security_games_with_signaling__216afd76.pdf,Evolutionary Approach to Security Games with Signaling,"Adam Żychowski, Jacek Mańdziuk, Elizabeth Bondi, Aravind Venugopal, Milind Tambe, Balaraman Ravindran",Agent-based and Multi-agent Systems,https://www.ijcai.org/proceedings/2022/0088.pdf
IJCAI,2022,detecting_outofcontext_objects_using_graph_contextual_reasoning_network__3cd32b34.pdf,Detecting Out-Of-Context Objects Using Graph Contextual Reasoning Network,"Manoj Acharya, Anirban Roy, Kaushik Koneripalli, Susmit Jha, Christopher Kanan, Ajay Divakaran","AI Ethics, Trust, Fairness",https://www.ijcai.org/proceedings/2022/0089.pdf
