Conference,Year,Filename,Title,Authors,Category,PDF_URL
NeurIPS,2017,diving_into_the_shallows_a_computational_perspective_on_largescale_shallow_learning__9e4da7f0.pdf,Diving into the shallows: a computational perspective on large-scale shallow learning,"SIYUAN MA, Mikhail Belkin",None,https://proceedings.neurips.cc/paper_files/paper/2017/file/bf424cb7b0dea050a42b9739eb261a3a-Paper.pdf
NeurIPS,2017,integration_methods_and_optimization_algorithms__e4308045.pdf,Integration Methods and Optimization Algorithms,"Damien Scieur, Vincent Roulet, Francis Bach, Alexandre d'Aspremont",None,https://proceedings.neurips.cc/paper_files/paper/2017/file/bf62768ca46b6c3b5bea9515d1a1fc45-Paper.pdf
NeurIPS,2017,the_unreasonable_effectiveness_of_structured_random_orthogonal_embeddings__f4e65c5a.pdf,The Unreasonable Effectiveness of Structured Random Orthogonal Embeddings,"Krzysztof M. Choromanski, Mark Rowland, Adrian Weller",None,https://proceedings.neurips.cc/paper_files/paper/2017/file/bf8229696f7a3bb4700cfddef19fa23f-Paper.pdf
NeurIPS,2017,a_kllucb_algorithm_for_largescale_crowdsourcing__6e22dcce.pdf,A KL-LUCB algorithm for Large-Scale Crowdsourcing,"Ervin Tanczos, Robert Nowak, Bob Mankoff",None,https://proceedings.neurips.cc/paper_files/paper/2017/file/c02f9de3c2f3040751818aacc7f60b74-Paper.pdf
NeurIPS,2017,qlda_uncovering_latent_patterns_in_textbased_sequential_decision_processes__ac6a2a83.pdf,Q-LDA: Uncovering Latent Patterns in Text-based Sequential Decision Processes,"Jianshu Chen, Chong Wang, Lin Xiao, Ji He, Lihong Li, Li Deng",None,https://proceedings.neurips.cc/paper_files/paper/2017/file/c0e90532fb42ac6de18e25e95db73047-Paper.pdf
NeurIPS,2017,streaming_weak_submodularity_interpreting_neural_networks_on_the_fly__2177124c.pdf,Streaming Weak Submodularity: Interpreting Neural Networks on the Fly,"Ethan Elenberg, Alexandros G. Dimakis, Moran Feldman, Amin Karbasi",None,https://proceedings.neurips.cc/paper_files/paper/2017/file/c182f930a06317057d31c73bb2fedd4f-Paper.pdf
NeurIPS,2017,decomposable_submodular_function_minimization_discrete_and_continuous__a7cd49b4.pdf,Decomposable Submodular Function Minimization: Discrete and Continuous,"Alina Ene, Huy Nguyen, László A. Végh",None,https://proceedings.neurips.cc/paper_files/paper/2017/file/c1fea270c48e8079d8ddf7d06d26ab52-Paper.pdf
NeurIPS,2017,learning_affinity_via_spatial_propagation_networks__37ac8b7f.pdf,Learning Affinity via Spatial Propagation Networks,"Sifei Liu, Shalini De Mello, Jinwei Gu, Guangyu Zhong, Ming-Hsuan Yang, Jan Kautz",None,https://proceedings.neurips.cc/paper_files/paper/2017/file/c22abfa379f38b5b0411bc11fa9bf92f-Paper.pdf
NeurIPS,2017,gated_recurrent_convolution_neural_network_for_ocr__b9b73c26.pdf,Gated Recurrent Convolution Neural Network for OCR,"Jianfeng Wang, Xiaolin Hu",None,https://proceedings.neurips.cc/paper_files/paper/2017/file/c24cd76e1ce41366a4bbe8a49b02a028-Paper.pdf
NeurIPS,2017,multiview_matrix_factorization_for_linear_dynamical_system_estimation__85d32290.pdf,Multi-view Matrix Factorization for Linear Dynamical System Estimation,"Mahdi Karami, Martha White, Dale Schuurmans, Csaba Szepesvari",None,https://proceedings.neurips.cc/paper_files/paper/2017/file/c2964caac096f26db222cb325aa267cb-Paper.pdf
NeurIPS,2017,policy_gradient_with_value_function_approximation_for_collective_multiagent_planning__c8049e0b.pdf,Policy Gradient With Value Function Approximation For Collective Multiagent Planning,"Duc Thien Nguyen, Akshat Kumar, Hoong Chuin Lau",None,https://proceedings.neurips.cc/paper_files/paper/2017/file/c2ba1bc54b239208cb37b901c0d3b363-Paper.pdf
NeurIPS,2017,stochastic_submodular_maximization_the_case_of_coverage_functions__ea8715f4.pdf,Stochastic Submodular Maximization: The Case of Coverage Functions,"Mohammad Karimi, Mario Lucic, Hamed Hassani, Andreas Krause",None,https://proceedings.neurips.cc/paper_files/paper/2017/file/c2f32522a84d5e6357e6abac087f1b0b-Paper.pdf
NeurIPS,2017,stochastic_approximation_for_canonical_correlation_analysis__a2662602.pdf,Stochastic Approximation for Canonical Correlation Analysis,"Raman Arora, Teodor Vanislavov Marinov, Poorya Mianjy, Nati Srebro",None,https://proceedings.neurips.cc/paper_files/paper/2017/file/c30fb4dc55d801fc7473840b5b161dfa-Paper.pdf
NeurIPS,2017,linear_regression_without_correspondence__988b5dd1.pdf,Linear regression without correspondence,"Daniel J. Hsu, Kevin Shi, Xiaorui Sun",None,https://proceedings.neurips.cc/paper_files/paper/2017/file/c32d9bf27a3da7ec8163957080c8628e-Paper.pdf
NeurIPS,2017,structured_generative_adversarial_networks__64b0bf89.pdf,Structured Generative Adversarial Networks,"Zhijie Deng, Hao Zhang, Xiaodan Liang, Luona Yang, Shizhen Xu, Jun Zhu, Eric P. Xing",None,https://proceedings.neurips.cc/paper_files/paper/2017/file/c3535febaff29fcb7c0d20cbe94391c7-Paper.pdf
NeurIPS,2017,dynamicdepth_context_tree_weighting__3e63d77e.pdf,Dynamic-Depth Context Tree Weighting,"Joao V. Messias, Shimon Whiteson",None,https://proceedings.neurips.cc/paper_files/paper/2017/file/c366c2c97d47b02b24c3ecade4c40a01-Paper.pdf
NeurIPS,2017,fast_sampleefficient_algorithms_for_structured_phase_retrieval__33422593.pdf,"Fast, Sample-Efficient Algorithms for Structured Phase Retrieval","Gauri Jagatap, Chinmay Hegde",None,https://proceedings.neurips.cc/paper_files/paper/2017/file/c3a690be93aa602ee2dc0ccab5b7b67e-Paper.pdf
NeurIPS,2017,hierarchical_methods_of_moments__d3f9ccd0.pdf,Hierarchical Methods of Moments,"Matteo Ruffini, Guillaume Rabusseau, Borja Balle",None,https://proceedings.neurips.cc/paper_files/paper/2017/file/c44e503833b64e9f27197a484f4257c0-Paper.pdf
NeurIPS,2017,a_new_alternating_direction_method_for_linear_programming__e1b9a462.pdf,A New Alternating Direction Method for Linear Programming,"Sinong Wang, Ness Shroff",None,https://proceedings.neurips.cc/paper_files/paper/2017/file/c4b31ce7d95c75ca70d50c19aef08bf1-Paper.pdf
NeurIPS,2017,near_optimal_sketching_of_lowrank_tensor_regression__4e774b2d.pdf,Near Optimal Sketching of Low-Rank Tensor Regression,"Xingguo Li, Jarvis Haupt, David Woodruff",None,https://proceedings.neurips.cc/paper_files/paper/2017/file/c4de8ced6214345614d33fb0b16a8acd-Paper.pdf
NeurIPS,2017,batch_renormalization_towards_reducing_minibatch_dependence_in_batchnormalized_models__355f8097.pdf,Batch Renormalization: Towards Reducing Minibatch Dependence in Batch-Normalized Models,Sergey Ioffe,None,https://proceedings.neurips.cc/paper_files/paper/2017/file/c54e7837e0cd0ced286cb5995327d1ab-Paper.pdf
NeurIPS,2017,positionbased_multipleplay_bandit_problem_with_unknown_position_bias__cdc7398f.pdf,Position-based Multiple-play Bandit Problem with Unknown Position Bias,"Junpei Komiyama, Junya Honda, Akiko Takeda",None,https://proceedings.neurips.cc/paper_files/paper/2017/file/c57168a952f5d46724cf35dfc3d48a7f-Paper.pdf
NeurIPS,2017,deep_voice_2_multispeaker_neural_texttospeech__57c7e5c7.pdf,Deep Voice 2: Multi-Speaker Neural Text-to-Speech,"Andrew Gibiansky, Sercan Arik, Gregory Diamos, John Miller, Kainan Peng, Wei Ping, Jonathan Raiman, Yanqi Zhou",None,https://proceedings.neurips.cc/paper_files/paper/2017/file/c59b469d724f7919b7d35514184fdc0f-Paper.pdf
NeurIPS,2017,eigendistortions_of_hierarchical_representations__1670e014.pdf,Eigen-Distortions of Hierarchical Representations,"Alexander Berardino, Valero Laparra, Johannes Ballé, Eero Simoncelli",None,https://proceedings.neurips.cc/paper_files/paper/2017/file/c5a4e7e6882845ea7bb4d9462868219b-Paper.pdf
NeurIPS,2017,learning_to_prune_deep_neural_networks_via_layerwise_optimal_brain_surgeon__59c5a2ed.pdf,Learning to Prune Deep Neural Networks via Layer-wise Optimal Brain Surgeon,"Xin Dong, Shangyu Chen, Sinno Pan",None,https://proceedings.neurips.cc/paper_files/paper/2017/file/c5dc3e08849bec07e33ca353de62ea04-Paper.pdf
NeurIPS,2017,deliberation_networks_sequence_generation_beyond_onepass_decoding__1159c703.pdf,Deliberation Networks: Sequence Generation Beyond One-Pass Decoding,"Yingce Xia, Fei Tian, Lijun Wu, Jianxin Lin, Tao Qin, Nenghai Yu, Tie-Yan Liu",None,https://proceedings.neurips.cc/paper_files/paper/2017/file/c6036a69be21cb660499b75718a3ef24-Paper.pdf
NeurIPS,2017,do_deep_neural_networks_suffer_from_crowding__e4b42d54.pdf,Do Deep Neural Networks Suffer from Crowding?,"Anna Volokitin, Gemma Roig, Tomaso A. Poggio",None,https://proceedings.neurips.cc/paper_files/paper/2017/file/c61f571dbd2fb949d3fe5ae1608dd48b-Paper.pdf
NeurIPS,2017,nonstationary_spectral_kernels__d888ab7d.pdf,Non-Stationary Spectral Kernels,"Sami Remes, Markus Heinonen, Samuel Kaski",None,https://proceedings.neurips.cc/paper_files/paper/2017/file/c65d7bd70fe3e5e3a2f3de681edc193d-Paper.pdf
NeurIPS,2017,extracting_lowdimensional_dynamics_from_multiple_largescale_neural_population_recordings_by_learning_to_predict_correlations__4f74a107.pdf,Extracting low-dimensional dynamics from multiple large-scale neural population recordings by learning to predict correlations,"Marcel Nonnenmacher, Srinivas C. Turaga, Jakob H. Macke",None,https://proceedings.neurips.cc/paper_files/paper/2017/file/c7558e9d1f956b016d1fdba7ea132378-Paper.pdf
NeurIPS,2017,minimizing_a_submodular_function_from_samples__24050775.pdf,Minimizing a Submodular Function from Samples,"Eric Balkanski, Yaron Singer",None,https://proceedings.neurips.cc/paper_files/paper/2017/file/c75b6f114c23a4d7ea11331e7c00e73c-Paper.pdf
NeurIPS,2017,a_graphtheoretic_approach_to_multitasking__1462555a.pdf,A graph-theoretic approach to multitasking,"Noga Alon, Daniel Reichman, Igor Shinkar, Tal Wagner, Sebastian Musslick, Jonathan D. Cohen, Tom Griffiths, Biswadip dey, Kayhan Ozcimder",None,https://proceedings.neurips.cc/paper_files/paper/2017/file/c850371fda6892fbfd1c5a5b457e5777-Paper.pdf
NeurIPS,2017,adversarial_surrogate_losses_for_ordinal_regression__8af1e27b.pdf,Adversarial Surrogate Losses for Ordinal Regression,"Rizal Fathony, Mohammad Ali Bashiri, Brian Ziebart",None,https://proceedings.neurips.cc/paper_files/paper/2017/file/c86a7ee3d8ef0b551ed58e354a836f2b-Paper.pdf
NeurIPS,2017,selfsupervised_intrinsic_image_decomposition__ebcc0409.pdf,Self-Supervised Intrinsic Image Decomposition,"Michael Janner, Jiajun Wu, Tejas D. Kulkarni, Ilker Yildirim, Josh Tenenbaum",None,https://proceedings.neurips.cc/paper_files/paper/2017/file/c8862fc1a32725712838863fb1a260b9-Paper.pdf
NeurIPS,2017,onthefly_operation_batching_in_dynamic_computation_graphs__1f395c7b.pdf,On-the-fly Operation Batching in Dynamic Computation Graphs,"Graham Neubig, Yoav Goldberg, Chris Dyer",None,https://proceedings.neurips.cc/paper_files/paper/2017/file/c902b497eb972281fb5b4e206db38ee6-Paper.pdf
NeurIPS,2017,fitting_lowrank_tensors_in_constant_time__a74fa0ef.pdf,Fitting Low-Rank Tensors in Constant Time,"Kohei Hayashi, Yuichi Yoshida",None,https://proceedings.neurips.cc/paper_files/paper/2017/file/c930eecd01935feef55942cc445f708f-Paper.pdf
NeurIPS,2017,random_projection_filter_bank_for_time_series_data__84c28ec3.pdf,Random Projection Filter Bank for Time Series Data,"Amir-massoud Farahmand, Sepideh Pourazarm, Daniel Nikovski",None,https://proceedings.neurips.cc/paper_files/paper/2017/file/ca3ec598002d2e7662e2ef4bdd58278b-Paper.pdf
NeurIPS,2017,dynamic_revenue_sharing__f06b8cee.pdf,Dynamic Revenue Sharing,"Santiago Balseiro, Max Lin, Vahab Mirrokni, Renato Leme, IIIS Song Zuo",None,https://proceedings.neurips.cc/paper_files/paper/2017/file/cb8acb1dc9821bf74e6ca9068032d623-Paper.pdf
NeurIPS,2017,prototypical_networks_for_fewshot_learning__60dc9d9b.pdf,Prototypical Networks for Few-shot Learning,"Jake Snell, Kevin Swersky, Richard Zemel",None,https://proceedings.neurips.cc/paper_files/paper/2017/file/cb8da6767461f2812ae4290eac7cbc42-Paper.pdf
NeurIPS,2017,unsupervised_learning_of_object_frames_by_dense_equivariant_image_labelling__4a130c74.pdf,Unsupervised learning of object frames by dense equivariant image labelling,"James Thewlis, Hakan Bilen, Andrea Vedaldi",None,https://proceedings.neurips.cc/paper_files/paper/2017/file/cbcb58ac2e496207586df2854b17995f-Paper.pdf
NeurIPS,2017,unified_representation_of_tractography_and_diffusionweighted_mri_data_using_sparse_multidimensional_arrays__2cb1057a.pdf,Unified representation of tractography and diffusion-weighted MRI data using sparse multidimensional arrays,"Cesar F. Caiafa, Olaf Sporns, Andrew Saykin, Franco Pestilli",None,https://proceedings.neurips.cc/paper_files/paper/2017/file/ccbd8ca962b80445df1f7f38c57759f0-Paper.pdf
NeurIPS,2017,random_permutation_online_isotonic_regression__2e7786b3.pdf,Random Permutation Online Isotonic Regression,"Wojciech Kotlowski, Wouter M. Koolen, Alan Malek",None,https://proceedings.neurips.cc/paper_files/paper/2017/file/cd3afef9b8b89558cd56638c3631868a-Paper.pdf
NeurIPS,2017,prune_preserving_proximity_and_global_ranking_for_network_embedding__7905e28c.pdf,PRUNE: Preserving Proximity and Global Ranking for Network Embedding,"Yi-An Lai, Chin-Chi Hsu, Wen Hao Chen, Mi-Yen Yeh, Shou-De Lin",None,https://proceedings.neurips.cc/paper_files/paper/2017/file/cdd96eedd7f695f4d61802f8105ba2b0-Paper.pdf
NeurIPS,2017,online_to_offline_conversions_universality_and_adaptive_minibatch_sizes__6b6fa251.pdf,"Online to Offline Conversions, Universality and Adaptive Minibatch Sizes",Kfir Levy,None,https://proceedings.neurips.cc/paper_files/paper/2017/file/ce5140df15d046a66883807d18d0264b-Paper.pdf
NeurIPS,2017,predicting_organic_reaction_outcomes_with_weisfeilerlehman_network__92a6cc4f.pdf,Predicting Organic Reaction Outcomes with Weisfeiler-Lehman Network,"Wengong Jin, Connor Coley, Regina Barzilay, Tommi Jaakkola",None,https://proceedings.neurips.cc/paper_files/paper/2017/file/ced556cd9f9c0c8315cfbe0744a3baf0-Paper.pdf
NeurIPS,2017,inferring_generative_model_structure_with_static_analysis__15b1f7c3.pdf,Inferring Generative Model Structure with Static Analysis,"Paroma Varma, Bryan D. He, Payal Bajaj, Nishith Khandwala, Imon Banerjee, Daniel Rubin, Christopher Ré",None,https://proceedings.neurips.cc/paper_files/paper/2017/file/cedebb6e872f539bef8c3f919874e9d7-Paper.pdf
NeurIPS,2017,influence_maximization_with_varepsilonalmost_submodular_threshold_functions__bdf778f0.pdf,Influence Maximization with $\varepsilon$-Almost Submodular Threshold Functions,"Qiang Li, Wei Chen, Institute of Computing Xiaoming Sun, Institute of Computing Jialin Zhang",None,https://proceedings.neurips.cc/paper_files/paper/2017/file/cf2226ddd41b1a2d0ae51dab54d32c36-Paper.pdf
NeurIPS,2017,improved_dynamic_regret_for_nondegenerate_functions__30c34604.pdf,Improved Dynamic Regret for Non-degenerate Functions,"Lijun Zhang, Tianbao Yang, Jinfeng Yi, Rong Jin, Zhi-Hua Zhou",None,https://proceedings.neurips.cc/paper_files/paper/2017/file/cfee398643cbc3dc5eefc89334cacdc1-Paper.pdf
NeurIPS,2017,adagan_boosting_generative_models__450992f5.pdf,AdaGAN: Boosting Generative Models,"Ilya O. Tolstikhin, Sylvain Gelly, Olivier Bousquet, Carl-Johann SIMON-GABRIEL, Bernhard Schölkopf",None,https://proceedings.neurips.cc/paper_files/paper/2017/file/d0010a6f34908640a4a6da2389772a78-Paper.pdf
NeurIPS,2017,largescale_quadratically_constrained_quadratic_program_via_lowdiscrepancy_sequences__d2b5b79d.pdf,Large-Scale Quadratically Constrained Quadratic Program via Low-Discrepancy Sequences,"Kinjal Basu, Ankan Saha, Shaunak Chatterjee",None,https://proceedings.neurips.cc/paper_files/paper/2017/file/d10ec7c16cbe9de8fbb1c42787c3ec26-Paper.pdf
NeurIPS,2017,graph_matching_via_multiplicative_update_algorithm__17975936.pdf,Graph Matching via Multiplicative Update Algorithm,"Bo Jiang, Jin Tang, Chris Ding, Yihong Gong, Bin Luo",None,https://proceedings.neurips.cc/paper_files/paper/2017/file/d1e946f4e67db4b362ad23818a6fb78a-Paper.pdf
NeurIPS,2017,neural_expectation_maximization__77776040.pdf,Neural Expectation Maximization,"Klaus Greff, Sjoerd van Steenkiste, Jürgen Schmidhuber",None,https://proceedings.neurips.cc/paper_files/paper/2017/file/d2cd33e9c0236a8c2d8bd3fa91ad3acf-Paper.pdf
NeurIPS,2017,hunt_for_the_unique_stable_sparse_and_fast_feature_learning_on_graphs__f636ea84.pdf,"Hunt For The Unique, Stable, Sparse And Fast Feature Learning On Graphs","Saurabh Verma, Zhi-Li Zhang",None,https://proceedings.neurips.cc/paper_files/paper/2017/file/d2ddea18f00665ce8623e36bd4e3c7c5-Paper.pdf
NeurIPS,2017,expectation_propagation_with_stochastic_kinetic_model_in_complex_interaction_systems__7687dcfc.pdf,Expectation Propagation with Stochastic Kinetic Model in Complex Interaction Systems,"Le Fang, Fan Yang, Wen Dong, Tong Guan, Chunming Qiao",None,https://proceedings.neurips.cc/paper_files/paper/2017/file/d38901788c533e8286cb6400b40b386d-Paper.pdf
NeurIPS,2017,welfare_guarantees_from_data__a19f8c05.pdf,Welfare Guarantees from Data,"Darrell Hoy, Denis Nekipelov, Vasilis Syrgkanis",None,https://proceedings.neurips.cc/paper_files/paper/2017/file/d3a7f48c12e697d50c8a7ae7684644ef-Paper.pdf
NeurIPS,2017,semisupervised_learning_with_gans_manifold_invariance_with_improved_inference__a28e1478.pdf,Semi-supervised Learning with GANs: Manifold Invariance with Improved Inference,"Abhishek Kumar, Prasanna Sattigeri, Tom Fletcher",None,https://proceedings.neurips.cc/paper_files/paper/2017/file/d3d80b656929a5bc0fa34381bf42fbdd-Paper.pdf
NeurIPS,2017,houdini_fooling_deep_structured_visual_and_speech_recognition_models_with_adversarial_examples__684c426e.pdf,Houdini: Fooling Deep Structured Visual and Speech Recognition Models with Adversarial Examples,"Moustapha M. Cisse, Yossi Adi, Natalia Neverova, Joseph Keshet",None,https://proceedings.neurips.cc/paper_files/paper/2017/file/d494020ff8ec181ef98ed97ac3f25453-Paper.pdf
NeurIPS,2017,clustering_stable_instances_of_euclidean_kmeans__a46c43c7.pdf,Clustering Stable Instances of Euclidean k-means.,"Aravindan Vijayaraghavan, Abhratanu Dutta, Alex Wang",None,https://proceedings.neurips.cc/paper_files/paper/2017/file/d54ce9de9df77c579775a7b6b1a4bdc0-Paper.pdf
NeurIPS,2017,attend_and_predict_understanding_gene_regulation_by_selective_attention_on_chromatin__d472c11b.pdf,Attend and Predict: Understanding Gene Regulation by Selective Attention on Chromatin,"Ritambhara Singh, Jack Lanchantin, Arshdeep Sekhon, Yanjun Qi",None,https://proceedings.neurips.cc/paper_files/paper/2017/file/d594b1a945b5d645e59e21f88bd2d83b-Paper.pdf
NeurIPS,2017,deep_reinforcement_learning_from_human_preferences__a5d5ce11.pdf,Deep Reinforcement Learning from Human Preferences,"Paul F. Christiano, Jan Leike, Tom Brown, Miljan Martic, Shane Legg, Dario Amodei",None,https://proceedings.neurips.cc/paper_files/paper/2017/file/d5e2c0adad503c91f91df240d0cd4e49-Paper.pdf
NeurIPS,2017,subset_selection_under_noise__0033de6a.pdf,Subset Selection under Noise,"Chao Qian, Jing-Cheng Shi, Yang Yu, Ke Tang, Zhi-Hua Zhou",None,https://proceedings.neurips.cc/paper_files/paper/2017/file/d7a84628c025d30f7b2c52c958767e76-Paper.pdf
NeurIPS,2017,pointnet_deep_hierarchical_feature_learning_on_point_sets_in_a_metric_space__e5096597.pdf,PointNet++: Deep Hierarchical Feature Learning on Point Sets in a Metric Space,"Charles Ruizhongtai Qi, Li Yi, Hao Su, Leonidas J. Guibas",None,https://proceedings.neurips.cc/paper_files/paper/2017/file/d8bf84be3800d12f74d8b05e9b89836f-Paper.pdf
NeurIPS,2017,approximation_bounds_for_hierarchical_clustering_average_linkage_bisecting_kmeans_and_local_search__a098948e.pdf,"Approximation Bounds for Hierarchical Clustering: Average Linkage, Bisecting K-means, and Local Search","Benjamin Moseley, Joshua Wang",None,https://proceedings.neurips.cc/paper_files/paper/2017/file/d8d31bd778da8bdd536187c36e48892b-Paper.pdf
NeurIPS,2017,thinking_fast_and_slow_with_deep_learning_and_tree_search__23d4460e.pdf,Thinking Fast and Slow with Deep Learning and Tree Search,"Thomas Anthony, Zheng Tian, David Barber",None,https://proceedings.neurips.cc/paper_files/paper/2017/file/d8e1344e27a5b08cdfd5d027d9b8d6de-Paper.pdf
NeurIPS,2017,learning_combinatorial_optimization_algorithms_over_graphs__5bbedb82.pdf,Learning Combinatorial Optimization Algorithms over Graphs,"Elias Khalil, Hanjun Dai, Yuyu Zhang, Bistra Dilkina, Le Song",None,https://proceedings.neurips.cc/paper_files/paper/2017/file/d9896106ca98d3d05b8cbdf4fd8b13a1-Paper.pdf
NeurIPS,2017,resurrecting_the_sigmoid_in_deep_learning_through_dynamical_isometry_theory_and_practice__17559145.pdf,Resurrecting the sigmoid in deep learning through dynamical isometry: theory and practice,"Jeffrey Pennington, Samuel Schoenholz, Surya Ganguli",None,https://proceedings.neurips.cc/paper_files/paper/2017/file/d9fc0cdb67638d50f411432d0d41d0ba-Paper.pdf
NeurIPS,2017,adaptive_classification_for_prediction_under_a_budget__4e45aee8.pdf,Adaptive Classification for Prediction Under a Budget,"Feng Nan, Venkatesh Saligrama",None,https://proceedings.neurips.cc/paper_files/paper/2017/file/d9ff90f4000eacd3a6c9cb27f78994cf-Paper.pdf
NeurIPS,2017,online_convex_optimization_with_stochastic_constraints__e1fa1bfd.pdf,Online Convex Optimization with Stochastic Constraints,"Hao Yu, Michael Neely, Xiaohan Wei",None,https://proceedings.neurips.cc/paper_files/paper/2017/file/da0d1111d2dc5d489242e60ebcbaf988-Paper.pdf
NeurIPS,2017,structured_bayesian_pruning_via_lognormal_multiplicative_noise__67c386c6.pdf,Structured Bayesian Pruning via Log-Normal Multiplicative Noise,"Kirill Neklyudov, Dmitry Molchanov, Arsenii Ashukha, Dmitry P. Vetrov",None,https://proceedings.neurips.cc/paper_files/paper/2017/file/dab49080d80c724aad5ebf158d63df41-Paper.pdf
NeurIPS,2017,clustering_with_noisy_queries__075c74a5.pdf,Clustering with Noisy Queries,"Arya Mazumdar, Barna Saha",None,https://proceedings.neurips.cc/paper_files/paper/2017/file/db5cea26ca37aa09e5365f3e7f5dd9eb-Paper.pdf
NeurIPS,2017,compressionaware_training_of_deep_networks__7cfb94d1.pdf,Compression-aware Training of Deep Networks,"Jose M. Alvarez, Mathieu Salzmann",None,https://proceedings.neurips.cc/paper_files/paper/2017/file/db85e2590b6109813dafa101ceb2faeb-Paper.pdf
NeurIPS,2017,maxing_and_ranking_with_few_assumptions__eeac6397.pdf,Maxing and Ranking with Few Assumptions,"Moein Falahatgar, Yi Hao, Alon Orlitsky, Venkatadheeraj Pichapati, Vaishakh Ravindrakumar",None,https://proceedings.neurips.cc/paper_files/paper/2017/file/db98dc0dbafde48e8f74c0de001d35e4-Paper.pdf
NeurIPS,2017,subspace_clustering_via_tangent_cones__f8a099e1.pdf,Subspace Clustering via Tangent Cones,"Amin Jalali, Rebecca Willett",None,https://proceedings.neurips.cc/paper_files/paper/2017/file/dbb422937d7ff56e049d61da730b3e11-Paper.pdf
NeurIPS,2017,dropoutnet_addressing_cold_start_in_recommender_systems__e121d7ba.pdf,DropoutNet: Addressing Cold Start in Recommender Systems,"Maksims Volkovs, Guangwei Yu, Tomi Poutanen",None,https://proceedings.neurips.cc/paper_files/paper/2017/file/dbd22ba3bd0df8f385bdac3e9f8be207-Paper.pdf
NeurIPS,2017,unsupervised_imagetoimage_translation_networks__59cc3dcc.pdf,Unsupervised Image-to-Image Translation Networks,"Ming-Yu Liu, Thomas Breuel, Jan Kautz",None,https://proceedings.neurips.cc/paper_files/paper/2017/file/dc6a6489640ca02b0d42dabeb8e46bb7-Paper.pdf
NeurIPS,2017,svcca_singular_vector_canonical_correlation_analysis_for_deep_learning_dynamics_and_interpretability__e5984506.pdf,SVCCA: Singular Vector Canonical Correlation Analysis for Deep Learning Dynamics and Interpretability,"Maithra Raghu, Justin Gilmer, Jason Yosinski, Jascha Sohl-Dickstein",None,https://proceedings.neurips.cc/paper_files/paper/2017/file/dc6a7e655d7e5840e66733e9ee67cc69-Paper.pdf
NeurIPS,2017,fast_rates_for_bandit_optimization_with_upperconfidence_frankwolfe__7c944078.pdf,Fast Rates for Bandit Optimization with Upper-Confidence Frank-Wolfe,"Quentin Berthet, Vianney Perchet",None,https://proceedings.neurips.cc/paper_files/paper/2017/file/dc960c46c38bd16e953d97cdeefdbc68-Paper.pdf
NeurIPS,2017,identifying_outlier_arms_in_multiarmed_bandit__72cf8e37.pdf,Identifying Outlier Arms in Multi-Armed Bandit,"Honglei Zhuang, Chi Wang, Yifan Wang",None,https://proceedings.neurips.cc/paper_files/paper/2017/file/dcda54e29207294d8e7e1b537338b1c0-Paper.pdf
NeurIPS,2017,discovering_potential_correlations_via_hypercontractivity__f82752f7.pdf,Discovering Potential Correlations via Hypercontractivity,"Hyeji Kim, Weihao Gao, Sreeram Kannan, Sewoong Oh, Pramod Viswanath",None,https://proceedings.neurips.cc/paper_files/paper/2017/file/dcf6070a4ab7f3afbfd2809173e0824b-Paper.pdf
NeurIPS,2017,a_dirichlet_mixture_model_of_hawkes_processes_for_event_sequence_clustering__5e057836.pdf,A Dirichlet Mixture Model of Hawkes Processes for Event Sequence Clustering,"Hongteng Xu, Hongyuan Zha",None,https://proceedings.neurips.cc/paper_files/paper/2017/file/dd8eb9f23fbd362da0e3f4e70b878c16-Paper.pdf
NeurIPS,2017,efficient_approximation_algorithms_for_strings_kernel_based_sequence_classification__ed7f677e.pdf,Efficient Approximation Algorithms for Strings Kernel Based Sequence Classification,"Muhammad Farhan, Juvaria Tariq, Arif Zaman, Mudassir Shabbir, Imdad Ullah Khan",None,https://proceedings.neurips.cc/paper_files/paper/2017/file/ddcbe25988981920c872c1787382f04d-Paper.pdf
NeurIPS,2017,multioutput_polynomial_networks_and_factorization_machines__b4d5e6c1.pdf,Multi-output Polynomial Networks and Factorization Machines,"Mathieu Blondel, Vlad Niculae, Takuma Otsuka, Naonori Ueda",None,https://proceedings.neurips.cc/paper_files/paper/2017/file/dea9ddb25cbf2352cf4dec30222a02a5-Paper.pdf
NeurIPS,2017,tractability_in_structured_probability_spaces__e39f82df.pdf,Tractability in Structured Probability Spaces,"Arthur Choi, Yujia Shen, Adnan Darwiche",None,https://proceedings.neurips.cc/paper_files/paper/2017/file/deb54ffb41e085fd7f69a75b6359c989-Paper.pdf
NeurIPS,2017,practical_bayesian_optimization_for_model_fitting_with_bayesian_adaptive_direct_search__879c773f.pdf,Practical Bayesian Optimization for Model Fitting with Bayesian Adaptive Direct Search,"Luigi Acerbi, Wei Ji Ma",None,https://proceedings.neurips.cc/paper_files/paper/2017/file/df0aab058ce179e4f7ab135ed4e641a9-Paper.pdf
